product,verified,rating,date,author,content,title
Google - Nest Wifi AC2200 Router - Snow,1,5,23 May 2020,gmak,"with everyone home the wifi was being bogged down and 12 years old router didnt help either. easy setup, thought was pricey but many other nest items at home been solid and like the ability to expand if needed.",so far so good
Google - Nest Wifi AC2200 Router - Snow,1,5,23 Jul 2020,David360,This router was incredibly easy to setup and the transition from my previous setup was flawless. I've never had a more stable connection.,Best Router I've ever owned
Google - Nest Wifi AC2200 Router - Snow,1,5,23 Jun 2020,max09,We got this to extend the mesh network in our house and boy it connects seemlessly to our existing router and the existing Google wifi mesh network. Highly recommend,Great Base Router
Google - Nest Wifi AC2200 Router - Snow,1,5,23 Aug 2020,dardar,"A great ""buy"" from Best Buy"" ! East set up! Affordable and works great! You need this for your nest!","Your nest needs this ""Nest""!"
Google - Nest Wifi AC2200 Router - Snow,1,4,23 Sep 2020,Tazz,"This router worked good, but it didn’t seem real compatible with the internet I had.",It wasn’t bad for the internet we had.
Google - Nest Wifi AC2200 Router - Snow,1,5,23 Jul 2020,Keng,Very happy with this unit with all the extra money I spent on net gear and extenders this unit does it all,Super WiFi
Google - Nest Wifi AC2200 Router - Snow,1,5,23 Aug 2020,Liquidforse,one of the best purchases i made from best buy. Def worth the money.,Love it!
Google - Nest Wifi AC2200 Router - Snow,1,5,23 Aug 2020,Jimcas43,We have a couple of these now & really help the internet work in our big old house ;),Great to extend internet
Google - Nest Wifi AC2200 Router - Snow,1,5,23 Jan 2020,Tomash,I upgraded my Gen1 TP-Link OnHub router with the new Gen3 Nest Wifi and while I expected it to be just as easy to manage and use. I was not expecting the dramatic performance increase I got when switching to the new router.  My wireless speeds are easily double what I was getting previously.,Works even better than I expected
Google - Nest Wifi AC2200 Router - Snow,1,5,23 Jul 2020,Joey,"Had the first generation of Google WiFi, and these paired seemlessly with them. Just make sure the router is the main unit.",Just Works
Google - Nest Wifi AC2200 Router - Snow,1,4,23 Jun 2020,guarddog13,"Performance wise this is a great router, especially with an ethernet backhaul and another router. I returned it because I need more customization than Google allows.",Not Bad
Google - Nest Wifi AC2200 Router - Snow,1,5,23 Jan 2020,plporter,"It easily connected all my nest products but one smoke detector, while my previous router struggled and I spent hours and hours trying to connect all my devices.

It also put my children on a separate subnet so if they get a virus it doesn't affect my computer's.","It did exactly what I wanted, easily connected all"
Google - Nest Wifi AC2200 Router - Snow,1,5,23 Apr 2020,shellyfresh,Love this router - started working from home recently and this has absolutely helped me ensure I have a strong internet connection anywhere within my house! Highly recommend!,Works great!
Google - Nest Wifi AC2200 Router - Snow,1,5,23 Mar 2020,Hakari,"Google really makes my wifi experience like never before. It doesn't matter you have Cincinnati Bell Fioptics or Spectrum Cable, both work great for streaming TV, games and music all at the same time.",Best wifi router
Google - Nest Wifi AC2200 Router - Snow,1,5,23 Jan 2020,Nick,I purchased this router on a whim because my old Linksys router crapped out and the Google router blew it out of the water this router maximize my speed for Google Fiber I am paying for a gig up and down and I’m getting a gig up and down through Wi-Fi,Best router I’ve purchased
Google - Nest Wifi AC2200 Router - Snow,1,5,23 Aug 2020,Tashy1,I have noticed a big difference in my WiFi  since buying this !,Great Product!
Google - Nest Wifi AC2200 Router - Snow,1,5,23 Jul 2020,bbcardfan1998,The router has made it easier for me to mange my service and control who ever is using it.,Quality internet
Google - Nest Wifi AC2200 Router - Snow,1,5,23 Aug 2020,stalwil,This is exactly what I needed for what I’m using it for.,Perfect routers
Google - Nest Wifi AC2200 Router - Snow,1,5,23 Dec 2019,Babbs,The router is excellent. Instructions walked me right thru setup. Would recommend. Highly.,Easy set
Google - Nest Wifi AC2200 Router - Snow,1,5,23 Jul 2020,Jaystan,First time picking up a mesh WiFi system and the extender works as advertised!,Great quality
Google - Nest Wifi AC2200 Router - Snow,1,5,23 Sep 2020,Gary,I had google Wifi and for the most part it worked pretty good. I would occasionally lose connection on the far side Camera. I installed the new Nest Router and used the 2 Google Wifi as points. I can't begin to tell you how good it works now. No issues what so ever.,I can't believe it.
Google - Nest Wifi AC2200 Router - Snow,1,5,23 Oct 2020,BLemus,Bought this and immediately understood the use case. This type of router is for a small apartment or even for a smaller home. Gives you the consistent performance of having google automatic updates and great DNS performance!,Great for a studio apartment
Google - Nest Wifi AC2200 Router - Snow,1,5,18 Nov 2020,DotJ,"Works excellent! 
Great buy. Had trouble getting WiFi in other rooms of house.
This router solved that!",WiFi router
Google - Nest Wifi AC2200 Router - Snow,1,5,23 Nov 2019,osof,do not get the google wifi points to extend your wifi get the router instead. Especially if you have ethernet in your home.,Router is the way to go
Google - Nest Wifi AC2200 Router - Snow,1,5,23 Nov 2018,Rickycaraz,"Excellent product, Google does it again. This router is very easy to set up and operate. Never fails and signal is super strong.",Excellent Router
Google - Nest Wifi AC2200 Router - Snow,1,5,23 Nov 2019,HCHC,"Fantastic router. Easy to setup, and easy to manage. Makes me wish I had invested in a more modern router sooner.",Fantastic.
Google - Nest Wifi AC2200 Router - Snow,1,5,23 Nov 2018,Chanjoe,Purchase to extend our original google mesh network. Works great and we notice the increase in speed with our original network.,Quality Google product
Google - Nest Wifi AC2200 Router - Snow,1,5,23 Aug 2020,Humberto,"I was looking for a router outside of the one provided by the ISP, after switching I could experience better (stable and stronger) signal an even hitting easily higher speeds.
The  integration of WPA3 is a good feature, the esthetics is really good to be placed anywhere without taking too much space.",Best overall
Google - Nest Wifi AC2200 Router - Snow,1,5,22 Nov 2020,wquiceno6,"Easy to setup, blends right in with furniture with sleek, professional look and feel",Love it
Google - Nest Wifi AC2200 Router - Snow,1,5,18 Nov 2020,jason,Easy to set up and integrates flawlessly with other Google products in my home.,Great router
Google - Nest Wifi AC2200 Router - Snow,1,5,23 Mar 2020,QueDub,"Setup and reconnecting after a power outage or isp disruption can be a pain the the butt; however, once up and running you can’t beat Google Nest!  The mesh network technology allows our 30+ devices to connect and stay connected to our in a multi story home covering 3500 sf ft.  I added the AC2200 router  to replace a stand alone router and to seamlessly connect my existing (3) AC1200 1st generation mesh network.  Prior to google nest our devices struggled to get the right bandwidth to function as expected even after increasing internet speeds to highest available in market.",All about our NEST WiFi
Google - Nest Wifi AC2200 Router - Snow,1,5,19 Nov 2020,Leeman,"Best Mash Wifi Router. 
Range is wide, easy to use with app and configure.",Simply the best
Google - Nest Wifi AC2200 Router - Snow,1,4,23 Nov 2018,HER0,"I really like this router, the speeds are good but I'm excited for Google to release a WiFi 6 Mesh Router. Once they do then I will be upgrading!",Like it but can't wait for Google WiFi 6 Mesh Rout
Google - Nest Wifi AC2200 Router - Snow,1,4,22 Nov 2020,Google,"Does exactly what it says and more! brought it to have more control over mine WIFI, still checking it out.",Goo WIFI
Google - Nest Wifi AC2200 Router - Snow,1,5,23 Nov 2019,Arpan,This is one of the best routers I have seen.. it’s excellent and easy to install and use...,Best Router
Google - Nest Wifi AC2200 Router - Snow,1,5,23 Oct 2020,pvidal,"Love it I was able to integrate it to my google Wifi with ease 

the Google Home app is a great improvement over teh original google wifi",Great product improvement
Google - Nest Wifi AC2200 Router - Snow,1,5,23 May 2020,Cmos,"I have 200 mbps from spectrum, the wifi modem they provided is just sad. I bought this and once I set it up I went from having 15 mbps in my upstairs to having 160 mbps. 

Only thing, the setup was a little slow. I do wish it was more plug n play, but none the less it was worth it.",Just Awesome!!!!
Google - Nest Wifi AC2200 Router - Snow,1,4,23 Nov 2018,MarsMarshall,"No major issues and reliable wifi for the most part, but only has one out ethernet port. Would have liked more ports and gave it a 4",Great router
Google - Nest Wifi AC2200 Router - Snow,1,5,23 Jun 2020,Arthur,"I upgraded from Google's original Google Wifi router to this one, but kept the other devices to use as I was told it was backwards compatible. It turns out that it is compatible, but you'd better be sure to do everything in the correct order! I added  some time and anxiety onto my upgrade by not resetting my previous access points back to factory status before adding this as my new, main router.",so far so good
Google - Nest Wifi AC2200 Router - Snow,1,5,23 Dec 2019,BobM,The Google Nest router was the closest to plug-and-play I've ever seen. Downloading a mobile app and walking through the process just took a couple of minutes. I'm seeing close to 300 Mbps wirelessly from my 300 fiberoptic provider. I see between 200 and 300 in a back bedroom where the signal goes through two interior walls. I've discovered that going through brick doesn't work well. I needed to reposition the router around a brick wall that was part of a fireplace.,User-friendly startup
Google - Nest Wifi AC2200 Router - Snow,1,5,23 Aug 2020,Sudevan,This is my first google product and I was surprised by the quality. Really good app and never had any complaint. I bought just one and I recommend to buy the pair as it need to be placed in different room.,Surprised by the quality
Google - Nest Wifi AC2200 Router - Snow,1,5,23 Aug 2020,Parv,"Great Product by Google, having awesome rang of wifi",Great Product by Google
Google - Nest Wifi AC2200 Router - Snow,1,5,23 Sep 2020,bowdette,"I wouldn’t really call it an accessory at this point as we rely on it so much! It helps take off the workload on the modem (which I turned the wi-fi off of). All of us here in the house have our own TVs and when we watch all the time, if not for this, it would have been a pixelated experience. I honestly love this thing. It makes my life easier, and for all the family as well. My little sister now has to have class all day and while she does it online, I can watch and not bother her connection. I’ve noticed that the max mbps for each device is about 17mbps which is very much enough for what each of us here deserve the first time around. I’m less angry at our local internet service because without this, the experience with them will continue despite our hate with it.

Now there are additional accessories to further extend the wifi but our little one story house is enough for just this wifi router. If you have a bigger home, and many more users (more than 6 people like us) spread out, you can test if this one router can reach anyone without a problem. For gamers, I think the ethernet is your best bet if you do PC gaming. But for console gaming, I do not find it bothersome as the constant fast connection is enough.","Even at 25 mbps, it’s much needed accessory"
Google - Nest Wifi AC2200 Router - Snow,1,5,23 Aug 2020,Dougsab,It is a bit pricey but you get a lot. The fact that the extenders are also google speakers is a fantastic bonus. As with all smart speakers they have a hardwire switch to turn the speaker and mike off.,does what it's mean to do very well
Google - Nest Wifi AC2200 Router - Snow,1,5,23 Jun 2020,TheCounselor,"I had the older Google wifi and for some reason my house just won't get good signals in the bedrooms. So I finally gave in and added another. I had to call google tech support to set this one up as the primary and move the older one to another room, but they were extremely helpful!",Perfect for my needs
Google - Nest Wifi AC2200 Router - Snow,1,5,23 Oct 2020,Venkman,Great upgrade from the Google wifi. Perfect if you need a new router,New router
Google - Nest Wifi AC2200 Router - Snow,1,5,23 Sep 2020,mellisa,the router is very useful went from not one could do the homework online to all 7 kids being online at the same time,excellent
Google - Nest Wifi AC2200 Router - Snow,1,5,23 Nov 2017,janferr,Works great! Keeps all my devices running smoothly.,Best router
Google - Nest Wifi AC2200 Router - Snow,1,5,23 Jul 2020,catdaddy2300,"The set up took a little longer than I hoped, but once that was complete the router works as well as advertised.  I can still stream a movie on my computer while the router in on the other side of the house separated by a wall",It works well
Google - Nest Wifi AC2200 Router - Snow,1,5,23 Sep 2020,Amujkic,Amazing product! I bought it to replace the spectrum router which we all know sucks. You won't regret buying this router!,"It works great, worth everything penny!"
Google - Nest Wifi AC2200 Router - Snow,1,5,23 May 2020,AlexD,"My Netgear router failed in less than 2 months and they still have not refunded or replaced it. Expensive piece of junk. So I went with the Google Nest router and I'm glad I did. Unlike the Netgear router I had a no-hassle set up using the Google Home app and now get ""blazing fast connections."" And it looks nice on my table!",Very Solid Router
Google - Nest Wifi AC2200 Router - Snow,1,5,23 Oct 2020,Twell,"Awesome mesh wifi system, works great! Small footpri t, works with old google points too.",Works great
Google - Nest Wifi AC2200 Router - Snow,1,5,23 Aug 2020,venu,you won’t regret it. one of the best interms of 1) setup 2) ease of use 3) coverage 4) parental and device controls + scheduling 5) adv networking flexibility,best mesh network out there
Google - Nest Wifi AC2200 Router - Snow,1,5,23 Sep 2020,JJ664,Upgraded from Google Wi-Fi to this nest Wi-Fi works great and best part I can use my Google Wi-Fi as beacons,Good upgrade
Google - Nest Wifi AC2200 Router - Snow,1,5,23 Jul 2020,Lelandw,"The newest version of the Google Wifi node has finally enabled me to extend my Wifi zone past a rock wall. Increased a weak signal to max! Although I am not a big fan of Google, their products seem to work as advertised.",Best Wifi by far!
Google - Nest Wifi AC2200 Router - Snow,1,4,23 May 2020,McScruffy,"Bought a second Nest router to boost 5Ghz signal at the back of the house and back yard as well as to act as a wireless bridge for my PS4 Pro which is known to have unreliable wifi.  The Point access points do not have this capability which is why I went with a second router for the mesh system.

Setup, like with my main one I bought around Christmas, was extremely easy and straightforward.  The Google Home app handles the majority of the work for you and there are only a few steps which are clear and simple.

With the mesh system in place, between these two routers I have excellent 5Ghz signal and throughput throughout my 7000+ sq ft lot (and beyond).  I've yet to notice any drop when switching between the two streaming video on my phone or doing anything else, so it's about as seamless as I could ask for.

My main complaint is that in the process of Google making the mesh system so easy to set up, they've made it too simple for people like me who like to be able to customize the network(s) to a higher degree.  There is very little you can actually do with your network once set up, but you are able to see the devices connected, test the throughput between the device and the mesh system, and set a priority device for a specified amount of time.

You have no control over the IPs assigned and subnet settings, cannot place devices in a DMZ, or have the mesh set up as a gateway VPN for privacy.  The only option with the latter is to have VPN clients on the individual devices you are connecting with which I have done but it does create many more steps than just having the gateway connection perform this task.

Overall I'm still very happy with the system and all of my complaints are on the software side so it is possible Google could add these features down the road, though I doubt it.",Great mesh system with a minor complaint or two
Google - Nest Wifi AC2200 Router - Snow,1,5,23 Apr 2020,skeller19,"Just what I needed to improve my signal strength and keep all my smart home devices connected. I recommend this to everyone. All the routers provided by your ISPs are trash, this should be the standard.",Perfect
Google - Nest Wifi AC2200 Router - Snow,1,5,23 Aug 2020,Pastorclw,We have the original pucks that have worked well. This doubled our speed and increased the range. Bonus: easily works with existing pucks.,Big improvement!
Google - Nest Wifi AC2200 Router - Snow,1,1,23 Nov 2019,deranger,"Despite all the advances this is supposed to have over an older Google Wifi, it was unable to maintain anywhere near gigabit speeds on a wired network. I pay for gigabit internet and regularly test my bandwidth at 930-950 Mbps using my old Google WiFi and a Netgear switch.

When I replaced the Google WiFi with the Nest WiFi, I immediately began to run network tests to ensure everything was set correctly. However, bandwidth tests would rarely top 400 Mbps, typically settling around 330-350 Mbps. Running Google's built in bandwidth showed 800 Mbps, but running multiple bandwidth tests wired directly to the Nest Wifi by themselves, trying over ten different ethernet cables, and factory resetting numerous times always resulted in the Nest WiFi limiting bandwidth,

I replaced it with the old Google WiFi and it's back to repeatable bandwidth tests of ~940 Mbps, regardless of direct connection or through a Netgear switch.

Don't beta test products for companies, this could be good after some firmware updates, I hope.",Buy a Google Wifi instead
Google - Nest Wifi AC2200 Router - Snow,1,5,23 Sep 2020,Craig,Knowledgeable salesman recommended this for better streaming vs. standard Spectrum router,Better router
Google - Nest Wifi AC2200 Router - Snow,1,5,23 Aug 2020,Matt,The google WiFi and router all in one is great.  We didn’t need an extender and the streaming throughout the house is amazing.,Amazing router
Google - Nest Wifi AC2200 Router - Snow,1,5,23 Jul 2020,DonB,"Excellent product, and very good service at the Braintree, MA store",new Wifi router
Google - Nest Wifi AC2200 Router - Snow,1,5,23 May 2020,Lovegoogle,My internet was sooo slow. I swit hed to the Google router and I can not believe how much faster everything runs.,router
Google - Nest Wifi AC2200 Router - Snow,1,5,23 Jul 2020,herbie,I like it so far.  hopefully it will last longer than my last router did,so far so good
Google - Nest Wifi AC2200 Router - Snow,1,5,23 Apr 2020,aktchicago,"My old router couldn't handle the bandwidth when we started working and learning from home, and the Google Nest was a great improvement.",Works great!
Google - Nest Wifi AC2200 Router - Snow,1,5,23 May 2020,maukro,"I bought this Google - Nest Wifi AC2200 Router for my friend's apartment. He purchased the slowest internet speed available from his ISP in order to keep his costs down, but he consequently had a few issues with his network as a result. I have the older style Google Wifi devices in my own home and I love them! They gave me fast, reliable connections to numerous devices in every room of my house. Since the older style Google Wifi access points are no longer available, I purchased this latest Google Wifi product instead. I installed it in my friend's apartment, and it solved several problems! His internet is faster on all of our devices. His Sling TV streams better on his Samsung 2019 smart TV. The wireless internet connection between his 2019 HP printer and his very old Mac desktop, old MacBook Air, and iPad are completely glitch free now, and his HP printer's response time has massively improved to downright awesome! This Google Nest Wifi has made a big difference in his network's internet performance! It was a snap to set it up. I'm very pleased.",It Fixed Issues in My Friend's Apartment
Google - Nest Wifi AC2200 Router - Snow,1,5,23 Jan 2020,MooseMadeULoose,"This system is amazing. On router covers what I needed three pucks to cover with the previous version. Throughput is great and doesn’t get hot. A lot of people complain because it not Wifi 6 but, that has no affect on me.",Excellent buy
Google - Nest Wifi AC2200 Router - Snow,1,5,23 Jul 2020,JimC,Worth every penny.  Lots of features and no issues so far.,Excellent
Google - Nest Wifi AC2200 Router - Snow,1,4,23 Jul 2020,Sage,It's not the best but it gets the job done. Just a good price for a good router.,Good for price
Google - Nest Wifi AC2200 Router - Snow,1,5,23 May 2020,CHARLIE,This little router is truly what we all need. Just the look and performance out ways all other competitions in its class.,Just stunning on the out come.
Google - Nest Wifi AC2200 Router - Snow,1,5,23 Dec 2019,Michael,This router allows me to easily manage and troubleshoot my network wifi.,I really enjoy the simplicity and ease of use
Google - Nest Wifi AC2200 Router - Snow,1,5,23 Jul 2020,rob1,great product great service always have product in stock.,great
Google - Nest Wifi AC2200 Router - Snow,1,4,23 May 2020,Sonn,It’s great confusing at first but after you figure out that you must use the google home app instead of thee google WiFi app it’s a breeze,You will get it
Google - Nest Wifi AC2200 Router - Snow,1,5,23 Jan 2020,Fire19,"Now that i have switched to google nest wifi i haven't had 1 dropped signal while at home or any connection issues at all! 

Only negative thing is that it only have 1 outgoing ethernet port.",Best wifi router i have had to date.
Google - Nest Wifi AC2200 Router - Snow,1,4,23 May 2020,gkkim,"A bit weird to have to use the google home app to replace the existing Google Wifi, but works like before with a bit better signal.",Solid Improvement
Google - Nest Wifi AC2200 Router - Snow,1,5,23 Jun 2020,Mama1,"We were needing more wifi power outdoor on the deck, and this router gets the job done!",Works well!
Google - Nest Wifi AC2200 Router - Snow,1,4,23 Feb 2020,WigginsPlay,I definitely have WiFi but as of right now don’t really see a difference between my original router and this new one.  I purchased because of the reviews so I’m hoping after more exploring this nest will work better.,"Ok, but not what I was expecting"
Google - Nest Wifi AC2200 Router - Snow,1,3,23 Oct 2020,CASS,"Does ok but it does not really strengthen your signal much as it has to be plugged into your router. Use a real extender, if that is what you need",Does Ok
Google - Nest Wifi AC2200 Router - Snow,1,5,23 May 2020,Momoney,"I have all smart google things in my home like the google home, the minis, nest cam, and also a bunch of to link Kasa light switches. 

I have a three story home and my netgear for some odd reason was having trouble with all my google speakers. None of the google speakers would connect to the WiFi, kept getting an error about not being on the same WiFi network which I clearly was on. 

So I said forget this let me go buy a google WiFi and it has to work. Bought this bad boy, setup the WiFi in a few minutes boom! Everything connected with ease and even got a stronger signal throughout the house with faster download speeds.",Great router
Google - Nest Wifi AC2200 Router - Snow,1,3,23 Oct 2020,AD1234,bought to improve mesh network in a room that struggles with signal.  it improved it slightly.  not as much as i expected.  not sure why or if i did something wrong,not as good as i hoped
Google - Nest Wifi AC2200 Router - Snow,1,5,23 Apr 2020,TechJunkie,So I took a long time to come around to trying agoogle Nest wifi but a tight budget forced my hand.  I am pretty satisfied with the performance and with the ability it has to handle 4k streeming along side keeping my smartphone online and functioning.  Just to give you an example I currently have 95 devices on my network I neverhavea slowdown when streaming music or 4k video. For the price range I think this is a great value. Oh and a huge + was that I was able to integrate my old Google WiFi with the Google NestWiFi I did not have to purchase additional access points witch was very nice.,"solid wifi, backward compatable"
Google - Nest Wifi AC2200 Router - Snow,1,5,23 Oct 2020,Zach,It works with the first gen google points and has an even longer range. A bit pricey but does exactly what I need.,Great Product
Google - Nest Wifi AC2200 Router - Snow,1,5,23 Aug 2020,Harris,"If you have problematic wifi, start here. I had Google Wifi and loved it, upgraded to Nest Wifi and noticed an improvement.",Easy to use and solves problems
Google - Nest Wifi AC2200 Router - Snow,1,3,23 Jul 2020,Jeremy,"2100 sq foot house, router was centrally located but almost no smart TVs in the bedrooms had a quality connection.  I’ve purchased an access point hoping this solves the problem but I tried my old Netgear nighthawk and it works just fine.  Not impressed with the range but the app is awesome and it’s all super user friendly",Range isn’t that great
