product,verified,rating,date,author,content,title
"Amazon - Echo Show 8"" Smart Display with Alexa - Charcoal",1,5,13 Aug 2020,AnyTyme,Now that they teamed up with the ring it’s a great accessory to have if you have a ring doorbell,Must have!
"Amazon - Echo Show 8"" Smart Display with Alexa - Charcoal",1,5,13 Sep 2020,Mseeber,Love it! Will probably but another one here soon! Such a great deal.,Amazing
"Amazon - Echo Show 8"" Smart Display with Alexa - Charcoal",1,5,13 May 2020,Mimi,"Purchased this on a bogo special, otherwise would not have purchased. Needed a mobile speaker for a tv and it works great for that and is fun to use. I have not used it to all of its capabilities.",Great deal
"Amazon - Echo Show 8"" Smart Display with Alexa - Charcoal",1,5,13 Jan 2020,Lee1,"I had purchased several of the larger Echo Shows because of the larger screen size for video chats. However, My youngest son & wife live in a very small apt. but wanted to be included in the video chats. so, I purchased this smaller unit. It still works just like the other one, but doesn’t take up as much space.",Very nice Echo Show
"Amazon - Echo Show 8"" Smart Display with Alexa - Charcoal",1,5,13 Feb 2020,NormaJean,"We love this little gadget. We are not a techie family but we absolutely love this little device. It gives us everything from recipes to traffic to weather. I highly recommend this device. I'm still trying to figure it out. There are so many features to it, I learn something new every week.",Oh Yeah!!!!
"Amazon - Echo Show 8"" Smart Display with Alexa - Charcoal",1,5,13 Jul 2020,Cilla,"Love my echo show , works well with my phone and ring doorbell ! I have 2 works well for upstairs and downstairs",Echo show
"Amazon - Echo Show 8"" Smart Display with Alexa - Charcoal",1,5,13 Aug 2020,Jakm65,I wanted to add to my first Echo show needed one in another part of the house,Great addition
"Amazon - Echo Show 8"" Smart Display with Alexa - Charcoal",1,5,13 Jun 2020,CoachPapa,"Its does everything you ask, weather, news, sports, radio stations,
music with the words that you can with. Its everything that I wanted and more, glade that i bought it.",Echo Show was better then expected
"Amazon - Echo Show 8"" Smart Display with Alexa - Charcoal",1,4,13 Oct 2020,echo8,the screen is small. I used a stand to make it look taller. It hears command better than my old echo show.,Cute and useful
"Amazon - Echo Show 8"" Smart Display with Alexa - Charcoal",1,4,13 Jun 2020,Thelma,"Bought this for my Mom as a Mother’s Day gift since I couldn’t visit due to COVID-19.  Great way to not only stay in touch but to actually see her is nice. Plus the added fact I was able to download photos for her to look at, listen to music and all the other things Alexa does.",Easy to stay in touch.
"Amazon - Echo Show 8"" Smart Display with Alexa - Charcoal",1,5,13 Jul 2020,Ikram,Love it. Still needs improvements in some areas but. Not bad for the price.,Not bad at all
"Amazon - Echo Show 8"" Smart Display with Alexa - Charcoal",1,5,13 Jul 2020,MomOf5,Easy to see from several feet away.   Maintains list and the grandkids love taking their pics with it.   Very pleased with the purchase.,Echo Show 8
"Amazon - Echo Show 8"" Smart Display with Alexa - Charcoal",1,5,13 Mar 2020,Coolslim66,Went their and they price matched the items I wanted without any problems or hassle. They have the best warranties offered no hassle to replacement and long as you in system dont need thw receipt.,Nice and feiendly
"Amazon - Echo Show 8"" Smart Display with Alexa - Charcoal",1,5,13 Sep 2020,PopeGirlsMama,It’s so nice to cook & clean and use my handsfree Alexa!,Love this product
"Amazon - Echo Show 8"" Smart Display with Alexa - Charcoal",1,5,13 Aug 2020,JAMESW,A great improvement over the old model.The wife fell in love with it1 works great fro her,works great!
"Amazon - Echo Show 8"" Smart Display with Alexa - Charcoal",1,5,13 Dec 2019,Jnwenn,"I use it with my ring doorbell and works fantastic I can see who’s at my door now, Very easy to use and has multifunctions  I can listen to music and the alarm can  be customized  to your own music And watch amazon prime   Great product especially if you are a prime member already and have their amazon music app.",Overall great product
"Amazon - Echo Show 8"" Smart Display with Alexa - Charcoal",1,5,13 Jul 2020,Chicken1,"Works great with Ring cameras, great for looking up quick recipes and for using the timer in the kitchen.",Work as expected
"Amazon - Echo Show 8"" Smart Display with Alexa - Charcoal",1,5,13 Aug 2020,Juvejr12,Awesome and we love it and please buy it because you would love It,Love it
"Amazon - Echo Show 8"" Smart Display with Alexa - Charcoal",1,4,13 Jun 2020,Dianne,"I have quite a few of the big Echo Shows. The 8 is smaller and works great for normal Alexa, but if you're looking for great music streaming, go with Bose or Sonos. I don't mind the sound from the regular size Echo Shows, but going smaller is not good if you like to listen to music.",Great screen Sound is okay.
"Amazon - Echo Show 8"" Smart Display with Alexa - Charcoal",1,5,13 Jun 2020,MotherofFour,"I added an Echo to my kitchen and it has been extremely useful.  I use it for recipes, cooking tips, measurement conversions, grocery lists, music and etc.",Helpful in the Kitchen
"Amazon - Echo Show 8"" Smart Display with Alexa - Charcoal",1,4,13 Oct 2020,worthjr75,The echo 8 is exactly what I was looking for I have no complaints at this time will keep updating,Works
"Amazon - Echo Show 8"" Smart Display with Alexa - Charcoal",1,5,13 Aug 2020,Badkidsdad,Bought 2 and shared on with my sister who is not very technical. She absolutely loves it!,Love our Echo!
"Amazon - Echo Show 8"" Smart Display with Alexa - Charcoal",1,5,13 Jul 2020,Rose,Very useful and entertaining.  I have an Echo show in every room of the house!   Can't get by without one.,Amazing accessory useful in any room!
"Amazon - Echo Show 8"" Smart Display with Alexa - Charcoal",1,5,13 Aug 2020,DJSHAWNE323,We absolutely love this!!  There’s so much you can do with it!  Highly recommend!,AWESOME!!
"Amazon - Echo Show 8"" Smart Display with Alexa - Charcoal",1,5,13 Jul 2020,Vinnyj,Helps with my cooking and keeps me up to date on current news events as well as many other topics of interest.,Great Addition to my kitchen
"Amazon - Echo Show 8"" Smart Display with Alexa - Charcoal",1,5,13 Jul 2020,Nana,I love this product so much I bought two of them can see my front door my back door and who’s at my front door,Best
"Amazon - Echo Show 8"" Smart Display with Alexa - Charcoal",1,5,13 Jun 2020,runningwild,Bought for me and my grandma. Absolutely love it and at 86 she worked it without instructions! She can’t even use a phone and managed this.,Live it for video calls
"Amazon - Echo Show 8"" Smart Display with Alexa - Charcoal",1,5,13 Jun 2020,dsh55Great,Daughter bought for me to use to talk to grandkids. Love being able to see them growing up. Bought one for my mom in nursing home for same reason.,Great for doing so many things
"Amazon - Echo Show 8"" Smart Display with Alexa - Charcoal",1,5,13 May 2020,jess,Great way to stay connected during these unprecedented times.  Really like the feeling of know my mother can just call out and have Alexa call me if she needs too.,So easy my mother could set it up!
"Amazon - Echo Show 8"" Smart Display with Alexa - Charcoal",1,5,13 May 2020,Xochitl,"Since buying this product I have been able to synchronize all my smart products (lights, Furbo). I have also found that I forget less...Alexa reminds me of lists, etc.",Best thing!
"Amazon - Echo Show 8"" Smart Display with Alexa - Charcoal",1,5,13 Aug 2020,Kidnurse,Love that you can drop in for video calls!  My girls love this option!,Great Alexa addition
"Amazon - Echo Show 8"" Smart Display with Alexa - Charcoal",1,5,13 Jun 2020,SandhillsofNC,Grand kids love it. Dancing to the music and searching for recipes.  I was surprised with the quality of the sound.,As good as a stereo
"Amazon - Echo Show 8"" Smart Display with Alexa - Charcoal",1,5,13 Jul 2020,Corvetteman123,"This thing sit by our bed and we use it every, alarm clock, weather, music. Everything.",Sits by the bed use it every day
"Amazon - Echo Show 8"" Smart Display with Alexa - Charcoal",1,4,13 May 2020,USB2,"Ok, I tried to update my apartment and notoriously am a fan of Alexa, however. .. It's a month or so in and Im having difficulty with Alexa searching and hearing in general unless vol. is almost to max. May meed to give Geek squad a call for assistance.",New Toy
"Amazon - Echo Show 8"" Smart Display with Alexa - Charcoal",1,5,13 Jul 2020,svdg,Love my Echo Show 8. I use it to display my Ring devices and make calls from it.,Love It
"Amazon - Echo Show 8"" Smart Display with Alexa - Charcoal",1,5,13 Aug 2020,jilly21,the base on this product is so good and loud too love it,love it
"Amazon - Echo Show 8"" Smart Display with Alexa - Charcoal",1,5,13 Aug 2020,frcmonster,Way better than just the dot! I love video calling.,Awesome
"Amazon - Echo Show 8"" Smart Display with Alexa - Charcoal",1,5,13 Jun 2020,Pamela53,I received the echo in the mail in one day which was great! The echo 8 works well! Thanks Best Buy!,I bought the echo 8 to talk to my Grandsons
"Amazon - Echo Show 8"" Smart Display with Alexa - Charcoal",1,5,13 Mar 2020,Morysa,I love this so much I went back and purchased two more for other rooms in the house along with other devices to use in the house.  James who helped me explained so much and was so knowledgeable.,fun and handy Echo show
"Amazon - Echo Show 8"" Smart Display with Alexa - Charcoal",1,5,13 Jun 2020,Aggie,I love my echo show 8. I wanted the bigger one but it was a little out of my price range. I really like the 8 and I have the 5,Love
"Amazon - Echo Show 8"" Smart Display with Alexa - Charcoal",1,5,13 Mar 2020,K9Mike,"First time purchase of the Amazon Echo Show 8, very satisfied with our purchase.     It is a real hit with the Grandbabies. Great with helping on homework when we cannot figure something out.",Amazon Echo is great .
"Amazon - Echo Show 8"" Smart Display with Alexa - Charcoal",1,5,13 Aug 2020,sarahbelle,We use it for music calling watching videos kid love to use it,Love it
"Amazon - Echo Show 8"" Smart Display with Alexa - Charcoal",1,5,13 May 2020,PowerOf10,"Nice quality and having a slider to cover the camera is nice, but who says they're still not listening when you least expect it. :)","Like an Echo, but with a screen"
"Amazon - Echo Show 8"" Smart Display with Alexa - Charcoal",1,5,13 Jul 2020,TrumpSupporter,I purchased this because i like to listen to music and the speaker is AMAZING/,Excellent smart speaker!
"Amazon - Echo Show 8"" Smart Display with Alexa - Charcoal",1,5,13 May 2020,pearls,Oh my gosh I thought I was ordering 2 but must have screwed up my order. Only got one. So I loved it so much that I had to order another!,I live Alexa!
"Amazon - Echo Show 8"" Smart Display with Alexa - Charcoal",1,5,13 Jul 2020,ItsJustMe,We don't use the camera feature. We mainly use it to check time and temperature at a glance.,My wife loves it.
"Amazon - Echo Show 8"" Smart Display with Alexa - Charcoal",1,4,13 Jun 2020,Jeff,"I have one of these in my home, but purchased this one for my parents so that we could easily do video calls & my mom could see her security cameras. My dad is able to listen to his favorite radio station too, so everybody wins!",Great way to stay connected!
"Amazon - Echo Show 8"" Smart Display with Alexa - Charcoal",1,5,13 Feb 2020,Awesome,8” screen. I listen to music I love shows lyrics. I watch my amazon prime movies and tv while I cook. It shows live cameras if you have them in your house. Speakers are good! You can “face chatting” with other echo show users,Daily use
"Amazon - Echo Show 8"" Smart Display with Alexa - Charcoal",1,5,13 Aug 2020,Beatsprouser,Love this product. I would highly recommend to any Alexa user.,Great
"Amazon - Echo Show 8"" Smart Display with Alexa - Charcoal",1,5,13 Aug 2020,Emily,"Love my Echo Show, it makes it so easy to check in on family in other rooms of house.",Awesome Device
"Amazon - Echo Show 8"" Smart Display with Alexa - Charcoal",1,5,13 Sep 2020,Brenbrencookies,"Love this amazon echo 8, shows great pictures and color is great",Love this echo
"Amazon - Echo Show 8"" Smart Display with Alexa - Charcoal",1,5,13 Sep 2020,lovey,really nice product.can do alot with this product. more functional than the dots,love it
"Amazon - Echo Show 8"" Smart Display with Alexa - Charcoal",1,5,13 Jul 2020,jbspotcheX,Love this little thing.  If you are all about Alexa then you can’t go wrong with this.  Extremely easy to integrate into your existing Alexa home.,Bingo
"Amazon - Echo Show 8"" Smart Display with Alexa - Charcoal",1,5,13 Sep 2020,William,Me and my girlfriend love this device. Works great with our ring products,Love this product
"Amazon - Echo Show 8"" Smart Display with Alexa - Charcoal",1,5,13 Aug 2020,JustMe,I am now able to control several devices thru out my house using alexa and also using my phone,great item
"Amazon - Echo Show 8"" Smart Display with Alexa - Charcoal",1,4,13 Apr 2020,DKCHAN,"I was looking for a device to put in my elderly parent's home. It had to be ""no touch"" so that my mom (90+) didn't have to know how to use it. This device does the trick but you really have to figure out (and work with Amazon) how to set it up to meet one's needs.

Once it's set up, all I have to do is ""drop in"" and the device picks up for a 2 way video call. That is drop dead simple.",Excellent device for elderly and anyone else
"Amazon - Echo Show 8"" Smart Display with Alexa - Charcoal",1,4,13 May 2020,Melanie,"We have really enjoyed this product. We have purchased several of these for family and it has been really great to be able to see and talk with each other. 
We have done so many things with our Show 8, we play games, get weather reports, view our uploaded pictures, ask questions, enable hue lighting, and even can view our Ring camera products.","Has been great, especially during Stay @ Home orde"
"Amazon - Echo Show 8"" Smart Display with Alexa - Charcoal",1,5,13 Sep 2020,Dimatty,Great size and works really well. Alexa lets you do alot of different things,Love
"Amazon - Echo Show 8"" Smart Display with Alexa - Charcoal",1,5,13 Sep 2020,Housewife,We love the echo show 8.  It is the perfect size for us.,Great product
"Amazon - Echo Show 8"" Smart Display with Alexa - Charcoal",1,5,13 Sep 2020,Troy,Its working great for being able to drop in and say hello.,stay in touch with grandma
"Amazon - Echo Show 8"" Smart Display with Alexa - Charcoal",1,5,13 Aug 2020,Grimprinter,"Echo show has great mic, works well with alexa devices and has many features, it is a great product!",Quality product!
"Amazon - Echo Show 8"" Smart Display with Alexa - Charcoal",1,5,13 Jul 2020,skidee,"Loaded with accessible information-sometimes voice recognition is quirky.  With that said, would still recommend this item for everyone.",Good Distraction
"Amazon - Echo Show 8"" Smart Display with Alexa - Charcoal",1,5,13 Jul 2020,Alice,This is one of the best things I ever bought. Plays any music or radio station and can even FaceTime other people with echo shows!,Best thing
"Amazon - Echo Show 8"" Smart Display with Alexa - Charcoal",1,5,13 Aug 2020,Scotts,Have purchased these showplaces. Great features. Enjoy the listen everywhere feature .,Great feature
"Amazon - Echo Show 8"" Smart Display with Alexa - Charcoal",1,5,13 Mar 2020,Atlmike99,"I really like Echos a lot, and got this one because it was at a great price.  I am using this in my kitchen so I can see videos or have it read books or the news to me.  
I recommend it anyone looking to get one of the larger Echos with video capabilities.",Best version of Echo yet
"Amazon - Echo Show 8"" Smart Display with Alexa - Charcoal",1,5,13 Aug 2020,WSMC538,Purchased to interface with my Ring Cameras. Makes it easy to view by asking Alexa.,Great Ring Interface
"Amazon - Echo Show 8"" Smart Display with Alexa - Charcoal",1,5,13 Jul 2020,Pepp,I use it the kitchen for recipes and to see who’s at the door with ring camera.,Great for watch
"Amazon - Echo Show 8"" Smart Display with Alexa - Charcoal",1,5,13 Apr 2020,mike,"I love my Amazon echo
Integrated very well with many of my home automated stuff that lives in the kitchen and I watch the news on it when I'm eating and my kids love it",love it
"Amazon - Echo Show 8"" Smart Display with Alexa - Charcoal",1,5,13 Jul 2020,Mary,I love this gadget.  I listen to music as I cook and it also acts as a timer.,Perfect kitchen helper
"Amazon - Echo Show 8"" Smart Display with Alexa - Charcoal",1,5,13 Aug 2020,Ajcastillo,This has been a great addition. Love all of the functions,Love!
"Amazon - Echo Show 8"" Smart Display with Alexa - Charcoal",1,5,13 Aug 2020,SMCUTE775,Perfect size. Not too big nor too small. Perfect for the kitchen or room.,Awesome
"Amazon - Echo Show 8"" Smart Display with Alexa - Charcoal",1,4,13 Mar 2020,Jordan,"I was really excited about this device. I think its very handy for catching up on the latest news or sports. I like all skills its can do via the Alex app. My only complaint is that there is no way to remove the ""try Alexa"" suggestions on the home screen.  Its very annoying. This feature is annoying & should have definitely been optional.",Great device except for one annoying feature.
"Amazon - Echo Show 8"" Smart Display with Alexa - Charcoal",1,5,13 May 2020,DRDON,"An amazing product! The product has many features, such as allowing me to view all of the areas in my house where I have Ring Cameras including my Ring Doorbell.",Very nice!
"Amazon - Echo Show 8"" Smart Display with Alexa - Charcoal",1,5,13 Jul 2020,Nickname,"this echo show is the ideal bedside companion
love that it does all the cool echo stuff plus videos",new bedside companion
"Amazon - Echo Show 8"" Smart Display with Alexa - Charcoal",1,5,13 Feb 2020,Lenny,"I’m amazed of of the things Alexa can fo for you! I’ve had it just for a couple of weeks and it’s part of my daily life already, even if it’s just to play music (nice sound) or maybe listen to the news. Love my Echo Show 8! I really recommend it!",Awesome smart speaker!
"Amazon - Echo Show 8"" Smart Display with Alexa - Charcoal",1,5,13 Apr 2020,scotty1987,No complaints whatsoever. This worked perfectly out of the box and communicated with other devices perfectly. It's necessary to follow detailed instructions from third party vendors however.,An excellent product.
"Amazon - Echo Show 8"" Smart Display with Alexa - Charcoal",1,5,13 Jul 2020,Fred,very cool.  Nice addition to the network.  Once you link all your items. Alexa can do the rest.,Echo
"Amazon - Echo Show 8"" Smart Display with Alexa - Charcoal",1,5,13 Apr 2020,Tabs,I got this after my friend showed me hers and I regret not getting it sooner! I use mine mainly for music in the kitchen but it comes in handy when you need a recipe!,In love!
"Amazon - Echo Show 8"" Smart Display with Alexa - Charcoal",1,5,13 May 2020,nandotnns,"Great Speaker!! i dont use the camera or other alexa features. I just got it for the audio, time, and weather. do not over think it and get it. LIKE NOW",Does Everything
"Amazon - Echo Show 8"" Smart Display with Alexa - Charcoal",1,5,13 Aug 2020,Bubba,A great product at a great price what a deal on these products,Great Deal
"Amazon - Echo Show 8"" Smart Display with Alexa - Charcoal",1,5,13 Jul 2020,James,"We love this.  Keep in contact with family, listen to relaxing sounds at night .   Check weather.",Big screen.
"Amazon - Echo Show 8"" Smart Display with Alexa - Charcoal",1,5,13 Jun 2020,Joeb,I got this for a gift a d they loved it as soon As they got home it was hooked up. All the little kids love singing with the Alexa.,Great product
"Amazon - Echo Show 8"" Smart Display with Alexa - Charcoal",1,5,13 Jul 2020,Queenbee658,Love my new echo device. Works well with my other Alexa devices and home security camera.,Great Device
"Amazon - Echo Show 8"" Smart Display with Alexa - Charcoal",1,5,13 Jul 2020,Osiel,Product is great love alexa and the fact that it comes in a bigger size now,Great product had to upgrade to the big one
"Amazon - Echo Show 8"" Smart Display with Alexa - Charcoal",1,5,13 Aug 2020,Junior,I love it and it works very well and the calls are very good,Great
"Amazon - Echo Show 8"" Smart Display with Alexa - Charcoal",1,5,13 May 2020,Tasha,I love this item.  It is large enough to view without having to bend over or prop up.  The color is amazing and has all features of regular Amazon - Echo with Alexa.,Great for FaceTime
"Amazon - Echo Show 8"" Smart Display with Alexa - Charcoal",1,5,13 Aug 2020,CCCC,Great buy. Easy to stay in touch with my elderly Mom since COVID-19 keeps us apart.,Great way to stay in touch with family
"Amazon - Echo Show 8"" Smart Display with Alexa - Charcoal",1,5,13 Aug 2020,Eileen,Purchased to view ring cameras and connect with family members who have same device,Good product
"Amazon - Echo Show 8"" Smart Display with Alexa - Charcoal",1,5,13 Jun 2020,Jackie,"Purchased this for my mother, not being able to visit family. She lives it and lives asking Alexa questions.  Great gift",Great device for my mother to use
"Amazon - Echo Show 8"" Smart Display with Alexa - Charcoal",1,5,13 Aug 2020,Jake,"marvelous,i like it,I can rexommwnd rhis to my orher friends",i love this echo show8
"Amazon - Echo Show 8"" Smart Display with Alexa - Charcoal",1,5,13 May 2020,Captain,"I thought Alexa was fantastic, but Echo is a another whole level , my wife loves it and we are bringing 1 to mother in law so they can video chat while shutdown is on.",Wife loves it
"Amazon - Echo Show 8"" Smart Display with Alexa - Charcoal",1,5,13 Jul 2020,RonC4400,nice television and a wonderful price i had looked at several other model and this was just right for what i needed,great
"Amazon - Echo Show 8"" Smart Display with Alexa - Charcoal",1,5,13 Jul 2020,Steve1,I have an echo show and echo spots and this is the perfect in between and has a great picture and sound,This is a great value
"Amazon - Echo Show 8"" Smart Display with Alexa - Charcoal",1,5,13 May 2020,wesley,i love this thing easy to use and all you have to do is tell alexa what to do and it’s done if you have the other equipment in your home to make it a smart home,love it
"Amazon - Echo Show 8"" Smart Display with Alexa - Charcoal",1,5,13 Jun 2020,Maggie,So fun to have. If one of our kids have a question the answer is seconds away! So great that she will tell you jokes!,Alexia
"Amazon - Echo Show 8"" Smart Display with Alexa - Charcoal",1,5,13 Jul 2020,Rubsomedirtonit,This item has been great. I have been using it to see my new niece and pop in on friends.,Keep In Touch With Family
"Amazon - Echo Show 8"" Smart Display with Alexa - Charcoal",1,5,13 May 2020,Grimes,The echo is great to automate switches and what not in my house.  It is also fun to ask random questions.  It provides a fair amount of entertainment and news.,This is an awesome device!
"Amazon - Echo Show 8"" Smart Display with Alexa - Charcoal",1,5,13 Aug 2020,ericdelrosso,Another quality of life improvement from amazon. Love it!,Great!
"Amazon - Echo Show 8"" Smart Display with Alexa - Charcoal",1,5,13 May 2020,Winnings,Excellent product even better when prices right! Thank you best buy for the great deal. . Going on sale again soon? I would love to buy again for mothers day gifts!,Love this! Purchased two! Great for myself and the
"Amazon - Echo Show 8"" Smart Display with Alexa - Charcoal",1,5,13 Jun 2020,ronnie,I'm enjoying the access to a relative that doesn't have the ability to operate a phone so I can call and we can talk and see each other,Hard to setup
"Amazon - Echo Show 8"" Smart Display with Alexa - Charcoal",1,5,13 Jun 2020,None,"The Amazon Echo Show8 is great, and was at a great price! It came in a timely manner, and was in excellent, brand new, condition!",Great price! And the Amazon Echo Show8 is great!
"Amazon - Echo Show 8"" Smart Display with Alexa - Charcoal",1,4,13 Jul 2020,Vince,"Could tell Alexa to add anything to my shopping list it wouldn't work
Couldnt have my pictures on my display srew only did one on the background didnt wanna do the album 
Had to return it get the echo 10 work great everything work on it",Ok
"Amazon - Echo Show 8"" Smart Display with Alexa - Charcoal",1,5,13 Aug 2020,DrChill,This is nice to see the pictures taken through the years,Love the photos
"Amazon - Echo Show 8"" Smart Display with Alexa - Charcoal",1,5,13 Jul 2020,Blmrocker,I have this near my dishes. It's great for YouTube and washing dishes.,Great
"Amazon - Echo Show 8"" Smart Display with Alexa - Charcoal",1,5,13 Aug 2020,Joanne,Love this device! It does every more than I anticipated.,Love it!
"Amazon - Echo Show 8"" Smart Display with Alexa - Charcoal",1,5,13 Jun 2020,MyOldTVdied,"Video calling using Alexa has made my MOM sooo happy!Easy setup, controls Sonos & other stuff-Great!",Future is NOW!
"Amazon - Echo Show 8"" Smart Display with Alexa - Charcoal",1,5,13 Sep 2020,Sweet,This product is fun and is amazing for the kitchen.,I love it
"Amazon - Echo Show 8"" Smart Display with Alexa - Charcoal",1,5,13 Aug 2020,Janhen,Father’s Day gift for husband. He has enjoyed all of the features and still discovering new uses.,Like all the amazing features
"Amazon - Echo Show 8"" Smart Display with Alexa - Charcoal",1,4,13 May 2020,Necrom2,I bought this mostly to use as a smart alarm clock. It works for this but for some reason Amazon doesn't let you choose the clock face like it does for other models. As a result it is hard for me to see the time at night when my glasses are off. A software update would make this a five star product for me.,"It does what I need it to, for the most part."
