product,verified,rating,date,author,content,title
Google - Nest Cam Indoor Security Camera - Black,1,5,23 Oct 2020,speeder37,"These are great cameras, We have 3 of the outdoor ones and then purchased this indoor one. Easy to set up and very clear picture",Nest indoor camera
Google - Nest Cam Indoor Security Camera - Black,1,4,23 Nov 2016,HKTL,"Easy to setup and use. Picture quality with 720p is great and 1080p is even better. Motion alert is a nice function to see what my pet is up to during the day or night.

Four stars only because the cameras don't always turn on or off with auto away and I have to keep Manukau turn them on and off.",Clear picture quick setup
Google - Nest Cam Indoor Security Camera - Black,1,1,23 Nov 2017,Jonmac41788,Bogged dowm my internet quality to price it was overrated for the money way to expensive ended up returning them,Junk
Google - Nest Cam Indoor Security Camera - Black,1,5,23 Nov 2019,Aguerrero7,"Great picture quality and easy to use.
Immediately notification through your phone
Great quality in night time mode",Best camera and easy to setup
Google - Nest Cam Indoor Security Camera - Black,1,5,23 Oct 2020,Phrf,This Google nest camera is perfect for your all your indoor security needs for anyone on a budget for security cameras. Easy set up and the quality of the recording is superb.,Excellent
Google - Nest Cam Indoor Security Camera - Black,1,4,23 Nov 2016,Vicky886,"I purchased the three pack to save some money. The setup was straight forward. The video is pretty clear during the day and on night vision. Nest charges a monthly subscription to retain video history. I think it's something that they should include with the cameras... Only 10 days initially without paying more. I not sure if mine is malfunctioning, but occasionally there's a blue flashing light when no one is watching/talking over the stream. Not sure what's going on there.",Decent
Google - Nest Cam Indoor Security Camera - Black,1,4,23 Nov 2018,JJ2018,"The nest cam really is a fantastic product. It’s pretty easy to setup and once online the video either through my laptop, iPhone or Apple TV is super crisp. The one drawback is if you plan to travel and plug it in elsewhere you have to unregister it then re-register a slight inconvenience but really not too much trouble. I highly recommend",The nest cam is great!
Google - Nest Cam Indoor Security Camera - Black,1,5,23 Nov 2018,AVGuru,Waited a while to review to be sure. Simple setup. Good video quality. Nest recently added ability to setup zones from the iOS app so no need for desktop browser anymore. Using the $5 / month plan is more than enough for me.,Easy with good video
Google - Nest Cam Indoor Security Camera - Black,1,4,23 Nov 2015,LonChayKnee,"Although the resolution on the picture is good and setup is a snap. If compared to similar units, the price is higher than most and the buyer must subscribe at ten dollars per month, per camera to save the video for viewing. Overall, I'm pleased, although the ability to save video on site would be a huge plus.",Easy set up and good resolution
Google - Nest Cam Indoor Security Camera - Black,1,1,23 Nov 2017,kyletsu,Get the Logi Circle. They offer free 24 hour cloud recording. Nest wants you to pay $100 a year to do any type of recording.,No free cloud recording
Google - Nest Cam Indoor Security Camera - Black,1,1,23 Nov 2017,Louis,"They keep going down. I purchase 10 cameras, the thermostat and smoke alarms... Not impressed.",Drop Cams
Google - Nest Cam Indoor Security Camera - Black,1,5,23 Apr 2020,Diana,"Love these. These cameras are so easy to set up takes about one minute. They don’t turn and you have to pay for a subscription if you want to see anything that happened I think over 24 hours. But well worth it. The picture is clear. It might not always know when you’re home or away so you might have to hit the home or away button yourself, so I wouldn’t keep these in the bedroom ha ha. I’ve used these on short trips to check on my cats. Good product.",Love these
Google - Nest Cam Indoor Security Camera - Black,1,1,23 Nov 2017,KelTech,It worked well for the first 2 weeks. Now it loses WiFi multiple times a day for no reason. I'm returning this,Needs improvement
Google - Nest Cam Indoor Security Camera - Black,1,5,23 Nov 2018,Vince,"Very simple to set up. Great quality picture, very clear. One of the best wireless cameras I have used. The app is very simple to use as well. I would definitely recommend buying this if you are looking for peace of mind for your home or office.",Great cameras
Google - Nest Cam Indoor Security Camera - Black,1,5,23 Nov 2016,Brahmsguy123,"These are awesome cameras. I am impressed with how clear they are even in night vision. You can both hear and speak through them. They are super easy to install and very easy to mount. The magnet use for mounting is super strong, so no worries for the camera falling. This is a great and easy way to add security to your home.",Great Cameras and Easy to Install
Google - Nest Cam Indoor Security Camera - Black,1,5,23 Jul 2020,BestBuyBoy13,"If you want a one stop shop for an easy to set up and reliable camera this is the one, google makes it easy to manage and share. Only confusing part is when you sign up for the cloud based subscription but itpanned our just took me a little bit to figure it out","Works great, easy to use"
Google - Nest Cam Indoor Security Camera - Black,1,4,23 Nov 2016,desertdwelling,"Good quality camera, easy setup. The mount is nice. The 1080 video is very spotty with my internet connection. It's hard to tell if the problem is with my connection speed or the camera. I can stream full HD video/audio without issue so it seems strange that I can't set the camera to 1080 and have reliable performance.

There's no local saving media, which is a downside. I'd recommend this for a nanny cam, but not full on security.","Simple, Reliable"
Google - Nest Cam Indoor Security Camera - Black,1,4,23 May 2020,divergentdan,"Setup is super easy. Just download the app, scan the camera and you’re done. Video quality is not as good as I was expecting/hoping but is adequate. The Nest Aware subscription starts low but as you add more cameras it begins to add up (min. $5/month/camera). The camera itself is also a bit pricey but I needed something fast and reliable. 

Overall, it did the job I needed it to and the notifications for when there’s activity in the room were very helpful.","Easy to setup, simple to use."
Google - Nest Cam Indoor Security Camera - Black,1,5,23 Nov 2018,AtlantaDev,No issues at all after two years. Vee clear picture and simple setup. Paying for the monthly video storage is worth it. Very easy to zoom into certain times.,Solid and easy to setup
Google - Nest Cam Indoor Security Camera - Black,1,5,23 Oct 2020,FranksTheTank,"I have a few of these cameras around my house. Love the functionality, Clarity, and ease of use. Integrates perfectly with my nest ecosystems.",Nice!
Google - Nest Cam Indoor Security Camera - Black,1,5,23 Nov 2017,memem,This camera makes setting up a security very easy and the functions are reliable. The cloud storage options to retrieve information is also very easy to use.,Great security camera
Google - Nest Cam Indoor Security Camera - Black,1,4,23 Nov 2017,Gamer4567,"Great cameras for a home user. The only downfall, their online storage, which is your only option, is expensive. 100$/Yr for the first camera for 10 days of online storage. Each additional camera is 50$. I think this is pretty sharp expense. Lower the price of the online storage and I will give it a 5 star.","Great Cameras, but....."
Google - Nest Cam Indoor Security Camera - Black,1,5,23 Sep 2020,JPNH,This camera was super easy to set up! Many features included. I like the small size and the picture is very clear and you can easily zoom in right from your phone.,Perfect size and good view!
Google - Nest Cam Indoor Security Camera - Black,1,5,23 Nov 2016,missylu,"Purchased the camera for home security while we were out of town. Love the alert notifications through smart phone. Clear picture/video. A little difficult to originally set up for a non-tech person, but customer service was friendly, helpful, and made process a little easier.",Great camera for home security
Google - Nest Cam Indoor Security Camera - Black,1,5,23 Nov 2019,PRZ40,Reliable and provides great home security. Easy to setup.,Awesome picture
Google - Nest Cam Indoor Security Camera - Black,1,4,23 Nov 2019,Nate,"this camera is great, good picture, easy to set up, ability to talk over video. The problem is that if you want to store any video, its a cloud subscription per month.","great cam, subscription for video"
Google - Nest Cam Indoor Security Camera - Black,1,5,23 Nov 2016,british,"I have been looking for a good easy to install camera for a while, this has been an excellent choice. I think it's great for the house you can place anywhere in the home that you want, if you change you mind it's simple to move. The ability to add to you home security system is excellent.",Great camera easy to use and install
Google - Nest Cam Indoor Security Camera - Black,1,5,23 Nov 2019,dbo11,these cameras are easy to install and the video is so clear. wish i had bought sooner.,nest camera
Google - Nest Cam Indoor Security Camera - Black,1,5,23 Nov 2017,CL2017,"Of all the systems I have seen, this is the easiest and most intuitive to set up and use. The pictures are clear and the email notifications of activity and problems are prompt. I am pleased with the purchase.",Easy to set up and use.
Google - Nest Cam Indoor Security Camera - Black,1,5,23 Nov 2018,saltydog,I've been very satisfied with this purchase. the setup was easy and I'm impressed by the video quality even in low light. It also stays connected to the wifi reliably. No complaints.,"Easy setup, great picture, reliable connection.."
Google - Nest Cam Indoor Security Camera - Black,1,4,23 Nov 2018,Tamwyn,"I really like these Nest Indoor Cams. I have 3 of them. I've used them as baby monitors, pet monitors, and for security. When you have the video set to the highest quality then the camera does get warm. Also, you don't get the full functionality unless you pay the monthly subscription. They can do 720 or 1080p video resolution and they zoom decently but not awesome. I love the wide angle lens though. I have one in a corner of the room as a security cam and I can see all 4 different doors into that room and the stairs. I only need one camera to see the whole room. I feel like they could keep optimizing the Nest App. It has gotten faster over time but it still feels like it loads slow when there is an ""emergency"" and I want to see the camera feed immediately. I like the ""2-way"" talk, but be aware that this means you can either hear what is going on, or you can turn on the mic and speak to the room, but not both at the same time. When you are speaking, you can't hear until you turn the mic off. This makes sense so you don't get an echo, etc. but it lags by as much as 2 seconds in my experience, so it doesn't work to carry on a conversation, if that is what you are looking for. You'll probably miss the first couple words every time.",Works well
Google - Nest Cam Indoor Security Camera - Black,1,5,23 Jul 2020,RobR,Easy to use. This is our first indoor camera. We use it to monitor the kids playroom. We can move it anywhere our wifi reaches so we use it to watch our sump pump while we are away. Super clear and adds piece of mind.,Easy to use!
Google - Nest Cam Indoor Security Camera - Black,1,5,23 Nov 2017,DonW,Received one for Christmas and it worked great. Very easy set up!! I bought five more for the home and my office. I would highly recommend this camera. The most simple setup and works great too!!! Great picture quality.,Excellent WiFi Cameras
Google - Nest Cam Indoor Security Camera - Black,1,5,23 Jul 2020,CatdaddyMD,"These cameras were bought for my mother-in-law and her elderly mother to keep an eye on her when we’re out of the house. Easy to set up, clear picture, great night vision. 

Would recommend highly to all interested in indoor cameras.",Excellent cameras!
Google - Nest Cam Indoor Security Camera - Black,1,5,23 Nov 2017,Trip4014,"This is a no brainer, if you need a Cam the Nest Cam is simple to use and a very non Tech set up.. PIcture is fantastic and controls are simple and intuitive. I appreciate the peace of mind it provides.",Great Cam Simple Set up
Google - Nest Cam Indoor Security Camera - Black,1,5,23 Nov 2017,SB2900,"This is my second camera. Tried others before this one and returned them. This is an excellent camera and the setup is super simple.
The picture is excellent. Does everything it saids it will do and more",Quality with Simplicity
Google - Nest Cam Indoor Security Camera - Black,1,5,23 Nov 2018,Rickster,I own about 10 of these cameras. They are easy to set up and the picture is sharp. They are clear on all my devices no matter how far away I am in the world.,Best security cameras on the market!
Google - Nest Cam Indoor Security Camera - Black,1,5,23 Nov 2019,Newbie,"Great product. Easy to set up. Great video images—sharp, clear. Not expensive.",Works great
Google - Nest Cam Indoor Security Camera - Black,1,5,23 Nov 2018,Pugs,"At $150.00 a camera during the sale, this camera is easy to install, set up, and use. The app is simple to use and the clarity is clear. I would recommend this if you have fast wi-fi.",Fantastic Camera for the Price
Google - Nest Cam Indoor Security Camera - Black,1,5,23 Nov 2019,GWIL,Easy to setup and easy to use.  Perfect for any home.,Great for monitoring home
Google - Nest Cam Indoor Security Camera - Black,1,5,23 Nov 2016,Wompy,"We bought two of these due to security concerns in our neighborhood. The install was simple, setup was even more simple, and the cameras were great. Daytime and nighttime the picture is great and I can access the views and review any activities captured by the cameras from my PC and my android cell phone. Great cameras!",Excellent cameras that are simple to set up!
Google - Nest Cam Indoor Security Camera - Black,1,1,23 Nov 2018,meme,"regret buying it, theres other cameras that do the same yet cheaper",Was not inpresses with this not worth what I paid
Google - Nest Cam Indoor Security Camera - Black,1,5,23 Nov 2017,Beast,"This camera is with a set of 3 others inside the home and 1 outdoor NEST camera as well. The setup is incredibly simple if you use an iPad, but harder with a Windows 10 computer. The clarity is wonderful. The only issue could be upload speeds since each camera recommends 2 Mbps.",Excellent camera
Google - Nest Cam Indoor Security Camera - Black,1,5,23 Nov 2016,Woorheemammoth,Love this camera. Very easy to set up and the video quality is better than I expected for such a small unit. Recommend it if you want something effective with very little maintenance.,Simple and Effective
Google - Nest Cam Indoor Security Camera - Black,1,1,23 Nov 2017,Someone,Couldn't get it to stream video with ASUS router. Tech support couldn't fix.,Wouldn't work
Google - Nest Cam Indoor Security Camera - Black,1,5,23 Aug 2020,ScottM,These cameras have a great picture and seem well thought out for connecting and aiming the cameras.  They are easy to install and connect to wifi.  They work well with the Nest App and provide quick alerts through the app,Easy to install and connect
Google - Nest Cam Indoor Security Camera - Black,1,4,23 Nov 2016,Beto,"Easy setup, but have some issues with the home and away feature which turns the camera off and on depending on if you are home or not. Sometimes it works other times it does not and a little difficult to setup. Looking to add some outdoor Nest cameras when they come out, but not sure after the experience with the indoor. Also you must purchase a history (recorded) service from Nest to view any activity. You cannot even review one motion incident without the purchase which costs about $100 a year. Seems they would provide some history information as other cameras do.",Good basic security camara
Google - Nest Cam Indoor Security Camera - Black,1,5,23 Nov 2018,pcallen,"I bought the Nest cam to keep an eye on the kids when they get home from school. Super easy to use and set up and works great with the app on your phone, you can listen and talk through it. Great investment",Great DIY security
Google - Nest Cam Indoor Security Camera - Black,1,5,23 Nov 2017,0397,"Out of several video camera brands that I have tried, this is the only one with very easy to use software (for setup) and reliable hardware. A friend who worked for 30+ years as an IT person choose this one and I was impressed how easy it was to set up and maintain.",Reliable software and hardware.
Google - Nest Cam Indoor Security Camera - Black,1,5,23 Nov 2019,nancylynnmarie,"easy to install, great picture and provides a level of security for pool area.",super easy to install
Google - Nest Cam Indoor Security Camera - Black,1,1,23 Nov 2017,Brenda,The camera is ok the audio is poor. You can't hear on the camera.,Camera
Google - Nest Cam Indoor Security Camera - Black,1,5,23 Sep 2020,AlanHH,Easy to use and amazing quality.  The picture is so clear.,Great Camera
Google - Nest Cam Indoor Security Camera - Black,1,5,23 Nov 2019,Tarzaname,"These work great. Easy to use, easy to set up, clear picture",Exactly what was needed
Google - Nest Cam Indoor Security Camera - Black,1,5,23 Aug 2020,N8theGr8,Very easy to setup and video quality is good. Recommended for anyone looking for an indoor security camera.,Great camera
Google - Nest Cam Indoor Security Camera - Black,1,5,23 Nov 2016,Pghgirlvb,Camera is easy to install and easy to use. 1000 times clearer than the camera provided with my ADT system. Can zoom in and see everything so clear. Wishing I would have bought the 3 pack.,Great Camera
Google - Nest Cam Indoor Security Camera - Black,1,5,23 Nov 2017,yclegg,"Easy to register, easy to install, easy to use. Great camera. Love the alerts. Recommend buyers also get the ten day recording feature.",I love my Nest Camera
Google - Nest Cam Indoor Security Camera - Black,1,5,23 Jul 2020,JustinKruger,"very easy to setup, a little on the higher priced side, but works very well and glad I bought!",Very good video quality and pretty good audio.
Google - Nest Cam Indoor Security Camera - Black,1,5,23 Nov 2015,Pokey,Perfect video monitor for checking on my dog and watching for any unwanted activity in my home. Easy to use and view on your phone.,Great way to protect your home
Google - Nest Cam Indoor Security Camera - Black,1,5,23 Jan 2020,lovetoshop,Excellent camera for indoor use. This is my second indoor Nest camera and I am absolutely satisfied with the quality.  Daytime monitoring is extremely clear.  Night time monitoring is also very clear even in a very dark room with minimal light.,Excellent Camera for indoor use.
Google - Nest Cam Indoor Security Camera - Black,1,4,23 Nov 2016,RadZ,"I really like this camera. It works well. I looks great. It does rely on a great internet connection and sometime the video would stop for a few seconds. I assume this was related to internet problems. I thought that this could be a baby monitor at night, but it is not reliable or sensitive enough. The audio is not nearly as sensitive as dedicated baby monitors. I do use the Nest as a nanny cam, and it works great for that.","Great security camera, not great as baby monitor"
Google - Nest Cam Indoor Security Camera - Black,1,5,23 Nov 2017,iDevice,We have several of these around the house and they are awesome. High quality video and easy setup.,Awesome security camera
Google - Nest Cam Indoor Security Camera - Black,1,5,23 Nov 2018,lrose,Very easy to install. Pictures and video are clear.,Great camera
Google - Nest Cam Indoor Security Camera - Black,1,5,23 Nov 2016,voyageur,Ease of setup is a plus. Picture is clear. We find great comfort with the security these cameras offer us,home security
Google - Nest Cam Indoor Security Camera - Black,1,4,23 Nov 2016,AudioWill,"The camera quality is absolutely amazing... I'm getting full HD at 1080p. Sound quality and microphone sensitivity is great. I'm using these cameras as both a security device and baby monitor. The only drawback with these cameras in the required subscription to record. I knew that when I purchased the cameras so it didn't bother me but, be prepared to pay for the ability to record ANYTHING. Also, setup was super easy but if you want to make it look professionally installed be prepared to climb into the attic to run wires. I'm very happy with my cameras.",Amazing camera quality
Google - Nest Cam Indoor Security Camera - Black,1,5,23 Nov 2017,Delo,"I like the clear picture, wide angle and easy to install. best camera",Excellent video
Google - Nest Cam Indoor Security Camera - Black,1,5,23 Nov 2015,Dadyman,"Great product, is as advertised! Very simple install, easy user interface. Hd video with zoom in and full room visibility....",Great for simple quick monitoring!
Google - Nest Cam Indoor Security Camera - Black,1,5,23 Jan 2020,Karen,"This is our first security camera. Very easy set up but we did need to get a new router. Ours was 6 years old and the camera couldn't find the wifi. New router and it hooked in immediately.
Great resolution, easy to use website and app.",Good camera!
Google - Nest Cam Indoor Security Camera - Black,1,5,23 Nov 2017,JetsFan1015,I loved this camera for my home. It was very easy to setup and very easy to use.,Great camera for home monitoring!
Google - Nest Cam Indoor Security Camera - Black,1,5,23 Nov 2016,Broncobuster23,Very easy to set-up. Great quality picture when it is recording and it even has night vision capability.,Great product
Google - Nest Cam Indoor Security Camera - Black,1,5,23 Nov 2016,dsilver66,Bought these cameras after having a new baby. So easy to set up and the camera picture is great.,So easy to use
Google - Nest Cam Indoor Security Camera - Black,1,5,23 Nov 2016,GrimReaper,This camera is exactly what I was looking for. The clarity of the picture is very good and setup was simple.,Very easy to set up
Google - Nest Cam Indoor Security Camera - Black,1,5,23 Jun 2020,jreed418,Easy to mount on a wall or desk. Set up is very easy just like the other nest products.,Great simple indoor camera
Google - Nest Cam Indoor Security Camera - Black,1,5,23 Nov 2016,Earnest,I have purchased 4 of these. Easy to set up and use. Great picture and the iPhone and iPad apps work great.,Great security camera
Google - Nest Cam Indoor Security Camera - Black,1,5,23 Nov 2017,Mick,"Easy setup, worked as expected. Going to get an outdoor one next week.",Great security camera with sharp pictures.
Google - Nest Cam Indoor Security Camera - Black,1,5,23 Nov 2017,apatel423423432,Best camera out there on market. Easiest to setup and most stable app to use.,Easy to setup and good video quality
Google - Nest Cam Indoor Security Camera - Black,1,5,23 Nov 2019,Nannicam,"Simple to understand instructions made me feel like I knew what I was doing. Even though this was my first time with camera and internet technology. Yes I know basic things like down loading app, or the difference between a wi-fi or a modem. But was not comfortable at first. It’s all good now :))",Easy set up for myself. Not a tek savy.
Google - Nest Cam Indoor Security Camera - Black,1,5,23 Nov 2017,Javrodriguez,"Easy setup, plug and play. Good clarity when reviewing captured video.",Peace of Mind
Google - Nest Cam Indoor Security Camera - Black,1,4,23 Nov 2017,kendelmc1,This is a solid build camera with good specs. Easy to setup. Costs $$ for cloud recording which is big negative,Great quality camera easy setup
Google - Nest Cam Indoor Security Camera - Black,1,5,23 Nov 2016,edtech,This camera is extremely easy to set and get running. Provides a perfect picture of the area being monitored. Works exactly as advertised.,Perfect as baby/pet monitor
Google - Nest Cam Indoor Security Camera - Black,1,5,23 Nov 2016,Country,Easy set up great pictures easy to use.............,Love
Google - Nest Cam Indoor Security Camera - Black,1,5,23 Nov 2016,beaufrusetta,"Purchased this camera about a month ago and love it! It was super easy to setup, using it is dead simple, and the picture is crystal clear!",Great Camera
Google - Nest Cam Indoor Security Camera - Black,1,5,23 Nov 2018,Javier,"I purchased this camera to keep an eye on our cats while away on vacation. It has a large angle view (I think 130 degrees?) of the room you are monitoring. When the lights are on the camera provides full color views that are crisp and have good resolution. When at night (or the lights are out and it's a bit darker), the camera switches to infra-red mode and everything is black and white. So you can still monitor activity even at night.",excellent security camera
Google - Nest Cam Indoor Security Camera - Black,1,5,23 Aug 2020,TomL,Very reliable easy to use. Good pix quality nice safety item for elderly,Perfect
Google - Nest Cam Indoor Security Camera - Black,1,5,23 Mar 2020,Kingy,These cameras are the easiest to set up .. can move around and the app has good service if there is a problem,These are the best cameras
Google - Nest Cam Indoor Security Camera - Black,1,5,23 Nov 2016,Sueanrick,Easy to use gives great picture . Think I have a ghost in my house we keep seeing something on the video during the night.,Easy set up
