product,verified,rating,date,author,content,title
Google - Nest Cam Indoor Security Camera - Black,1,5,23 Nov 2018,Johns00,"This camera offers free cloud storage, 2 way voice communication, and multiple camera display from a single app screen. No other competing brands allow this or can match the quality and price point",Best features for the cost
Google - Nest Cam Indoor Security Camera - Black,1,5,23 Nov 2019,Snorlax,Super good quality and works like a champion exhale campion,Excellent
Google - Nest Cam Indoor Security Camera - Black,1,5,23 Nov 2018,Kristin,I’ve been contemplating buying this for months and I’m happy I finally did! I feel at ease now knowing I can check in on the house from time to time especially when I have deliveries being made.,Great!
Google - Nest Cam Indoor Security Camera - Black,1,5,23 Nov 2019,Crana,"Very useful, very effective versatile easily managed through App",Very useful quite effective
Google - Nest Cam Indoor Security Camera - Black,1,4,23 Nov 2017,cbj123,Works great. To use through a window you must turn off the night vision or the reflection of the infrareds will blind the camera. Requires monthly subscription for online backup of video.,Great product
Google - Nest Cam Indoor Security Camera - Black,1,5,23 Nov 2019,jlpezr,We use this camera everyday to keep an eye on our baby and nanny (and doggy). We could not live without it anymore!,Great camera to keep an eye on baby & nanny
Google - Nest Cam Indoor Security Camera - Black,1,5,23 Nov 2017,Bugs17,I had a single NEST cam given to me as a present and the set up was so easy - I bought the 3 pk and expanded my network - can see real time from wherever I travel - or can pay for a DVR subscription - really is a deal!,Plug & play instant security!
Google - Nest Cam Indoor Security Camera - Black,1,5,23 Nov 2019,JoJo,"Works great, no problems at all. Easy and convenient",A+
Google - Nest Cam Indoor Security Camera - Black,1,5,23 Nov 2016,Rm32828,I didnt think it was going to be so easy setting this cam up and the quality was going to be so good also. I dont need the monthly subscription and i also think its a a bit pricey but not a deal breaker. Go ahead and buy it!! You wont be sorry. We use it to monitor our puppy.,Better than Expected
Google - Nest Cam Indoor Security Camera - Black,1,5,23 Nov 2019,Littlerockgal,Nest is a good product and the quality is good inside with good pictures.,Great camera
Google - Nest Cam Indoor Security Camera - Black,1,5,23 Nov 2019,Christian,Just installed this and so far everything is working fine. the nest app has been helpful and cannot complain. Thank you,Security
Google - Nest Cam Indoor Security Camera - Black,1,5,23 Nov 2017,Robocop,It's a great camera. I give it 5 stars for the quality and the back up. The only con that this camera has is that you have to pay for a subscription to store the recorded files on their cloud drive. Other than that it's great. I say 9.5/10!,Good for all uses
Google - Nest Cam Indoor Security Camera - Black,1,5,23 Nov 2019,Briggie,Great product very useful on the go! Recommended!!,Excellent
Google - Nest Cam Indoor Security Camera - Black,1,4,23 Nov 2016,Rach,"I love this! I keep it focused on my front door and know when my kids come and go and with who they do so. I've recently bought one for my living room, two children's room and my husbands car. I can now see what everyone in my family is doing at all time. I love being able to spy on them as I please without them knowing!",Really cool
Google - Nest Cam Indoor Security Camera - Black,1,5,23 Nov 2017,nestawemsome,"All of the nest products are easy to use and integrate, I have the thermostat and cameras at my work, and got the same for my house, i can toggle between both locations very seamless.",nest is the best
Google - Nest Cam Indoor Security Camera - Black,1,5,23 Nov 2019,Shanabela,I received one for Christmas as a gift and loved it. Decided I needed another one. Works great with the app and WiFi. Nest is the best so for.,I love it.
Google - Nest Cam Indoor Security Camera - Black,1,5,23 Nov 2019,Maaa,Definitely recommend these cameras. Great quality and great price,Great camera
Google - Nest Cam Indoor Security Camera - Black,1,5,23 Nov 2018,Westcoastsharpshooter,Great little camera bought it to keep tabs on my 86y/o mother. She feels much safer with it keeping an eye on her. She waves to the camera and says good morning.,Great Mommy Cam
Google - Nest Cam Indoor Security Camera - Black,1,5,23 Nov 2019,tome,good for around the house seams to be doing a good job,does the job
Google - Nest Cam Indoor Security Camera - Black,1,4,23 Nov 2016,jmill75,Overall its a great device. Only negative there is a monthly fee if you want to save video. There are options that do not cost anything available for the same price.,Great Webcam but...
Google - Nest Cam Indoor Security Camera - Black,1,5,23 Nov 2016,TECHGUY,These are by far the best wireless cameras i have ever installed!!! the setup couldn't be easer and the quality is top notch !!!! They look a little funny but a great pick for an indoor or even outdoor camera with he right enclosure.,AMAZING!!!!
Google - Nest Cam Indoor Security Camera - Black,1,5,23 Nov 2018,Ninja,I’ve put this camera to the rest on more than one occasion And it passes with flying colors each time. Two thumbs up,Best camera out here
Google - Nest Cam Indoor Security Camera - Black,1,5,23 Nov 2016,Susyq,"Love how easy it is to connect to my phone! It alerts me if there is movement (that can be taken off) and I can click to see what it is. Having a dog at home while I work, it is a great way to know that everything is okay while I'm away.",Great product!
Google - Nest Cam Indoor Security Camera - Black,1,5,23 Nov 2019,Mackersheap,Works really good. Good quality and easy connection.,Good Product
Google - Nest Cam Indoor Security Camera - Black,1,5,23 Nov 2017,COX4,"So far, so good! We are having our home remodeled so I bought this to keep an eye on the contractor and I absolutely love it! Would highly recommended. Quality is amazing too!",LOVE IT!
Google - Nest Cam Indoor Security Camera - Black,1,5,23 Nov 2017,Sup3rtallpaul,I bought this to use as a baby monitor for our first child and it hasn't disappointed. It can be a little touchy at times but that's because I have the sensitivity all the way up.,Great baby monitor
Google - Nest Cam Indoor Security Camera - Black,1,4,23 Nov 2015,Snic,I took a gamble on the nest thermostat over a year ago and wow it has saved me money! I then added the smoke alarm and loved the compatibility. I'm glad I waited for nest to introduce their camera and feel comfortable upgrading to these smart products that all link together and that I can control from anywhere!!!,Third nest product for my home!
Google - Nest Cam Indoor Security Camera - Black,1,5,23 Nov 2016,SdotPatel,"Bought 6 of these cameras in addition to the 2 I already had. Very easy to setup and provide great features and integration with the nest thermostat and smoke detectors I also have all over the home. 

Would highly recommend",Great cameras for the home
Google - Nest Cam Indoor Security Camera - Black,1,4,23 Nov 2016,macnewbie,"Pros:
-Easy to setup and get running.
- Nest app has a clean interface and very response.
- Lag is been live and broadcast video is minimal
- History feature is easy to use
- Motion & sound detection is good.

Cons:
-The unit gets pretty hot and needs good ventilation
- Cloud storage is not free.",Great DIY security camera
Google - Nest Cam Indoor Security Camera - Black,1,5,23 Nov 2018,techgirl1,Just needed one camera for my apartment and this is a great option. No hub needed. Plug in and connect it to WIFI.,Great camera without needing a hub/extender
Google - Nest Cam Indoor Security Camera - Black,1,5,23 Nov 2019,TexTech,Best is the best. Is compatible with Amazon Alexa!,Great camera
Google - Nest Cam Indoor Security Camera - Black,1,5,23 Nov 2017,Samsung,"Pros: Real time notifications of activity/persons in the house, the microphone is a great benefit, it's fun to see what your dog does when you're not home
Cons: You have a monthly subscription of $10 a month or $100 for the year if you want the notifications and feed saved for up to 10 days.",Get rid of your old security system!
Google - Nest Cam Indoor Security Camera - Black,1,5,23 Nov 2019,Rewind,"Use this to watch dogs remotely 
Works very well had three others from different manufactures that did not work as advertised",Great camera we like
Google - Nest Cam Indoor Security Camera - Black,1,4,23 Nov 2017,h4mbone,"I am overall pleased with the product. My only quarrel is that you have to zoom and set the focus to a specific depth in order to have the quality desired.
If you want a no touch always nice quality without the need to manually zoom, you may want to look into the Nest IQ. I am very pleased with that product, as it was a nice upgrade from this model.",Decent Quality when digital zoom is set properly
Google - Nest Cam Indoor Security Camera - Black,1,5,23 Nov 2019,Erik,"Amazing product 
Perfect camera for my store 
Works well",Amazing
Google - Nest Cam Indoor Security Camera - Black,1,5,23 Nov 2019,Dmerritt,Love this camera. We use it as a baby monitor and it alerts us and gives a short clip of what happened.,Great product
Google - Nest Cam Indoor Security Camera - Black,1,5,23 Nov 2019,GREATLAPTOP,you can beat the nest camera for smart features and look . could be a little easer to install Ring has the market cornered on that one.,AMAZING CAMERA
Google - Nest Cam Indoor Security Camera - Black,1,5,23 Nov 2018,MommaMia,"I carefully read the reviews and decided the Nest Cam was for me. It was easy to set up, even for an older person. I positioned the camera in an inside window but faced it outside so I can keep an eye on my property. Great resolution and great camera!",First security camera purchase
Google - Nest Cam Indoor Security Camera - Black,1,4,23 Nov 2019,Shopper,Cameras were ez to connect to my WiFi and set up.  I would give them a 5 but the night vision is not as clear as I expected.,Ez set up
Google - Nest Cam Indoor Security Camera - Black,1,3,23 Apr 2020,Chuck,This is the 2nd camera that I have had from next.  The first was storm damaged in a hurricane.  I was hoping there would be some significant upgrades but it is about the same.  Adequate.,Provides basic features but is fairly expensive.
Google - Nest Cam Indoor Security Camera - Black,1,5,23 Nov 2017,Misti,"I love my Nest camera. It picks up even the slightest sound and any and all activity. It alerts me immediately of a sound, seeing a person, notice of activity, etc. It also stores the video. You can open the app on your phone and view your home live at any time.",Love it!
Google - Nest Cam Indoor Security Camera - Black,1,5,23 Nov 2016,Goldgoode,"This product is well designed from both a functional aesthetic viewpoints. The packaging, instructions and installation are exceptionsl. If you encounter difficulties, there is competent support available through Nest.",Elegant design
Google - Nest Cam Indoor Security Camera - Black,1,4,23 Nov 2019,jdWOW,Good deal for three Nest cameras. I like the peace of mind of being able to keep an eye on multiple rooms of my home! The app makes it easy to view the feed from all of my Nest cameras.,Great deal for the package
Google - Nest Cam Indoor Security Camera - Black,1,5,23 Nov 2019,Shama,I love this nest camera it’s so convenient we can monitor from phone,I use this nest camera every where my home busines
Google - Nest Cam Indoor Security Camera - Black,1,5,23 Nov 2018,Shooter,Nest cam is number 1 in my book. Owned these cameras for years now and can’t say enough about the performance. Love the notification when camera detects activity. I feel so much safer with the cam notification I dropped my ADT alarm system.,Great cameras
Google - Nest Cam Indoor Security Camera - Black,1,4,23 Nov 2019,SLIDER18,"I liked this at first but realized it’s overpriced. And on top, you have to buy the storage in the cloud for a monthly subscription. Is 200$ not enough? The only benefit is you can zoom with the camera.",Overpriced.
Google - Nest Cam Indoor Security Camera - Black,1,5,23 Nov 2018,Keith,"When the NEST camera's go on sale, it is worth getting them. They're very reliable and the cloud service offers 10gb of free storage. Note, there is a trial for their premium services. Good for elderly and two way communication",NEST is definitely is a worth buy
Google - Nest Cam Indoor Security Camera - Black,1,5,23 Nov 2017,Pixie,"We had security camera through our security system and the quality was always just 'ok'. The Nest camera has a better quality picture, is super easy to install and I like getting an automatic notice if it picks up anything in any of our security zones. I also love that I can look back at earlier footage.",Love the Nest camera.
Google - Nest Cam Indoor Security Camera - Black,1,5,23 Nov 2018,RyanT,This was my first wifi camera when I was looking to get rid of the home alarm system 2 years ago. I still love it. Nest makes it easy. You leave the house and it does exactly what it's supposed to do.,Best of the bunch
Google - Nest Cam Indoor Security Camera - Black,1,4,23 Nov 2017,TJames88,I knew buying these cameras that the subscription was necessary and I was fine with that. The quality is good as well as a lot of the features. The only complaint I have is the activity zone notification don't work 100% of the time.,Great Cameras
Google - Nest Cam Indoor Security Camera - Black,1,4,23 Nov 2016,GDub,"My newborn just lays at night listening to soft classical music and the nest can in his room with the pure guardian elite hour ultrasonic humidifier, he is great and I hear little peeps out of him, I have a constant eye on my son with a great picture to I might add depending on your wifi speed.",Great for newborns
Google - Nest Cam Indoor Security Camera - Black,1,5,23 Nov 2016,ProfX,"Works better than the Samsung version as it wireless.
One shouldn't have to pay for a service to access the recording though.",Great
Google - Nest Cam Indoor Security Camera - Black,1,5,23 Nov 2018,Myooran,This camera is unbelievable and made by a company I like. I love the motion alerts i get especially to see what my pets are up to,Love this Nest Indoor camera
Google - Nest Cam Indoor Security Camera - Black,1,5,23 Nov 2016,TPSreports,"Picked this after looking at comparable items, and seeing that is basically the only option promoted by Apple for being compatible with their new home automation protocol. Set up took no time and it's worked flawlessly for over a month.",Works exactly as expected
Google - Nest Cam Indoor Security Camera - Black,1,4,23 Nov 2015,WatchfulEye,"So far, really love the camera. Took a little longer than the 60seconds advertised, but that was mostly because of logistics of placing the camera where I wanted it. The o my thing that it is missing is a pan/tilt feature to scan the area like other cameras, but the fish-eye lens does a great job with the area!",Only missing one frature
Google - Nest Cam Indoor Security Camera - Black,1,5,23 Nov 2017,Doctorsmile,It's great to be able to see what's going on at home. I have had other camera systems but nothing like the nest. You have audio in and out. Get notifications and be able to see live. Priceless,Now I can see what's going on at home
Google - Nest Cam Indoor Security Camera - Black,1,5,23 Nov 2019,Mason19,Not interest in writing more it’s great did the job and I can scare my dog with it,Love it - keeps people out of my room
Google - Nest Cam Indoor Security Camera - Black,1,4,23 Nov 2019,Ladymancer,"The app is a bit buggy sometimes, but overall it's a great camera.",Overall a solid camera
Google - Nest Cam Indoor Security Camera - Black,1,5,23 Nov 2015,Momof4,This was my first attempt at setting something like this up and it was quite easy! I am not a techie by any means and I got the job done.,Beginner user
Google - Nest Cam Indoor Security Camera - Black,1,5,23 Nov 2018,Ansoochul,This is my 2nd Nest cam. Works well as expected. Nest aware free trial is for 7 days. I will subscribe when I have kids later.,Great camera
Google - Nest Cam Indoor Security Camera - Black,1,4,23 Nov 2016,Notatechie,"I love the ability to see what's going on, but disappointed in having to pay $200 annually to have the video recorded. Had I known that cost was associated with this product, would have invested a bit more and had in home storage instead of having to pay for cloud based recording",Great views....but
Google - Nest Cam Indoor Security Camera - Black,1,5,23 Nov 2019,Watch,Works great as a baby monitor. Love how it can be used after,Camera
Google - Nest Cam Indoor Security Camera - Black,1,5,23 Nov 2016,nebo,"I highly recommend this camera for several reasons. It has adjustable pixel count to accommodate internet connection via satellite up to the high speeds connection some people have access to. It has off site recording available at different rates or the choice to not use off site. It has magnetic base or hard wired base making it easier to find a spot to install. It still can be removed from the hard wired base and moved. It covers a large area allowing you to use one camera where some brands would require 2 or more. It is easy to install with out professional help. The picture is very clear and you can enlarge hard to see spots. The indicator light can be turned off to not call attention to it's location. It is completely compatible with so many brands of smart phones not just Apple products. The voice availability makes it perfect to talk to pets or kids with the push of a button. Although I am not using the automatic away feature, it is nice to know it is available. I am sure when I submit this I will think of several other reasons that I forgot to mention.",Nest Cam. Compared a long time before making this
Google - Nest Cam Indoor Security Camera - Black,1,5,23 Nov 2017,EBoogie,The camera's are awesome. I have it set-up for indoor and outdoor activity. They work well in the night time as well. I plan on buying some additional camera's for another home of mine.,Great Camera
Google - Nest Cam Indoor Security Camera - Black,1,5,23 Nov 2018,JPW1784,Just as everyone else has said. Sometimes there are intermittent signal. But it is so nice to be able to look and see what those doggies are up to.,Works great!
Google - Nest Cam Indoor Security Camera - Black,1,5,23 Nov 2017,Young,"Very good indoor camera, good low light capabilities and not a bad microphone. However, Nest needs to provide more mounting options for the camera vice having to find cheap after market items.",Good Camera
Google - Nest Cam Indoor Security Camera - Black,1,5,23 Nov 2016,Moc247,These are pricey but worth it. It's great to be able to check the cameras remotely with ease via smart phone.,Worth the money
Google - Nest Cam Indoor Security Camera - Black,1,5,23 Nov 2019,klasse09,This works perfectly to watch any movement while im out of town,Love this
Google - Nest Cam Indoor Security Camera - Black,1,3,23 May 2020,pp2531,"Disappoint, this was return. Bought the Arlo Ultra for 4K feature.",Google Nest Cam
Google - Nest Cam Indoor Security Camera - Black,1,5,23 Nov 2017,Nathan,"Allows me to keep an eye on my dog, know when he's barking, interact with him so he stops barking, and lets me know when someone (hopefully always the girlfriend) enters my apt.",Does it's job well
Google - Nest Cam Indoor Security Camera - Black,1,5,23 Nov 2017,Relly,"I have an alarm system for my home already, but when I’m not at home I can see where my dog is at all times by the motion alerts that go directly to my phone.",Great Purchase
Google - Nest Cam Indoor Security Camera - Black,1,5,23 Nov 2018,CharlieBean,"The product is great to work with, I have four of them in the house , the thermostat, and two smoke detectors, they work together with great ease.",This one is the forth one I got for the house
Google - Nest Cam Indoor Security Camera - Black,1,5,23 Nov 2017,JG27,Love our Nest system and added an indoor camera for our nursery! Very pleased with the quality and ability to talk back through the Nest App & camera!,Great indoor camera!
Google - Nest Cam Indoor Security Camera - Black,1,4,23 Nov 2019,Paul,Looks like a good camera for beginners. This should work fine.,Great camera for beginners!
Google - Nest Cam Indoor Security Camera - Black,1,5,23 Nov 2019,Hktl,Great way to check in on the house or different rooms while at home or away.,Great home cam
Google - Nest Cam Indoor Security Camera - Black,1,5,23 Nov 2016,iam4in,"First time buying Nest Cameras, Nice picture, decent sound. I only wish that you could view without going through Nest Site. Have Several DLink cameras and I can View them via web Browser instead of the web site.",Nice Camera
Google - Nest Cam Indoor Security Camera - Black,1,3,23 Nov 2019,Chris,"Cameras work great and are easy to connect.  However, the advertisements are misleading in indicating that you can use without an expensive subscription.  You cant really review video at all without a $50 subscription per camera.",Worthless without a $50 Subscription per Camera
Google - Nest Cam Indoor Security Camera - Black,1,5,23 Nov 2018,Reyrey,"By far the best security cameras I have used . Tried to be a cheap skate and order some off of amazon , big mistake.",You're the best! Around!
Google - Nest Cam Indoor Security Camera - Black,1,4,23 Nov 2015,UIMB,The camera is nice and slick but getting the subscription to the video backup is quite expensive. $100 for the year of ten day backup. I don't know that I will keep it.,Good product but expensive subscription
Google - Nest Cam Indoor Security Camera - Black,1,5,23 Nov 2018,Chloie022,Installation was way easier than my previous ones. I’ve had the old insteon cameras and the d-link hd and by far the nest outranked them both,Best Cam I’ve had so far
Google - Nest Cam Indoor Security Camera - Black,1,5,23 Nov 2018,Coleman,"Great purchase works smoothly and helps me check on my toddler in the other room, the talk feature works great and video quality fits my needs.",Great camera to monitor indoors
Google - Nest Cam Indoor Security Camera - Black,1,5,23 Nov 2019,Sesn,Good cheap realiable cam Recommended for basic indoor use,Good cheap realiable cam
Google - Nest Cam Indoor Security Camera - Black,1,5,23 Nov 2018,Psuman,This is a fantastic indoor camera. Great for keeping an eye on the kids when you are gone.,Awesome camera
Google - Nest Cam Indoor Security Camera - Black,1,5,23 Nov 2017,johnb,"I've installed two NEST indoor cameras in two separate houses, both of which operate flawlessly. Navigation between the two sites is very easy with the Android app. Very impressive product!",NEST Products are truly impressive!
Google - Nest Cam Indoor Security Camera - Black,1,5,23 Nov 2017,TomBenoit,This replaced a previous camera from a different vendor. It has been reliable and high quality from the beginning. I wished I had purchased NEST originally.,Best I have used
Google - Nest Cam Indoor Security Camera - Black,1,5,23 Nov 2017,Gat79,Had a burglar come through my house and this caught everything on video. The online services were great and i was able to show the po-po what happened to lead to an arrest. Great product,Love this
Google - Nest Cam Indoor Security Camera - Black,1,5,23 Nov 2018,Jeramie74,The security of knowing if there is movement near one of these cameras is very comforting. Not to mention being able to watch from your mobile device,Great camera
Google - Nest Cam Indoor Security Camera - Black,1,4,23 Nov 2017,Bill,The speaker on this camera is not very loud and there is no way to adjust volume up. If someone was breaking in there is a great possibility that they could not hear me if I was letting them know they are being recorded,The speaker is too low
Google - Nest Cam Indoor Security Camera - Black,1,4,23 Nov 2016,RC12102,We use it as a baby monitor for our daughter . It works well for that purpose since we just leave it up on an old ipad. It does time out occasionally but not sure whether that's the camera or the internet connection we have.,Nice camera at this price
Google - Nest Cam Indoor Security Camera - Black,1,4,23 Nov 2019,Sweetcheeks,The only done side is when the power goes out or the wifi is down all the cameras have to be recanted to be useable again.,Good cameras
Google - Nest Cam Indoor Security Camera - Black,1,5,23 Nov 2019,Nestman1,"This cam is easy to install, has high sensitivity, and can record/save images.",Highly satisfied
Google - Nest Cam Indoor Security Camera - Black,1,5,23 Nov 2015,Thefoodie,Works well through Wi-Fi. I have cameras on the West Coast and East Coast and they work awesome together. The quality is outstanding.,Great camera
Google - Nest Cam Indoor Security Camera - Black,1,5,23 Nov 2017,Pinky,Great camera love it it does everything I want to see I could see if a package comes and it's on the floor it's great great item I would recommend it to anybody,Love it
Google - Nest Cam Indoor Security Camera - Black,1,5,23 Nov 2016,Prkrbzn,We vacation a lot and this works great for keeping an eye on pets and also when our security company advises an alarm was set off! We can check and see if it was just a storm or the cats knocking something over!,Great for pets and false alarms!
Google - Nest Cam Indoor Security Camera - Black,1,4,23 Nov 2019,Bluesguy,Better performance and better software.  Great resolution too.,Better that Logitech Circle it replaced
Google - Nest Cam Indoor Security Camera - Black,1,5,23 Nov 2019,Review,"Great camera to keep track of what, when and how something happened.",Great camera
