product,verified,rating,date,author,content,title
Google - Nest Cam Indoor Security Camera - Black,1,5,23 Nov 2017,Apco25guy,"I absolutely love nest, and their products. This is a perfect camera for someone who wants to set it and forget it. And her face is great. Does exactly what you needed to do. Set up is easy I absolutely love nest, and their products. This is a perfect camera for someone who wants to set it and forget it. And her face is great. Does exactly what you needed to do. Set up is easy.",Love Nest!
Google - Nest Cam Indoor Security Camera - Black,1,5,23 Nov 2015,ampleslady,I had heard that the dropcam was the camera to buy. When I was ready to purchase I was excited to find out that a new camera the nest cam came out. I immediately purchased. It was easy to set up and the app is awesome.,Easy setup
Google - Nest Cam Indoor Security Camera - Black,1,5,23 Nov 2017,Cooper10,Fantastic video quality and very very easy to set up!!,Great camera
Google - Nest Cam Indoor Security Camera - Black,1,5,23 Nov 2019,Cloma44,I use these to keep an eye on the kids when I’m in a different room. The picture quality is great and i love that you can hear what’s going on and also talk through the camera to whomever is in the room.,Overall great cameras
Google - Nest Cam Indoor Security Camera - Black,1,5,23 Nov 2017,Explicit,"Set up was super easy as was installation. You can set up ""Zones"" while logged on to the PC and view your camera(s) on the PC, phone, Apple TV. The ""Home/Away"" feature is great and the cameras sense the location of you phone and turn on when you leave and then turn off when you arrive. Do note that if you want to review recordings of you videos, you will need the subscription while runs at $10 for the first camera and then $5 for the next.",Nice Little Wireless Camera
Google - Nest Cam Indoor Security Camera - Black,1,4,23 Nov 2019,TheJBF,I have several of these cams at 3 different properties. Having them viewable all in one app is great and having them easily movable to other locations is convenient. Always room for improvement but I recommend for those looking for easy plug and play use.,Easy to use and manage
Google - Nest Cam Indoor Security Camera - Black,1,5,23 Nov 2017,Stevaroo01,"I have several of these, and they are great cameras! I really love Nest products, and these are no different. They provide high quality video, the option to record to the cloud, notifications of motion, person recognition, or sound if desired, and easy viewing through the Nest app. They're a little spendy, but this is a case of ""you get what you pay for"" in my opinion. I've tried a variety of other brands that cost less, but none of them worked nearly as well. I recommend these if you can afford it!",Great cameras!
Google - Nest Cam Indoor Security Camera - Black,1,5,23 Nov 2019,Primetime35,We have been extremely pleased with our Nest Cam. We use it in our young son's nursery and love the clarity of the picture and our ability to view it on all of our devices (from iPhones to Echo Show). We will be adding more Nest cameras as time goes on. We are satisfied. Period!,Great for our nursery
Google - Nest Cam Indoor Security Camera - Black,1,5,23 Nov 2019,Regina,Purchased for security of my elderly mother  has been perfect for our needs. Installed by Best Buy the day after purchase and no issues with the system since. I would highly recommend this product.,Perfect for indoor security
Google - Nest Cam Indoor Security Camera - Black,1,4,23 Nov 2017,SS5280,The picture on the camera is great and the viewing of the camera through the Nest app is simple and straight forward. Set up was a breeze. The camera does seem to give false motion detection pretty consistent. For some reason the devise keeps detecting light reflection on our interior wall from cars driving by the house. Also if we leave our dogs out it will pick up when one jumps on the couch but that is somewhat expected. It would be nice if there was at least a one or two hour free feed instead of just getting live feed as the free option.,Pretty good but has some flaws
Google - Nest Cam Indoor Security Camera - Black,1,5,23 Nov 2019,Mjwalker,I love the nest cameras. I use them for home security and for my nanny cams. I get alerts to my phone when there is movement and can see what is happening in “real time”. The best system is easy to use. I have peace of mind knowing I can see what is happening in my home anytime I like.,Best cameras
Google - Nest Cam Indoor Security Camera - Black,1,5,23 Nov 2016,EdOB,"I have some Lorex webcams. They are very good. Both NEST and Lorex recover well from the wi-fi being interrupted. That's important if you're away and can't reboot the webcam. The NEST has a stunningly clear wide angle view that puts the whole room in view. Both work well in the dark, too.

The NEST app is far far more responsive than Lorex PING app.

The Lorex will record events to a local SD card, but playback remotely is iffy and very slow. NEST is outstanding and fast, but costs $10 a month. That's a lot, but it very stable and fast.",Great Wide Angle and Responsive App
Google - Nest Cam Indoor Security Camera - Black,1,5,23 Nov 2019,FurMom,"I bought this camera to watch my dog and communicate with him when I was out. Set
Up was easy and took only a few minutes. I had purchased a trio of cameras and was able to set the extras up in another home.",Great camera and easy to set up
Google - Nest Cam Indoor Security Camera - Black,1,4,23 Nov 2016,Secureone2,"This Nest camera works well and has an excellent camera. My internet fiber (956 download and upload speed) is really robust. The sound is two way, but even with a robust Internet, the sound is delayed. That's nota problem for me. What I don't like is no free five or ten gig storage. You have to pay to playback history. I would recommend this camera if you don't need playback of history or have money to make Nest very happy.","Love the camera, great picture"
Google - Nest Cam Indoor Security Camera - Black,1,4,23 Nov 2018,Gamers101,These cameras and great and easy to use. Easy to set up and add to your phone via Nest app. I am only rating it 4 starts instead of 5 because of the Nest Subscription. Nest charges up to $300 a year for a single camera which is outrageous. Ring charges a flat rate for unlimited. Nest look into doing that because I will be switching to ring shortly due to the substantial subscription savings. Other than that the cameras are wonderful.,Great quality & User friendly
Google - Nest Cam Indoor Security Camera - Black,1,4,23 Nov 2019,GailMM,Camera works great. I use to monitor inside my home when I go to work while my elderly Dad is at home. It brings me great relief. Ease of set up was good. My only complaint is the annual fee for storing history of videos seems steep per camera. Otherwise would have given 5 stars!,Very Satisfied
Google - Nest Cam Indoor Security Camera - Black,1,5,23 Nov 2017,Brenny,Looked at several options and read many reviews before picking this the Nest and this version. The sound and quality is excellent. Simple to setup and easy to link it to Nest account. Nest really simplifies the whole process. Can check the camera’s live feed even while traveling outside the country and it was crystal clear and no delay. Only cosmetic complaint is the white cord. Would prefer the option of black as well.,Works like a charm...getting a 2nd one
Google - Nest Cam Indoor Security Camera - Black,1,5,23 Dec 2019,Dank,"Easy to setup, love the app. Haven’t really had any issues with them yet which is important for this kind of thing.",Nest is the best
Google - Nest Cam Indoor Security Camera - Black,1,5,23 Nov 2019,GilC2019,Bought this for my son and his wife... they have two girls that play in the back yard (fenced yard and secure) so they could feel that much better when they were outside.,Great gift
Google - Nest Cam Indoor Security Camera - Black,1,5,23 Nov 2019,DantheMan1801,"We continue to add more Nest products to our other cameras as they pretty much just plug and play. Also, their support staff is second to none when questions or issues need to be addressed.",Easy to set up and quality is very good
Google - Nest Cam Indoor Security Camera - Black,1,4,23 Nov 2016,nwarren82,I was looking for a camera system that could help me keep an eye on my house and dog while I was away. The Nest camera also hooks up to my other Nest products on the same app which is a nice little bonus. The picture quality is excellent and the built-in speaker is a nice addition. The only complaint I have is that there is no way to record anything without an additional charge. Even a 24 hour backup would be helpful but I am not willing to pay an additional $100 per year for the convenience of a backup.,Nice addition
Google - Nest Cam Indoor Security Camera - Black,1,5,23 Nov 2017,txinhawaii,"After extensively researching baby video monitors, none had as great reviews as the nest, especially for the price. We still use our audio baby monitor because it has the temperature and movement sensors, but now we are able to have peace of mind being able to see our baby as well. The video quality is great, both in light and with the night vision.",Home security camera used for baby video monitor
Google - Nest Cam Indoor Security Camera - Black,1,5,23 Jan 2020,Gaby,These cameras work great and are super easy to install.,Useful camera
Google - Nest Cam Indoor Security Camera - Black,1,5,23 Nov 2017,Iggnyte,"I have two of these in the house and two of the outdoor Nest Cams for the front and back of the house. They are rock-solid, staying on-line almost 100%. The Nest subscription/archive service is superb. The associated iPhone app works VERY well. I wouldn't trust any other security camera. I have the Nest Thermostat and the Nest Protect. They play together very well.",Absolute best home security camera
Google - Nest Cam Indoor Security Camera - Black,1,4,23 Nov 2016,1joee,I travel a lot for work and I mostly power off All Electronics except for my router and this camera. This camera allows me to look into my home while I'm not there on my cell phone and alert me of any movements/sound. Downfall they charge a subscription for video history. They have monthly or yearly plans.,Not bad
Google - Nest Cam Indoor Security Camera - Black,1,4,23 Nov 2017,MeMe,"This camera does what I need it to do - keeps me informed of what's going on in my home. It's highly sensitive so for instance when a cloud covers the sun, I'll receive an update on ""activity"" (our front door has a good amount of glass around it). The camera does occasionally turn off for whatever reason, but it's a simple step to turn it on manually, no matter where I am.",Camera covers a large area
Google - Nest Cam Indoor Security Camera - Black,1,5,23 Nov 2019,Seth,I bought the 5 pack for my house and love these! I need to add 3 more to cover more rooms but the cameras are great. Super easy to install too!,Great cameras
Google - Nest Cam Indoor Security Camera - Black,1,5,23 Nov 2018,TechTeach,"I like the nest products with the exception of having to purchase the subscription. The camera supports many angles, has good resolution, and is becoming a little more affordable...that subscription though",Very Clear
Google - Nest Cam Indoor Security Camera - Black,1,5,23 Nov 2016,JimA,"We set up three of these cameras, had all three set up in less than 15 minutes. They work great detecting movement and sound and sending out notifications to both my wife's and my cell phones. We have one of the cameras in my Mother in Laws room who we provide care for. This allows us to be able to go into other parts of the house or outside and still be able to make sure she is OK. The other two are set up for security.",Works as discribed
Google - Nest Cam Indoor Security Camera - Black,1,5,23 Nov 2019,Tims,"Great camera, very clear.  The motion vs ""people"" detection is a big step-up from another brand of video doorbells.",Great quality
Google - Nest Cam Indoor Security Camera - Black,1,4,23 Nov 2017,Carm,The nest camera works good it dose go off line time to time but it might be because of my wifi not sure but its a good camera. I have an indoor camera that i face out my window. I wasn't able to use out door nest cam because of the cord but this works just as good. I can see people passing by and the cam always notifies me when people pass and picture seems pretty clear. One of my complaints would be when rewatching the cam its sometimes hard to see because it moves fast.,Good camra
Google - Nest Cam Indoor Security Camera - Black,1,4,23 Nov 2017,CarpalMute,"The only downfall is Nest's subscription model to keep video history. Nevertheless, the Nest cams have great image quality in both light and dark situations. The app works great and is easy to use. 

The cameras have two way audio. Meaning, one can listen and talk to individuals through the camera. Again, this works great with their app. 

If you need a good indoor camera solution, the Nest cameras are definitely something to consider.",Great image quality.
Google - Nest Cam Indoor Security Camera - Black,1,5,23 Nov 2016,tallred,"I got this camera to keep an eye on my puppy during the day AND as a back-up security program. 
The picture is very clear. It notifies me anytime there is movement. It also shows a pretty complete view of two bedrooms and the hall, much more area than I thought I would be able to see.",great camera
Google - Nest Cam Indoor Security Camera - Black,1,5,23 Jan 2020,EVCM,I really like the image and app.  Two way sound is pretty clear.,Awesome in door camera
Google - Nest Cam Indoor Security Camera - Black,1,5,23 Nov 2016,Gcubed,"My wife and I have been looking for a baby monitor for our newborn. She was leaning towards a dedicated baby monitor with a screen but I always felt the video quality wouldn't be there. We finally decided to purchase the Nest Cam. Video quality is great, but you need to have a decent high speed internet package. The sound through the camera isn't that great but does feature two way communication. Overall we are happy with the product.",Great Camera for Nursery
Google - Nest Cam Indoor Security Camera - Black,1,5,23 Nov 2019,Diane,We bought this for our house because We have been robbed before with this camera in almost every room in our home works great clear picture does it’s job.,Great Camera
Google - Nest Cam Indoor Security Camera - Black,1,5,23 Nov 2017,Nitsua666,"This was a great choice from the suggestion of a bb team member. Initally we had overlooked this sleek security camera, luckily a team member assisted us and suggested it. This camera has motion sensing technology and will send you a alert if it senses movement. It works great for us because the sensing tech works through our window allowing us to watch our land with ease",Excellent product
Google - Nest Cam Indoor Security Camera - Black,1,4,23 Nov 2016,pgurung,I have installed this camera at my baby's room and monitor him. The video quality is very good and it has night vision as well. The only thing that I do not like is that it does not give new notification within 30 minutes of the last notification. But I really do not need this feature right now. Otherwise it does everything else well.,Very decent camera
Google - Nest Cam Indoor Security Camera - Black,1,4,23 Nov 2019,evryan,"This is a great camera for a back door or someplace where the subject gets close to the lens but the resolution isn’t quite good enough for further than say 25 feet. Other than that though, awesome camera with regards to expected functionality and ease of use.",Great camera but room for improvement
Google - Nest Cam Indoor Security Camera - Black,1,4,23 Feb 2020,Montauk,Love the visibility and ease of use. Wish the sound and night vision was a little better.,Great camera
Google - Nest Cam Indoor Security Camera - Black,1,3,23 Aug 2020,Chase,Reliable. We have a few of these now and never had any issues. Decent video quality but could be better.,Decent Quality
Google - Nest Cam Indoor Security Camera - Black,1,5,23 Nov 2019,Tollcollector,The indoor Nest Cam is great!. Connects easily and generates very good quality images.It rarely goes offline but easily reconnects when it does. This is a great product and is recommended for security indoors.,Great indoor camera
Google - Nest Cam Indoor Security Camera - Black,1,5,23 Nov 2019,Msria,"This product is so dependable and met all of our expectations. It was easy to set up. We have them set up so we can watch our dog when we leave the house and know that she is safe.

Thanks Nest!",Terrific!
Google - Nest Cam Indoor Security Camera - Black,1,4,23 Nov 2016,Demecore,Camera has nice HD and the set up was straightforward. But don't buy it from Best Buy as their return policy is 15 days. So if you don't set it up right away you have very limited time to determine if you want to keep it.,Easy set up
Google - Nest Cam Indoor Security Camera - Black,1,5,23 Nov 2017,DWSinIL,This was my 5th Nest/Dropcam camera and that alone should indicate how I feel about this product. No problems. Extremely helpful for us to diagnose cat issues. The recording costs per month/year per camera is prohibitive for us so we just do the one camera and that seems to be ok. We’re very happy with this camera and recommend it.,A breeze to set up.
Google - Nest Cam Indoor Security Camera - Black,1,5,23 Nov 2019,Yesi,Everyone should invest in these cameras! So easy to use. I love the fact I can check my house and if I hear a noise outside at night I’ll just open up the app and see what’s going on.,A household must!
Google - Nest Cam Indoor Security Camera - Black,1,4,23 Nov 2016,Spd12acer,Camera is very easy to setup. App has great user interface.,Great camera and easy use
Google - Nest Cam Indoor Security Camera - Black,1,4,23 Nov 2016,BigMoneyGrip,"I bought two of these to keep an eye on my home when no one is around , they are ideal for watching the house when your not home but I do not consider them security cameras because they can't be used outdoors and are easily accessible to an intruder to remove if they enter because they are visible And they need to be connected to Internet and power so they can be unplugged and don't work if power goes out. They are high quality though. Easy to set up and install",Good camera for indoor use
Google - Nest Cam Indoor Security Camera - Black,1,4,23 Nov 2016,Vozzman,"Great recording capability, but for a price, I bought 2 of them",A gerat camera with very good picture
Google - Nest Cam Indoor Security Camera - Black,1,5,23 Nov 2019,Fortworthgooner,"I would recommend this camera for first time home buyers who are looking for home security on a budget, you can watch moment key areas of your home from your phone while being at work and you get alerted when there is some kind of movement.thats all you need for this type and camera and you can add to it if required",Perfect starting point for home security
Google - Nest Cam Indoor Security Camera - Black,1,5,23 Nov 2019,PaulM,We had someone “visit” our office and decided to get some security in case they came back. The camera takes minutes to set up and works perfectly.   Thanks Google and Nest.,Great place to start...
Google - Nest Cam Indoor Security Camera - Black,1,5,23 Nov 2019,retchief,I got this camera to watch our two dogs when we are out of the house. It has a great picture (even with low light) and we are able to talk to them if need be. It also has alerts that are sent to our smart phones if they are making to much noise and/or running around. It gives us piece of mind when we are out.,Great camera
Google - Nest Cam Indoor Security Camera - Black,1,4,23 Nov 2016,Miguel,"I love this camera; so much that I bought three of them. The yearly fee is reasonable, the quality is excellent, and the app is very user friendly (although it can be glitchy at times). Only problem is they do not have an outdoor version, or I would have given them 5 stars. You can by a Dropcase outdoor case, which I have and has worked great, but it'll cost you an extra $50-$75. I have researched many of the security cameras and found this to be the best.","Great indoor camera, but not for outdoor use alone"
Google - Nest Cam Indoor Security Camera - Black,1,5,23 Nov 2016,elitedoc,"works flawlessly, set up easy, does require a good wifi signal, some interference if you are using it in conjunction with another wifi camera system. the integration with the NEST system is flawless. great wide angle lens. sends alerts to cell phone when motion is detected. best is that it has a setting that you can select that it shuts off when nest system detects that you are home and not away.",set up with ease
Google - Nest Cam Indoor Security Camera - Black,1,5,23 Mar 2020,Mich,we can turn them off if we are going to be home for a couple days.  Great picture.,Love it
Google - Nest Cam Indoor Security Camera - Black,1,4,23 Nov 2016,memphis4nr,Was easy to set up and operate. Good image and reliably sends text messages when motion is detected. Can not view any history unless you pay ($100/year for 10 days worth or $300 for 30).,Works great. Peace of mind
Google - Nest Cam Indoor Security Camera - Black,1,4,23 Nov 2016,Hector,This is an easy security camera and simple to set up.,Easy Security Camera.
Google - Nest Cam Indoor Security Camera - Black,1,3,23 Nov 2016,TruthTeller,"Nice fast simple set up.
Camera works great as long as your Wi-Fi is working well. 
We just had some Wi-Fi issues to fix, but once we fixed that problem, we never had a issue with the camera performance.
Camera performs just as expected.",Nice simple set up
Google - Nest Cam Indoor Security Camera - Black,1,5,23 Nov 2017,NBC3,"Nest is easy to set up and works very, with neat alerts when it sees movement or a person and the ability to have it turn on/off automatically when you are in/out of the house. The remote staoragenof video costs extra but is worth it, with the first costing $100 a year for 10 days of stoarage (who needs more than that?) and each camera thereafter adding $50. The app it comes with is easy to use and updated often, an important consideration being that it is how you will likely access the cameras 99.9% of the time.",Best security camera system out there
Google - Nest Cam Indoor Security Camera - Black,1,4,23 Nov 2015,Ally,Easy to set up. Easy to hide. Hard to see detail at night.,Good picture.
Google - Nest Cam Indoor Security Camera - Black,1,4,23 Nov 2019,Tele,"Currently have a Nest infrastructure that consists of a a few cams, thermostat and aware system and wanted to add a new cam to the mix. Could not be happier with purchase set up was a breeze and working great. good quality image but gets degraded when zooming in (be aware).",Great indoor Cam
Google - Nest Cam Indoor Security Camera - Black,1,5,23 Nov 2016,Marty702,"1080 HD video outstanding for intended security use. Cloud recorded clips work perfect for review, dowloading and sharing. Third camera now gives complete outside and inside blanket protection. Not one problem setting up or using hardware and software since first camera installed. Now have ""piece of mind"" without thinking about system. Get appropriate alerts anytime anywhere. Done.",Completes Coverage
Google - Nest Cam Indoor Security Camera - Black,1,5,23 Nov 2017,JOEP,Good camera and easy setup. Also has a great picture.,Easy setup
Google - Nest Cam Indoor Security Camera - Black,1,5,23 May 2020,RyanH007,Love the Nest products. They are easy to connect and this camera is so small and easy to install.,Awesome Indoor Camera
Google - Nest Cam Indoor Security Camera - Black,1,5,23 Nov 2016,Audiophile,Simple to set-up; easy to use; nice mobile app; good value for money.,Best At Its Pricepont
Google - Nest Cam Indoor Security Camera - Black,1,5,23 Nov 2015,Ozinus,"The Nest Cam works great, being able to zoom and enhance parts of the video image is great, Also the mic and speaker are a great addition.
Perfect for security or nanny cam. I will buy another, the only negative is the $100/yr for 10 day history, I would prefer to be able to record locally also",Great Camera
Google - Nest Cam Indoor Security Camera - Black,1,5,23 Nov 2017,Madwiki,Was amazed at how clear the video was on my iPhone.,Like the features with voice
Google - Nest Cam Indoor Security Camera - Black,1,5,23 Dec 2019,tennisman,Multiple room use as I now have three Nest Cams inside and two outside.,Good Quality Camera
Google - Nest Cam Indoor Security Camera - Black,1,5,23 Jan 2020,Litopine,I use these indoors at work. They are simple but quality is a 6/10.,Simple and easy
Google - Nest Cam Indoor Security Camera - Black,1,4,23 Nov 2018,Willman,"Bought it keep an eye on the cat when I’m away. This cam is solid heavy. Mostly metal. Not, the plasticky feeling like the others on the market. You really get what you pay for in their cam. Great picture on my phone when the cats hopping on my furniture like a bad commercial. I would buy more if they weren’t 200 bucks, maybe 150. Thus the 4 of 5 stars for the price, not quality.",Solid Cam!
Google - Nest Cam Indoor Security Camera - Black,1,5,23 Nov 2019,PumpkinPie,I use it for my retail store. Disconnects from my WiFi on occasion but always reconnects and video quality is always great.,Great camera
Google - Nest Cam Indoor Security Camera - Black,1,4,23 Nov 2018,Lisa,"I was really surprised how easy this was to install and get immediate results. The images are very clear in daylight and complete darkness. The app works better on the Android phone than on the browser, as there is some delay with the browser. It is a little strange to walk out of the camera range and into the other room, look at the monitor and see yourself still in the picture.","Excellent camera, easy installation"
