product,verified,rating,date,author,content,title
Google - Nest Wifi AC2200 Router - Snow,1,5,23 Mar 2020,movielover,"I have its previous Google wifi, 3 of them to cover my house. Later I found that one in the master room had low connection strength. I looked for another Google wifi to extend it, and realized that this is the new version.
I searched how to use this with the existing Google wifi, and it was quite easy to set up the new wifi home network with existing ones. With this, the connection strength in the master room becomes quite strong.",Easy setup and powerful wifi
Google - Nest Wifi AC2200 Router - Snow,1,5,23 Jul 2020,Superman1,"Easy to set up and works  10x better than cable router. The only bad thing was that ID # on the unit was hard to see, because it was white numbers on a white base. But couldn’t be happier with the strong signal it puts out.",Nice router !!!
Google - Nest Wifi AC2200 Router - Snow,1,5,23 Oct 2020,Bosley921,Works great. Improvement over old model in speed. Easy to set up.,Easy home wifi network solution
Google - Nest Wifi AC2200 Router - Snow,1,5,23 Sep 2020,Queensgeek,Easy setup via the Google Home app.  Put in place fire up your app create your network and walk away.,Set up and walk away
Google - Nest Wifi AC2200 Router - Snow,1,5,23 Aug 2020,JC55,Easy to install. Name your network anything. App makes it always available. Spectrum speed is off the charts. No more lags or buffering I had with stock router.,Very very nice!
Google - Nest Wifi AC2200 Router - Snow,1,5,23 Jul 2020,Saltykarmel,"Had the older one and the WiFi would act up. I love this one, it has more power and a stronger signal. Not to mention it looks nice. Easy to connect and set up. A bit pricey, but you get what u pay for.",Strong signal
Google - Nest Wifi AC2200 Router - Snow,1,3,23 Sep 2020,techHead,"I purchased this to replace the standard issue wifi router I received from my internet provider.  The speeds are impressive and the Home app allows for more control of the router than what I had with my previous.  It will reduce speed and need to be reset every couple of months which I am not sure of why.  I expect more from a Google device that is the heart of the Google Home network, which why my rating is lower.","good range, needs to be reset often"
Google - Nest Wifi AC2200 Router - Snow,1,5,23 Aug 2020,GrouchyChameleon,"Got the new version because we maxed out the original.  New one handles  all out lights, switches, outlets and nest with no problems.",Strong enough for smart home
Google - Nest Wifi AC2200 Router - Snow,1,5,23 Oct 2020,hmerr14,"Our WFH internet speed wasn't up to par with our usage, so we did a little updating and the Google Nest Wifi Router was perfect for our system! First, we ditched our ISP Modem for a higher capacity one, then we added the Google Nest. In our 2-story townhouse, the router worked great without needing a second ""point"" - even with one of us gaming and the other streaming videos. If you're already familiar with the google system, this is the perfect addition!",WiFi Running Better than Ever with Google Nest
Google - Nest Wifi AC2200 Router - Snow,1,5,23 Aug 2020,JayRo,Setup was a breeze. Strong wifi coverage all over the house. Easy to add additional modes for every more coverage. Highly recommended!,Super easy. Works great!
Google - Nest Wifi AC2200 Router - Snow,1,5,23 Jan 2020,Jason411,I love this router. It broadcasts the signal nicely around our home and it has the 2.4 and 5.0 signals to choose from. The Google WiFi app helps you prioritize the device you'd like and let's you know what devices are using up the most WiFi. Love it,Great and efficient router
Google - Nest Wifi AC2200 Router - Snow,1,5,23 Jul 2020,ilovefssttwifi,"look is great, set up is easy, and love that you can manage which devices should get ""prioritized"" for bandwidith while easily checking for any hidden wifi-sucks across the home",Easy + Effective Router
Google - Nest Wifi AC2200 Router - Snow,1,5,23 Aug 2020,Joan,Connection is great thus far and the setup process was so easy and stupid-proof. Practically just plug in and go.,Super easy setup
Google - Nest Wifi AC2200 Router - Snow,1,5,23 Mar 2020,acideo,"The Google Wifi was extremely easy to set up, and the improved router service is a breath of fresh air. If you don't already have Google Assistants feel free to add on a Wifi point because it has assistant capabilities. The ability to suspend service to devices and test the service speed are very nice features",Fantastic Wifi experience!
Google - Nest Wifi AC2200 Router - Snow,1,5,23 Jul 2020,AV007,"I had the older Google WIFi (3 mesh points). And wanted to upgrade to a better router. At beginning I was told they weren’t compatible but they are, and the setting up it’s quite easy.",Great improve on network coverage.
Google - Nest Wifi AC2200 Router - Snow,1,5,23 Jul 2020,Tyler,I love this router! The set up was super quick and the google home app is amazing and is super customizable though your wi-if setting preferences.,Great Router
Google - Nest Wifi AC2200 Router - Snow,1,5,23 Oct 2020,Finster1130,Easy to installs connected to all my devices and Comcast right away. I’ve only had it for a month but so far so good,Great and simple!
Google - Nest Wifi AC2200 Router - Snow,1,5,23 Nov 2017,Frozenthrone,Very nice router that has massively increased my speeds and stability.,Fast
Google - Nest Wifi AC2200 Router - Snow,1,5,23 Aug 2020,Yoursweete,"This thing is fast!  My internet is rated 100/100 and I’m hitting over that.  Cable guy said if I direct connect to it that it may increase by 30%!  It’s a nice stylish, sleek design.",Stylish sleek compact design
Google - Nest Wifi AC2200 Router - Snow,1,5,23 Sep 2020,TMHM90S,Help stabilize my internet connection to my tv downstairs. A great feature is the ability to limit how many devices can share the network,Excellent Router
Google - Nest Wifi AC2200 Router - Snow,1,5,23 Oct 2020,Garrett,This nest helps a lot and the google app is really easy to use. Easy set up.,Buy
Google - Nest Wifi AC2200 Router - Snow,1,5,23 Oct 2020,George,"Needed a new router cause the one that came with my provider was crashing, this was the perfect replacement.",Excellent router with easy setup
Google - Nest Wifi AC2200 Router - Snow,1,5,23 Aug 2020,BigB,Great product worth every dime would recommend to anyone having WiFi issue within their home.,Great Product
Google - Nest Wifi AC2200 Router - Snow,1,5,23 Oct 2020,Gamer625,"This is a no frills wifi router. It works great, and the google wifi system is really nice. Super easy to set up.",Great WiFi Router.
Google - Nest Wifi AC2200 Router - Snow,1,4,23 May 2020,Laurent,"I love it! I do get some unstable signal sometimes but it is probably due to the internet service provider. This router can suck a bit more megabytes per second than your ISP is willing to give you. If you don't want to get cheated, get a powerful mesh router like this one. Be careful what modem you are pairing it with. It  is  a powerful water and deserves a suitable modem.",Great internet signal booster
Google - Nest Wifi AC2200 Router - Snow,1,5,23 Sep 2020,Srijans,It was easy to setup out of the box. I already had Google Wi-Fi points and added this as a router to work with those points. Works great.,"Easy to setup, backward compatible"
Google - Nest Wifi AC2200 Router - Snow,1,5,23 Oct 2020,Positive,My previous router was not providing the coverage I needed.  The AC2200 did the job.,Solved my issues. Setup was painless.
Google - Nest Wifi AC2200 Router - Snow,1,5,23 Oct 2020,SandyCheeks,"Somewhat easy setup, works great. Overall enjoying the product.",Google Nest Wifi
Google - Nest Wifi AC2200 Router - Snow,1,5,23 Sep 2020,sarah,"great router, better than the old school ones.  This one has great range and easy to use and modify using  the google app.  Highly recommend",excellent quality
Google - Nest Wifi AC2200 Router - Snow,1,5,23 Oct 2020,Jimjam069,"Love the way it looks, works super well, and was easy to set up with the app.",Great Router!
Google - Nest Wifi AC2200 Router - Snow,1,5,23 Sep 2020,Sadat,Great product from google as expected. Easy set up and great integration with other google nest products,Great wifi and easy set up
Google - Nest Wifi AC2200 Router - Snow,1,5,23 Jun 2020,DCConsumer,"I had the first Google mesh system, which worked wonderfully but had a few performance issues with gigabit internet. The new version has none of those issues. WiFi is now much closer to the wired speed. It’s easy to set up and use. Outstanding product.",Immediate improvement
Google - Nest Wifi AC2200 Router - Snow,1,5,23 Jun 2020,Lucas,Had serious wifi struggles with my previous router and this solved it all. Features like prioritizing devices for set periods of time is a really cool feature as well. Wish I would have gotten it on sale but very easy to setup and recommend.,Awesome router
Google - Nest Wifi AC2200 Router - Snow,1,5,23 Aug 2020,Sandy,I have a 1 bedroom apartment and it covers all the space pretty good. Works really well with my ATT fiber 1 Gbps speed. No complaints so far.,Very good so far
Google - Nest Wifi AC2200 Router - Snow,1,2,23 Dec 2019,Timmy,Set up is simple and straightforward. If I walk about 10’ ft away from the router my iPhone is switching to 2 ghz band without any wall between the router while my previous asus cave router is getting 5ghz all the way to my garage 25’ away and two wall.,5ghz range is very weak
Google - Nest Wifi AC2200 Router - Snow,1,5,23 Sep 2020,johncolts54,"I like the Google systems anyway and having the Google Wifi couldn't get my speeds. So researched the Nest and love it. However I chose to go with the Router 2 Packs instead of the Points.So have 4 Routers thru my home and get blazing speed. 
Best but did the price match and was happy there and got tech support to install stem.. Any one wouldn't be disappointed",Great Mesh
Google - Nest Wifi AC2200 Router - Snow,1,5,23 Oct 2020,Emily,Have had this router for months and haven’t had any problems! Super easy to setup and I love how I can control/check/ and test the speed easily on the app! If you’re getting a router this one will absolutely be your top choice,Amazing router!
Google - Nest Wifi AC2200 Router - Snow,1,5,23 Jul 2020,Puhistrain,Easy to link all your google items to each other using the interface that is provided.,Easy to setup and works well
Google - Nest Wifi AC2200 Router - Snow,1,5,23 Mar 2020,Rileyjean,This really boosted our Comcast WiFi. I highly recommend it to anyone that wants a boost to their in home WiFi. Speeds are much faster now and set up was incredibly easy,Great addition to wifi
Google - Nest Wifi AC2200 Router - Snow,1,5,23 Jan 2020,Bfour31,"I purchased this item to hopefully improve the signal quality over my older Onhub router. I was completely surprised at just how much signal quality improved and was blown away by the speed increase, it was 3X better!!!",Great boost in speed!!
Google - Nest Wifi AC2200 Router - Snow,1,4,23 Jul 2020,spray67,Works great can put one on each floor of the house and get coverage everywhere no dead spots.,great router
Google - Nest Wifi AC2200 Router - Snow,1,5,23 Apr 2020,Reedcoker,We had tons of connectivity issues with our old router. We have had zero since switching over. Easy setup great connection streaming in multiple rooms.,Easy setup
Google - Nest Wifi AC2200 Router - Snow,1,5,23 Jul 2020,2dogmama,This replaced our 15 yr old router. Set up was fast & easy! No complaints,Quick internet
Google - Nest Wifi AC2200 Router - Snow,1,5,23 Jul 2020,Cedrick,Easy to hook up and use. Great app to use and the speed has been great,Superior router
Google - Nest Wifi AC2200 Router - Snow,1,5,23 May 2020,Mister,My wifi speed and coverage improved do much I would recommend this to anyone with we I gtg I issues,My wifi speed and coverage improved do much
Google - Nest Wifi AC2200 Router - Snow,1,5,23 May 2020,MelinOC,Love it. Great coverage. Couldn't have been easier to install and set up. You can even easily set up guest accounts.,Easy to install and set up
Google - Nest Wifi AC2200 Router - Snow,1,5,23 Oct 2020,David,"This is a great router, I've had no complaints about it so far. I have the 1 Gbps Google Fiber service and this router can consistently give great speeds throughout my apartment. You don't get as many settings or options for customization as some other routers since the Google Home app is limited, but I find it does what I need it to do well.",Great little router
Google - Nest Wifi AC2200 Router - Snow,1,3,23 Feb 2020,sanman202,I have mostly all Google products and made the switch to the Google Nest from a Netgear R7000 which had firmware that you couldn't rely on any longer. I went to the Nest router due to the ease of using the Home app and setup was easy. Was it too easy is the question. The router has been good but it's suspect at times for dropped devices. Tonight in fact I leave home and my whole network went down about an hour after I left. Unbelievable! It wasn't the cable company or power outage. It was the router. This is an absolute no no. I am very disappointed with this as I've liked this router. Today you need reliability with smart home items. I may have to return it.,Want to Love It
Google - Nest Wifi AC2200 Router - Snow,1,5,23 Oct 2020,brich,"Maybe a bit overkill but each of my 3 kids have a pod in their room. With them all remote learning and my wife and I working from home, this was a great solution to make sure everyone had a strong wifi signal to get their work done. Fairly simple to configure with my Comcast modem, once configured, it just worked as expected. I can now even work remote from my backyard on nice days.",No more complaints about dropped wifi
Google - Nest Wifi AC2200 Router - Snow,1,5,23 Jul 2020,Paul,Greatly enhances internet speed throughout the house.,Router
Google - Nest Wifi AC2200 Router - Snow,1,5,23 Jun 2020,BP2020,Beautiful and easy to use with great signal throughout the house.,Nice
Google - Nest Wifi AC2200 Router - Snow,1,5,23 Dec 2019,Dude,"This router is super simple to set up and very user friendly. Easily expandable too for larger households. Does not work tremendously well with old Google WiFi points, but is an incredible package as is.",Great and powerful router
Google - Nest Wifi AC2200 Router - Snow,1,5,23 Sep 2020,BestBuyCustomer2020,"Great product!

I bought this for my apartment . I am able to use the internet anywhere in m apartment without any hassle or slowing of the internet!

This reaches very far as well!

I can be downstairs standing on the street and I will still get wifi!
That's insane but awesome.

This product is Definitely worth the price!!! I guarantee it.
I always ""rented"" routers from the Internet Service companies

but after purchasing this I will never again do that!",Google Nest Wifi Router is worth the Price
Google - Nest Wifi AC2200 Router - Snow,1,5,23 Jan 2020,Gene,I live in a 2 story house and my old router could not pick up WiFi signal in certain areas. The Nest router picks up and delivers a strong signal everywhere in the house now.,Great router eliminates all the WiFi dead spots.
Google - Nest Wifi AC2200 Router - Snow,1,5,23 Oct 2020,Lynn,I love the ease of use and setup for this router. I use it with a cable modem from my provider and it's miles better. I love the functionality. It's so easy to share the network with friends or turn it off when I need to. It also notifys me when the network goes down and how long it's been down. I love this for when I have to call my provider. I'm happy with my purchase.,Best Router I've used
Google - Nest Wifi AC2200 Router - Snow,1,5,23 Oct 2020,Rudi,Installed by Geek Squad after reviewing current smart home Ruckus and loss of internet for smarthome items in a Lennar Home. It replaced the Ruckus which continued to have loss of signal. This has been a major improvement for our other smart home items. Has worked well with no drop outs so far. It connected easily and has been easy to use. Would recommend.,Nest Wifi Router
Google - Nest Wifi AC2200 Router - Snow,1,5,23 Oct 2020,James,I used to with my ATT UVerse Fiber Modem / Router combo. The router component was pretty mediocre so I routed the connection to the Nest Wifi node instead and my wifi performance has nearly doubled.,Excellent Router
Google - Nest Wifi AC2200 Router - Snow,1,5,23 Jan 2020,Smokey,Seemed a little too modern for me but turned out to be easy to install and use.,A must have for any home owner.
Google - Nest Wifi AC2200 Router - Snow,1,5,23 May 2020,kpereda,"Definitely noticed the speed on my wifi increase instantaneously! 
I am no longer experiencing any more lagging when I am playing online.",This thing is MAGICAL
Google - Nest Wifi AC2200 Router - Snow,1,5,23 Jul 2020,Wedon,This is An excellent router and gives  great mesh coverage,Great Router.
Google - Nest Wifi AC2200 Router - Snow,1,5,23 Apr 2020,Armycisn25,It really fixed the issues I had about the other google devices disconnecting. As well as actually making the WiFi in the house faster. Overall great product!,Fixed issues I had with google devices
Google - Nest Wifi AC2200 Router - Snow,1,5,23 Jul 2020,Bna47,Very easy to set up and easy to use. works great and as expected,Easy to set up
Google - Nest Wifi AC2200 Router - Snow,1,5,23 Jul 2020,Dave,great item fast and easy delivery arrived early excellent purchase,Good service
Google - Nest Wifi AC2200 Router - Snow,1,5,23 Jul 2020,Kiesh,It does exactly what is says. Reaches the entire house and the yard,Great for your home
Google - Nest Wifi AC2200 Router - Snow,1,5,23 Jul 2020,JonathanQ123,Easy to use and super fast WiFi. I would recommend it,Great
Google - Nest Wifi AC2200 Router - Snow,1,5,23 Apr 2020,dslee33,I am definitely getting faster internet speeds and cant go back to any other router. Added a puck in my room and it works like a charm,Faster speeds
Google - Nest Wifi AC2200 Router - Snow,1,5,23 Apr 2020,KevinD,I have a multi-story townhouse and wasn’t able to get reliable signal throughout.  This plus three pods did the trick.,Easy set up!
Google - Nest Wifi AC2200 Router - Snow,1,5,23 Jan 2020,Paul3D,This nest Wi-Fi works great. I like that it doesn’t get hot on top of the unit and is cool to the touch.  The app works great lets you know how much data each device is using. And it’s fast. Nice size.,Love this new router
Google - Nest Wifi AC2200 Router - Snow,1,5,23 Jul 2020,dlb20913,I really enjoy hooking this up with my google home!,This thing is cool
Google - Nest Wifi AC2200 Router - Snow,1,5,23 Jun 2020,anyon,"Perfect  router ever seen, the band is matching speed we took.",Perfect at its speed
Google - Nest Wifi AC2200 Router - Snow,1,5,23 Jun 2020,Srinu,Good.Able to get good speed. Setup is easy. Able to manage multiple devices.,Good
Google - Nest Wifi AC2200 Router - Snow,1,5,23 Jun 2020,Linda,Easy to install; takes up less room and excellent quality,Excellent Router
Google - Nest Wifi AC2200 Router - Snow,1,5,23 Mar 2020,Kings,Add new space and needed to expand my mesh system. Google mesh worked out well. Easy setup with adding to my existing mesh system,Easy setup
Google - Nest Wifi AC2200 Router - Snow,1,5,23 Jun 2020,Imcheap2,Easy to use. Expandable as far as adding to it so you can extend range,Crazy fast speed
Google - Nest Wifi AC2200 Router - Snow,1,5,23 Apr 2020,Dkormsby79,Love this router.  WiFi is blazing fast now and dead zones just don’t exist.  The price is fantastic!!!,Excellent router upgrade!
Google - Nest Wifi AC2200 Router - Snow,1,5,23 Apr 2020,betocampelo,"The router speed is really fast, it works just fine and has great integration with the Google ecosystem",Really fast
Google - Nest Wifi AC2200 Router - Snow,1,4,23 May 2020,GamerBear,"This works great for my home, but I upgraded from the 1st generation of this product and I don't see much added benefit.","Works well, but..."
Google - Nest Wifi AC2200 Router - Snow,1,5,23 Oct 2020,Fjoy,"works great, easy to install and maintain, wish it had more LAN ports",Great wifi system
Google - Nest Wifi AC2200 Router - Snow,1,5,23 Jul 2020,FeFe,I was very pleased that my Wi-Fi improved greatly. So far I haven’t needed to buy a Wi-Fi point cause I get good service on all 3 levels of my house with router alone.,Great increased my Wi-Fi in my house.
Google - Nest Wifi AC2200 Router - Snow,1,5,23 Jun 2020,DZBUYZ,"When I mean this thing makes wifi signals work better, it really does!! It does all the dirty work of making the signal strong and consistent",Wifi feels amazing
Google - Nest Wifi AC2200 Router - Snow,1,5,23 Mar 2020,LilBit28,"4th one we have purchased to improve wifi throughout the house. Being used in my son's room since he is a ""gamer"".",Immediate wifi improvement
Google - Nest Wifi AC2200 Router - Snow,1,5,23 Feb 2020,Blackwaldo88,"This was so easy to setup, and even to maintain! Cannot wait to extend it, with the points",Future
Google - Nest Wifi AC2200 Router - Snow,1,5,23 Oct 2020,WeatherGeek,Easy to set up and then Google takes care of the administration.,Great router
Google - Nest Wifi AC2200 Router - Snow,1,5,23 Oct 2020,gram,Everything in the house that uses wifi runs faster with this unit. Yay!,great product
Google - Nest Wifi AC2200 Router - Snow,1,5,23 Oct 2020,Ronkar,So far I’m very pleased with this unit.  It’s fast and hasn’t dropped.,Great
Google - Nest Wifi AC2200 Router - Snow,1,5,23 Sep 2020,Skyflykai,This is so easy to set up just downloaded the app and followed the app instructions.,Great wifi router
Google - Nest Wifi AC2200 Router - Snow,1,5,23 May 2020,Nestfan,Finally am able to use wi-fi without having to worry about which room I am in. Have always had inconsistent wi-fi with a variety of routers until installing the Google Nest system. Very easy to set up with the Google app and pair with the other Nest routers.,Fixed all my wi-fi issues
Google - Nest Wifi AC2200 Router - Snow,1,5,23 Sep 2020,Anonymous,This was the easiest install i have ever experienced on a device. My google app pretty much did everything for me...,easiest install
Google - Nest Wifi AC2200 Router - Snow,1,5,23 Feb 2020,Hotrod18,"i got this for my dad for xmas because his old router would keep disconnecting.  i hooked it up for him and he is a happy camper now and can hook up multiple devices (smartv, directv for ondemand, phones, tablets, CPU)  he loves it.  plus keeps me from going over all the time when he calls to say his tablet was disconnected from his router.  thanks google!","got for my dad for xmas, loves it"
Google - Nest Wifi AC2200 Router - Snow,1,5,23 Jul 2020,Stephanie85,Great range of how far this reaches. It works with everything I have connected to it so far. Excited to be able to do more with controlling my kids' devices.,Fantastic range
Google - Nest Wifi AC2200 Router - Snow,1,5,23 Aug 2020,Fasmos,I am able to stay connected inside and outside of my home.  I can monitor speeds and usage.  Excellent product,Strong Signal
Google - Nest Wifi AC2200 Router - Snow,1,5,23 May 2020,maserlaser,"works great, both by itself and in mesh format.  easy to setup.  runs multiple units (35 plus) at one time with ease.  my wife even likes how it looks (no ugly antenna).  i have 600 download through comcast and ill usually get 660 or so through my pixel 4.",great simple wifi
Google - Nest Wifi AC2200 Router - Snow,1,5,23 May 2020,JENN76,We bought one of these a few months back and realized that we may need to purchase another one because of dead zones.  Since we’ve had this one no dead zones anywhere in the house. And with so many devices that’s a beautiful thing!,Wifi better than ever
Google - Nest Wifi AC2200 Router - Snow,1,5,23 Jun 2020,robQC704,I bought this with hopes it would be better than my spectrum router- THIS PRODUCT EXCEEDED MY EXPECTATIONS! I have referred family to it and it works so much better than the cable company router!,Awesome Router
Google - Nest Wifi AC2200 Router - Snow,1,5,23 Sep 2020,Jasonghent,I set this up and I have a way more stable net connection and way faster.,Very fast
Google - Nest Wifi AC2200 Router - Snow,1,5,23 Jul 2020,Kudos,"At first, I was unsure to buy this product after reading some reviews about it. Don't regret it at all, easy set up, periodic updates, great performance. What else can you ask for?",Good for the money
Google - Nest Wifi AC2200 Router - Snow,1,5,23 Sep 2020,ChazM,Great router super easy to install. Only needed one for my apartment. Definitely worth every penny.,Awesome
Google - Nest Wifi AC2200 Router - Snow,1,5,23 Oct 2020,javi,"Fit super great, it has a great signal and it's easy to use.",Excellent
Google - Nest Wifi AC2200 Router - Snow,1,5,23 Sep 2020,Gopi,"Easy to install, performs so good and easy to manage the network through mobile app",Performs so good
Google - Nest Wifi AC2200 Router - Snow,1,5,23 Sep 2020,BabyBoy,"I love the Next Wifi system. Easy to use and customize, and works great.",Easy to set up. Works great.
Google - Nest Wifi AC2200 Router - Snow,1,5,23 Sep 2020,zippy,Use the app correctly and it is easy to setup and get working.,Easy setup
Google - Nest Wifi AC2200 Router - Snow,1,5,23 Sep 2020,Eddie,Excellent coverage with just only one unit without extender.,Good range
Google - Nest Wifi AC2200 Router - Snow,1,5,23 Aug 2020,MTMP,This was so easy to set up and use! Connected easily to our router and has been working great!,Easy to set up!
Google - Nest Wifi AC2200 Router - Snow,1,3,23 Oct 2020,Jim2,Looks easy to setup and quick unless you are interfacing across non google equipment. My scan would not work and reading the password was difficult. Interfacing required working through help function and finding out how to reset settings.,Google
