product,verified,rating,date,author,content,title
Google - Nest Cam Indoor Security Camera - Black,1,5,20 Nov 2020,Jcanon25,I’ve bought this multiple times. Always great! Always reliable.,Repeat buyer
Google - Nest Cam Indoor Security Camera - Black,1,5,23 Nov 2017,Carlos,Excelent product. I bought 2 exterior nest about a year ago and I was surprised when I had the interior.,Great cameras!
Google - Nest Cam Indoor Security Camera - Black,1,5,23 Mar 2020,Bestbuy2020,"We bought these cameras to put in our house to check on our dog and of course in case someone were to enter our house unwanted.  The cameras are very easy to set up, easy to interface with the Nest app, and are very user friendly overall. It is nice that you can hear and see what is happening in the room as well as talk back through the app.",Great cameras for general watching!
Google - Nest Cam Indoor Security Camera - Black,1,5,23 Oct 2020,Trippinbillie06,We already have a Nest thermostat and this was the ideal companion. Super easy setup and shows up instantly in your Nest app.,Perfect add to the Nest Thermostat
Google - Nest Cam Indoor Security Camera - Black,1,5,23 Nov 2018,Dave,This is my 3rd camera and I’ve yet to have problems.  Always good to have nest products.,Nest
Google - Nest Cam Indoor Security Camera - Black,1,5,21 Nov 2020,Nest,Really good  I like that it’s very clear. Highly recommend,Good
Google - Nest Cam Indoor Security Camera - Black,1,5,23 Jun 2020,Denise,"I love this product! If your power goes out, sometimes you need to reset it, but I haven't had too much trouble with it. The biggest trouble is the app that goes with it, but it works fine as long as your power doesn't go out! Also, I wish it could hear better. It doesn't pick up sound that great unless you're talking loud or up close.",Like this!
Google - Nest Cam Indoor Security Camera - Black,1,4,23 Jul 2020,Nestuser,"The Nest Cam works just as it is advertised to work.  No better and no less.  The night vision feature is poor quality, all in all, but it does function.  The sound feature works pretty well, though I have not been able to have a two way conversation; don’t know why not.  For the money it is a reasonable device, though far too soon to know how reliable it is or is not.  So far, so good.",As advertised
Google - Nest Cam Indoor Security Camera - Black,1,5,23 Oct 2020,BuckeyeJoe330,"I live in a 185 unit apartment building and there have been issues previously. It couldn't be proven, that is what prompted me to get these camera's.",Best choice I made!!!
Google - Nest Cam Indoor Security Camera - Black,1,5,23 Nov 2018,Talwall,Great indoor camera if you are able to get it for sale price. Overall satisfied.,Great indoor camera.
Google - Nest Cam Indoor Security Camera - Black,1,5,23 Aug 2020,Miah,Definition of plug and play. The quality is great and the controls are customizable. You do have to purchase a NEST aware subscription if you want additional features and the ability to record. It's like $6 a month. Overall a great investment.,Great indoor camera
Google - Nest Cam Indoor Security Camera - Black,1,5,23 Nov 2018,Cadkubat,Expensive but easy to set up and haven’t had any problems. Great night vision.,Good cameras
Google - Nest Cam Indoor Security Camera - Black,1,3,23 Aug 2020,Maine,"The camera performs as expected, but I wish it didn’t have so many connection issues. Despite having the fastest possible internet in my area and the most state-of-the-art modem / router etc. it still spontaneously loses connection at various times while I’m away, or whenever there’s rapid activity on the screen like an animal moving through the frame.

Also— BEWARE— for people who enjoy any modicum of privacy; these camera DO NOT turn off even when in “off” mode. Google has admitted that they merely “close their eyes,” however the cameras still hear and record everything. Considering everything we know about Big Tech and surveillance, you’ll want to consider totally unplugging the cameras from their power source when they aren’t being used.",Not bad but not great
Google - Nest Cam Indoor Security Camera - Black,1,5,23 Sep 2020,gvcgarrett,"After having multiple Amazon purchased cameras, the Google nest home camera take the cake for being the best overall quality and easiest to set up.",Best Camera Yet
Google - Nest Cam Indoor Security Camera - Black,1,5,23 Nov 2018,kleptobot,We use this to monitor my child's room. It's worked out really well.,Great Camera
Google - Nest Cam Indoor Security Camera - Black,1,5,23 Nov 2016,DisplayZeke,This little thing does more than just keep you informed it notifies you kind of scary lol,mine cant get wet
Google - Nest Cam Indoor Security Camera - Black,1,5,23 Nov 2018,cbcb,"It is as expected and as advertised 
Works great
Nothing surprising",Review
Google - Nest Cam Indoor Security Camera - Black,1,5,23 Sep 2020,CtS383,"We have the doorbell and two of these indoor cameras.  With the newest subscription program it makes sense to round it out with more.

Highly recommended",Have multiple Nest camera products
Google - Nest Cam Indoor Security Camera - Black,1,5,23 Nov 2018,Ryan,"Love these cams, I would definitely recommend these to anyone!!",Amazing cams
Google - Nest Cam Indoor Security Camera - Black,1,5,23 Oct 2020,Jasmin35,I love nest cameras I have 3 in my house and they look so clear and easy to see what’s going on. Definitely recommend,Great
Google - Nest Cam Indoor Security Camera - Black,1,5,23 Sep 2020,Jammy,"These cameras captured someone trying to get in the house, thanks to this cameras that are small and bend to the perfect angle we were able to see perfect the person who try to break in.  I have one even in the house facing out and it works amazing. If I were to say a down size of it, make sure you have a great internet and not too far from the router as when they disconnect you have to rescan them again. Overall, I love them.",Nest Indoor Camera the best!
Google - Nest Cam Indoor Security Camera - Black,1,5,23 Jun 2020,CyGuY,Good build quality and easy to use interface through the Nest app. Also like how cameras can be easily adjusted. Very sleek looking in any room of the house. Wish the subscription wasn't so pricy in order to use all the features.,Solid devices
Google - Nest Cam Indoor Security Camera - Black,1,5,23 Jun 2020,Rita6340,I purchased this camera to install in my home for my elderly mother.  It is truly a life saver during these unexpected times.  Don’t know what I would have done without it!!,Watchout!!
Google - Nest Cam Indoor Security Camera - Black,1,3,23 Nov 2017,Silverwolf,"The camera works very well with great image quality; however, I was unaware of the high monthly costs to store the footage. Nowhere on the packaging dose it mention, that after 30 days, I would have to pay to save the footage. Now I'm stuck with this camera, that I can't even use, unless I pay the monthly fee. For $200+, I should at least have 5 gigs free, to store the footage, then I can rinse and repeat.","Great Product, expensive monthly fee."
Google - Nest Cam Indoor Security Camera - Black,1,5,23 Nov 2016,Khaledzou,"We live in California and have to leave town for work too much, but we can check in on the pet sitter and our cat and dog all day and night. It's amazing. and it's actually really fun just watching the animals. It sends you and alert (if you want it to) whenever there is movement or sounds. So whenever we get an alert we give it a look. It's also peace of mind to check in on our belongings and make sure if anyone did break in or try, we'd have a video record of it. Love it. Worth every cent. We are going to buy more.",We have pets. And we LOVE this.
Google - Nest Cam Indoor Security Camera - Black,1,5,23 Nov 2015,lferga12,I did a lot of research before I bought it and I went to Best Buy and I purchased nest camera since then I'm connected with my dog every day and I talk to him through the nest cam and it's worth the money I spent,The best cam
Google - Nest Cam Indoor Security Camera - Black,1,5,23 Nov 2017,ParentsNanny,We have used DLink and Hubble but Nest is absolutely head and shoulders above and worth the higher cost. We monitor elderly parents,Nest is Best
Google - Nest Cam Indoor Security Camera - Black,1,5,23 Nov 2019,sleepu2,"Little pricey, but does everything it said it would do. I don’t like having a new subscription for the video storage.",Everything I thought it should be.
Google - Nest Cam Indoor Security Camera - Black,1,5,23 Nov 2018,tcsyh,"Very well made, the quality is absolutely top notch. The image quality is acceptable on mobile devices, I will have to check the downloaded quality later. The Nest app works great and I would always know when my cat enters my study room through push notification.",Versatile indoor camera
Google - Nest Cam Indoor Security Camera - Black,1,5,23 Nov 2019,CatCity,"I have purchased 3 of these cameras over the years, and the original one that I purchased over 3 years is still working perfectly. The nest app is fantastic, because it lets you scroll through the entire day of feed, which is different than some camera, which section off your feed by independent clips based on motion. The nest way is far superior, because I can scroll through to find exactly what I’m looking for. I can’t tell you how many times I’ve used this camera to see where my toddler placed a toy that he can no longer find. These devices are amazing.",I own 3 of these
Google - Nest Cam Indoor Security Camera - Black,1,4,23 Nov 2015,Lander,"one of the nice features of this camera is the playback but you have to be subscribed for it. The unit is pricey itself already so why pay more for a subscription. Also, the camera can get hot.",Good camera but a little pricey
Google - Nest Cam Indoor Security Camera - Black,1,5,23 Jul 2020,KatieCav,"These are great little cameras, quality is great, you do need some form of light to see but even a nightlight is ok (we use as a baby monitor). I would recommend!",Very Impressed
Google - Nest Cam Indoor Security Camera - Black,1,5,23 Nov 2016,John,"This is a great interior camera system. I already had one for approximately 2 years and used it to watch our dog, while gone from home. The 130 degree lens takes in the entire room. If there is movement, I get a notification on my phone and can immediately check to see what is going on.

We added this second camera and now can monitor both entrances to our home from the inside. We also have the 10 day subscription and I highly recommend it. Should a thief break in, see the cameras and either disable or take them he is still caught. The recording is off site at Nest and can be easily accessed with your phone, pad or computer. Check what a professional system would cost to install and you'll see what a bargain this is.",An inexpensive home camera system
Google - Nest Cam Indoor Security Camera - Black,1,5,23 Dec 2019,Alfster,"I've purchased these before and also cheaper cameras in my past.  Although these are more expensive, they are so much more reliable that the added expense is very worthwhile.   They only go on sale 3 or 4 times a year, so I patiently wait to add to my inventory for these events.   They do give you the first 30 days of history for review for free which is nice, after that it is an added expense, which I've never purchased.",Can't go Wrong
Google - Nest Cam Indoor Security Camera - Black,1,5,23 Sep 2020,JustinM,We put these in our office and have the motion zones set. They’re awesome!,Great indoor camera!
Google - Nest Cam Indoor Security Camera - Black,1,4,23 Jul 2020,George,I would definitely recommend this over the more expensive version unless you absolutely need the enhanced fuctions. Only complaint thus far is that the camera need a lot of light to turn off night mode.,Great choice for people already using nest
Google - Nest Cam Indoor Security Camera - Black,1,4,23 Mar 2020,Charger,"I use the camera in my living room (mostly to watch my animals). It has a great wide angle lens. The sound is sporadic. Some days I can talk to whoever is in the room, but barely be heard and other days the sound doesn't work at all.",Good camera
Google - Nest Cam Indoor Security Camera - Black,1,2,23 Nov 2017,looloo,"Not what I expected from Nest! Bought this thinking the indoor cam should work well considering the doorbell works absolutely great. It arrived and I quickly put it out. I played with different areas of my house and the resolution was soooo bad! It didn't matter where I placed it, it did not show clear at all. The image was very pixelated. If I needed to catch someone in it and try to get a clear image of the persons face it would be next to impossible. Needless to say it went back. I'm going to try the HD one and hope it works better if not I'm going to have to do what I didn't want to do which is purchase from a different brand and download a second app different from the Nest one.",It didn't work out for me
Google - Nest Cam Indoor Security Camera - Black,1,5,23 Oct 2020,Pupo,We have 5 at home and 3 at office..works great with the app,Amazing
Google - Nest Cam Indoor Security Camera - Black,1,5,23 Aug 2020,Mzwief,Good features and works well. This is the 2nd one I've added to the house and happy with the quality.,Solid camera
Google - Nest Cam Indoor Security Camera - Black,1,4,23 Nov 2019,Jondres,"Next is probably one of the best cameras on the market. I only wish the quality of the picture was better. For instance, when mounted on the front of a house you cannot make out alicense plate on a car in the driveway or on the street or details of a persons face. I had someone take something off my front porch right underneath where the camera is mounted and I could not tell who the person was or what they really looked like. That something that could be important if any foul play is detected. Picture is grainy especially when zooming in.",Probably one of the best cameras out there.
Google - Nest Cam Indoor Security Camera - Black,1,5,23 Oct 2020,Kimberly,Excellent cameras and perfect quality for anyone to use!,Excellent cameras
Google - Nest Cam Indoor Security Camera - Black,1,4,23 May 2020,PeeJ,"I have some nest cam that I purchased and they look better than this one. Probably because it's an old cam compared to my previous purchases but it do serve it's purpose. The video quality is OK and not to mention, you need to subscribe to the nest aware to maximize it's purpose.",It serves its purpose
Google - Nest Cam Indoor Security Camera - Black,1,5,23 Nov 2019,Mochten,"The new google nest is more refined than the old original nest product. I have an older version and this new one was way easier to setup. Great quality and the trial version of the nest aware is very good to the point that makes me want to buy the subscription.  The angle of view is much wider than the previous versions so all in all, great investment.  It binds very well with an existing nest account with my nest thermostat and nest door bell.",It's a Nest
Google - Nest Cam Indoor Security Camera - Black,1,4,23 Sep 2020,Teetee,I'm satisfied with my purchase and will definitely purchase again. The night vision ain't the greatest but it's ok.,It's all good
Google - Nest Cam Indoor Security Camera - Black,1,5,23 Aug 2020,Pakman,Really impressed with this camera as I use it to monitor my apartment when I’m gone and my dog is left by herself.,WOW!
Google - Nest Cam Indoor Security Camera - Black,1,5,23 May 2020,Geoboy,This is my second nest cam that I have installed in my home. I love how easy it was to set up and also the quality of the video display. The camera gives me peace of mind to check in on my house when I’m not around.,Love this camera!
Google - Nest Cam Indoor Security Camera - Black,1,2,23 Nov 2015,Allistar,"At first glance, the Nest Cam is a really great product. However, for those that are more tech inclined or with needs such as outdoor mounting, the Nest Cam falls short.

Pros:
+: Great for those with simple recording or technical requirements.
+: The Nest Cam integrates tightly with the Nest app on the iOS/Android platforms and Nest.com website.
+: Setup is extremely easy.

Cons:
-: Wireless range and performance isn't great Despite a line of sight to my 802.11AC Apple Airport Extreme router, it often has buffering issues.
-: Fully relies on the Nest Cam cloud video recording system to be operational. The highly touted capabilities that require a monthly Nest Aware subscription where motion detection sends alerts to your mobile device, etc. have been down for a subset (myself included) of active Nest Cam users on the Nest Community forums since 7/10/2015 with no notice from Nest.
-: Nest's Phone Technical Support is extremely lackluster. Estimated hold time was 30 minutes, my call was disconnected by their phone system at a hold time of 1 hour and 2 minutes.
-: Nest's E-mail support is also poor, they tell you to expect a 3-5 day turnaround time before you receive a response.

I am now currently trying to engage Nest's support via twitter and other venues. I want a refund, I'll roll my own security camera system.","Good camera, but beware of cloud downfalls."
Google - Nest Cam Indoor Security Camera - Black,1,4,23 Aug 2020,RyRy,"This camera is a great part of the ecosystem. Unless you need to recognize faces inside, I would go with this one instead of the IQ.",Love the Nest ecosystem
Google - Nest Cam Indoor Security Camera - Black,1,5,23 Sep 2020,Drinkie,"Excellent value quality product - Google have made set up and configuration confusing due to working with both Google Home and Nest software, you will also need to subscribe to the Nest software to be able to retrieve up to 30 days of recordings, which is not expensive, but is another cost to factor in.",Great Indoor Camera
Google - Nest Cam Indoor Security Camera - Black,1,5,23 Aug 2020,SanBenito,I use islt a a baby can. Turn it off when not needed. It's integrated with my other nest devices,Works as advertised
Google - Nest Cam Indoor Security Camera - Black,1,3,23 Sep 2020,Bones29,"I now have 6 cameras watching the house. I pay for the 5-day archive and to me, it is worth it. The cost to archive is a little expensive and I think Nest could do better here. However, the cameras are all solid and reliable. I give it a 3 based on the cost of monitoring otherwise functionality is a 5-star rating. You do not have to pay for the archive feature but I like it so I take the hit.",Camera number 6
Google - Nest Cam Indoor Security Camera - Black,1,4,23 Nov 2018,SimonSays,"If you've read other reviews, NEST makes some great cameras. You can mount these pretty much anywhere, or just place them on a flat surface. The camera itself can be tilted and turned, so in any mounting situation, you can get your image framed as needed.

The image quality is great. When the light goes off, it switches to night vision, and the image in pitch dark is still amazing, although it's in black and white. (There's no such thing as a color night vision)

Connect the app on your phone, or use the website (home.nest.com) to view the video stream. There are also apps for Apple TV and perhaps some other platforms.

The downside of this camera (the whole NEST ecosystem, really) is that none of the advanced features work without their ""Nest Aware"" subscription. And most of those features don't work well at all. A gust of wind moves a bush? Alert. A shadow moves across the image? Alert. You get the picture. 
Add to that the cost (starting at $100 per camera) for Nest Aware, and it's just crazy.

So for just keeping an eye out on things wherever you are in the world, these are great. For alerting and cloud storage of your video, be prepared to pay a lot.

I haven't measured the data usage, but it's not insignificant, so don't use these when you're on Satellite internet or a slow DSL connection.","Quality Good, Features Mediocre"
Google - Nest Cam Indoor Security Camera - Black,1,4,23 Nov 2015,TechIke,"I'm a big fan of Nest products and this was my first purchase. Setup was very simple - the longest part was setting up a Nest account. The camera has either a magnetic base or you can attach it to a wall. Easy to turn and pivot and the wide angle lens is great.

The biggest drawback is to have the ability to go back or save videos, you need to subscribe to a Nest Aware package. Cheapest is 10 days of history for $100/yr or $10/mo. That is pretty expensive and I have yet to buy into that. Also, when you do not have a subscription, the quality of alerts diminishes, so you don't get notified right away if movement is seen in your house. These features could change in the future, and I believe they should. I plan on buying the subscription if I go away on a trip or something like that, but I can't justify it for day to day purchases.",Good entry into the smart home future
Google - Nest Cam Indoor Security Camera - Black,1,5,23 Sep 2020,Joey,"it works great, I paired it with my other two cool",Super  amera
Google - Nest Cam Indoor Security Camera - Black,1,5,23 Aug 2020,MAQuatt,This is my fourth Nest Dropcam. It’s a great investment. Gives me peace of mind while I’m away from home.,Love this Camera!
Google - Nest Cam Indoor Security Camera - Black,1,5,23 Sep 2020,JDGA,Great cameras at a great price!  I would purchase again!,Great cameras at a great price!
Google - Nest Cam Indoor Security Camera - Black,1,5,23 Aug 2020,Niklause1982,Love the fact I can view my property while inside or on the go with the push notifications a must have,Awesome
Google - Nest Cam Indoor Security Camera - Black,1,5,23 Aug 2020,Marc,I rely on these cameras when we are not home in order to keep an eye on the property,The Nest Cameras are very user friendly
Google - Nest Cam Indoor Security Camera - Black,1,5,23 Jul 2020,Doug,These cameras are great and the new Nest Aware pricing makes them more valuable for security than before.,Not my first Nest Cam and will not be my last
Google - Nest Cam Indoor Security Camera - Black,1,5,23 Aug 2020,Angel,I have this Both at work and at home. I  love the nest platform and helps keep everything and one safe.,Google everything
Google - Nest Cam Indoor Security Camera - Black,1,5,23 Jul 2020,Melw,Purchased this to be able to watch my dogs when we are not home. Works great and happy with this purchase,Works Great
Google - Nest Cam Indoor Security Camera - Black,1,5,23 Nov 2019,Katherine,"Be aware that you will need to get the Nest Aware subscription to continue having those scrollable timelapse clips/videos of when motion is detected. Your camera will still work and alert you to motion (but not talking or dog barking without Nest Aware), but for the full experience you'll need Nest Aware. The subscription has different pricing models depending on how many days back of video history you want to keep in the cloud, and it does scale according to how many cameras you have on Nest Aware. Overall, I feel it's worth it. The peace of mind I have with this camera is not something to discount lightly. Buy 1, and then buy 1..or 2+ more!","Subscription required, but worth."
Google - Nest Cam Indoor Security Camera - Black,1,5,23 Aug 2020,MidNightRockr,Very happy with these cameras and how they tie in with my Nest Guard.,Great solid camera
Google - Nest Cam Indoor Security Camera - Black,1,5,23 Mar 2020,Bryan,These are a great purchase. I know know which dog was on the couch and when the kid is not doing there homework when they Say they are,Great purchase
Google - Nest Cam Indoor Security Camera - Black,1,5,23 Nov 2016,ApartmentCamera,We have been a problem of a woman coming into our apartment building in the middle of the night and causing damage to the building. The Police set up a criminal trespass warrant against this person but we needed to catch her in the building to have her arrested.. The Nest camera worked perfectly by notifying us when there was activity in the hall of the building. When she showed up we called the police and she was arrested,Nest protects our apartment building
Google - Nest Cam Indoor Security Camera - Black,1,5,23 Sep 2020,Kelll,Great basic camera for all types of spaces would recommend,Good camera
Google - Nest Cam Indoor Security Camera - Black,1,5,23 May 2020,Mark,I wanted to have surveillance for the inside of my house to see my dog if she’s destroying anything. The quality is great and works seamlessly with the app connecting my Nest Hello,Great wuality
Google - Nest Cam Indoor Security Camera - Black,1,5,23 Jun 2020,B5252,This camera is stationary but the viewing angle is very wide automatic night vision works very well. The nest app works quite well also,Great camera for the money
Google - Nest Cam Indoor Security Camera - Black,1,5,23 Aug 2020,gimmid,"Excellent product. It can be either mounted on the wall or free standing. The app is easy to connect and the camera quality is excellent! If you already have other nest product, this is the one to go with; eco-system integration on each nest products provide superb experience in a single app! Highly recommended!",Best camera in the market
