product,verified,rating,date,author,content,title
"Amazon - Echo Show 8"" Smart Display with Alexa - Charcoal",1,4,13 Feb 2020,Titan,Good.. bought it for my mum for Christmas and she likes it so far..,Good
"Amazon - Echo Show 8"" Smart Display with Alexa - Charcoal",1,4,13 Feb 2020,Jchernandez,The only complaint its that doesn’t came with the stand included,Good speaker
"Amazon - Echo Show 8"" Smart Display with Alexa - Charcoal",1,4,13 Feb 2020,Cody,Wish it would respond to different names and use voice recognition.,works as should
"Amazon - Echo Show 8"" Smart Display with Alexa - Charcoal",1,4,13 Feb 2020,Koolaid,Looking forward to trying this out with the Ring security system.,Haven't actually used this yet.
"Amazon - Echo Show 8"" Smart Display with Alexa - Charcoal",1,4,13 Feb 2020,Sbiggame,We purchased to have on our kitchen counter.  good for recipes.,Good for the Kitchen
"Amazon - Echo Show 8"" Smart Display with Alexa - Charcoal",1,4,13 Feb 2020,Hrys,Good product but had to exchange due backlight bleeding.,Good
"Amazon - Echo Show 8"" Smart Display with Alexa - Charcoal",1,1,13 Apr 2020,Rdog,"By far the biggest piece of crap. This thing never works right. Bought it for my Dad whose 91 so he can do video calls with the family during the COVID 19 lock down. This thing is buggy and now has an orange line across the bottom of the screen. Rebooted the Echo, no luck. Rebooted the wireless router, no luck. His computer is able to access the internet via the wireless router, so that’s not the problem. Disabled the wireless and re-enabled it on the Echo, no luck. 
THANKS ANAZON FOR A TRUELY PIECE IF CRAP!",DON’T WASTE YOUR MONEY. JUNK!!!!!
"Amazon - Echo Show 8"" Smart Display with Alexa - Charcoal",1,4,13 Feb 2020,claire,family really enjoys and has purchased another echo,given as a gift
"Amazon - Echo Show 8"" Smart Display with Alexa - Charcoal",1,3,13 Feb 2020,Corvid,"The perfect Assistant would be if Google and Amazon joined forces but that'll never happen. Until then we get two different devices with their own strengths and weaknesses. This one in particular, for my needs, isn't ideal. But it made for a nice holiday gift.",Decent but could be improved.
"Amazon - Echo Show 8"" Smart Display with Alexa - Charcoal",1,4,13 Feb 2020,Jdawgg17,I'm still learning the system. But so far so good.,Works great
"Amazon - Echo Show 8"" Smart Display with Alexa - Charcoal",1,3,13 May 2020,JJJJ,"I am use to the sound on the echos, this sound isn't very good.  I really don't need the video type because I don't use it that much.  I returned it.",It's ok
"Amazon - Echo Show 8"" Smart Display with Alexa - Charcoal",1,3,13 Apr 2020,tammyp1040,I don't know if it's just that it's new to me and I do not know all the features yet or if I just do not like it. It seems to be very basic to me and I could do more with my Google Home.,I'm on the fence with this.
"Amazon - Echo Show 8"" Smart Display with Alexa - Charcoal",1,4,13 Jan 2020,RetiredCook,They are enjoying it as it acts like a TV for them!,I bought 2 of these for gifts
"Amazon - Echo Show 8"" Smart Display with Alexa - Charcoal",1,3,13 Apr 2020,Lovetoshop,"I don't know if it's my internet or the ring doorbell but it's slow to give me video and audio. For other purposes it works well but when working with Ring, I'm not happy with it.",Slow interaction with Ring
"Amazon - Echo Show 8"" Smart Display with Alexa - Charcoal",1,4,13 May 2020,charlotte,it is very good/convenient - seeing kids to go with it all the time,echo show 8
"Amazon - Echo Show 8"" Smart Display with Alexa - Charcoal",1,5,13 Jan 2020,Unseen,Amazing how Manny things you can control with your Alexa,Must have
"Amazon - Echo Show 8"" Smart Display with Alexa - Charcoal",1,3,13 Feb 2020,RLJones,I bought this mainly for the screen size.  I already have a Echo Show 5.  This one is Ok but the biggest disappointment is I can not set up the clock faces the same as I can with the Echo show 5.  The Echo show 8 does not give the same options as the 5.,Good product but needs some work
"Amazon - Echo Show 8"" Smart Display with Alexa - Charcoal",1,4,13 Feb 2020,rldj,"I am still in the process of learning how to use the Echo 8.  I think as I use it more, I will find more uses for it.",I like my Echo Show 8
"Amazon - Echo Show 8"" Smart Display with Alexa - Charcoal",1,4,13 May 2020,Ester,Not as adaptive as I had hoped but great toy to play with.,Fun little toy
"Amazon - Echo Show 8"" Smart Display with Alexa - Charcoal",1,3,13 Oct 2020,Denny,"Like the title says, it's a great smart device, but the speaker is terrible...","Nice smart device, with a TERRIBLE speaker."
"Amazon - Echo Show 8"" Smart Display with Alexa - Charcoal",1,5,13 Jan 2020,carm,Love it.  Great present for all the family to enjoy.,bought one for family members to keep in touch
"Amazon - Echo Show 8"" Smart Display with Alexa - Charcoal",1,4,13 May 2020,NikkiS,Love these Alexa shows. Just wish you did not need a cell phone,Love it
"Amazon - Echo Show 8"" Smart Display with Alexa - Charcoal",1,5,13 Dec 2019,Firered09139,I absolutely love my echo show! Alexa is simply amazing!!!,Love
"Amazon - Echo Show 8"" Smart Display with Alexa - Charcoal",1,5,13 Jan 2020,Grba021,Love this product. Does everything I want it to do.,Great product
"Amazon - Echo Show 8"" Smart Display with Alexa - Charcoal",1,4,13 Jan 2020,Kenny,I purchased the Amazon Echo Show 8 a few weeks ago and it is quite good. The screen/picture is just the right size for a kitchen counter.,Echo Show 8
"Amazon - Echo Show 8"" Smart Display with Alexa - Charcoal",1,4,13 May 2020,Chimis,"Is good, but somethimes no understand when I say something",Good
"Amazon - Echo Show 8"" Smart Display with Alexa - Charcoal",1,4,13 May 2020,RjRz,Works seamlessly with my previous Alexa Show Gen 1.,Great peoduct
"Amazon - Echo Show 8"" Smart Display with Alexa - Charcoal",1,4,13 May 2020,TO60,I brought 2 of these and they are working out great,Nice Echo
"Amazon - Echo Show 8"" Smart Display with Alexa - Charcoal",1,4,13 May 2020,rabbit,i work with it in business but it has many issues with zoom,its a good device not great
"Amazon - Echo Show 8"" Smart Display with Alexa - Charcoal",1,4,13 Mar 2020,Ting,"I't awesome to have Alexa echo show 8, if you need recipe Alexa will find it for you...",Awesome
"Amazon - Echo Show 8"" Smart Display with Alexa - Charcoal",1,5,13 Feb 2020,Jbbb,Makes things easy to see onscreen. Best for cooking too. Hands free.,Really great to use with Alexa
"Amazon - Echo Show 8"" Smart Display with Alexa - Charcoal",1,4,13 Feb 2020,TechUser,The unit is really nice and Best Buy has a great deal with a free Dot.  Home Depot’s price was way more.  This speaker could be better for music.,Really nice unit and a great price.
"Amazon - Echo Show 8"" Smart Display with Alexa - Charcoal",1,5,13 Feb 2020,Ddesz,Great product worth the money esp on sales works great with ring,Great
"Amazon - Echo Show 8"" Smart Display with Alexa - Charcoal",1,5,13 Jan 2020,Carlos0727,"I like this device, I love the Alexa, she remember my appointment and the weather",Excelente product
"Amazon - Echo Show 8"" Smart Display with Alexa - Charcoal",1,5,13 Jan 2020,Guison,Goes well with the ring smart door bell. You can see who's at the door,Nice
"Amazon - Echo Show 8"" Smart Display with Alexa - Charcoal",1,5,13 Jan 2020,CaptivRihno,I have owned many echo devices over the years and this one is by far the best.,"Love, love, love this thing"
"Amazon - Echo Show 8"" Smart Display with Alexa - Charcoal",1,5,13 Jan 2020,1happymama,Great features! Will keep you busy for hours! Definitely a must have!,So much fun!
"Amazon - Echo Show 8"" Smart Display with Alexa - Charcoal",1,5,13 Feb 2020,Tclaringbold,Makes a great baby monitor paired with ring indoor cameras.,Makes a perfect baby monitor
"Amazon - Echo Show 8"" Smart Display with Alexa - Charcoal",1,5,13 Jan 2020,watchman,"fun and useful connects easily to your devices like lights, blink, ring",fun and useful
"Amazon - Echo Show 8"" Smart Display with Alexa - Charcoal",1,5,13 Feb 2020,Chin,Connects seamlessly and voice recognition is excellent.,Great product
"Amazon - Echo Show 8"" Smart Display with Alexa - Charcoal",1,4,13 Mar 2020,crafty,I bought this to automate lighting in my home. I’m now addicted! I use it for a ton of things and am learning more about it every day.,Nice toy
"Amazon - Echo Show 8"" Smart Display with Alexa - Charcoal",1,5,13 Jan 2020,BF101,Great value at Nest Buy got Echo dot for free with this purchase great buy.,Great product with great picture and functionalit.
"Amazon - Echo Show 8"" Smart Display with Alexa - Charcoal",1,5,13 Feb 2020,Jonesy,I loved this. Great price! It even came with a free echo dot!,Great device
"Amazon - Echo Show 8"" Smart Display with Alexa - Charcoal",1,5,13 Jan 2020,NyNy,Way better then the Google hub. Love that it connects to my Ring product.,Love
"Amazon - Echo Show 8"" Smart Display with Alexa - Charcoal",1,4,13 Feb 2020,mfisher,Handy little do-dad. Has its uses for weather and cooking. Still learning the ropes.,Convenient
"Amazon - Echo Show 8"" Smart Display with Alexa - Charcoal",1,3,13 May 2020,Boats,I thought great one for me and one for my Daughter we could talk face to face. It is smarter than both of us. it has become just another waste of money.,smarter than me
"Amazon - Echo Show 8"" Smart Display with Alexa - Charcoal",1,2,13 Nov 2017,BigB,wasn't happy with this purchase due to the humming from the speakers. Speaker quality isn't as good as expected.,Sound Quality
"Amazon - Echo Show 8"" Smart Display with Alexa - Charcoal",1,4,13 Sep 2020,TwoEZ,"Bought this device when it was on sale.  Definitely like the audio/video quality over the Show 5 (not that the show 5 is a bad device).  More space, better speakers & bass.  Screen is nice & bright, but dims in low light (a must if you want to sleep).  Made phone calls with it, great sound.  Haven't video called with it, so can't make any opinions on it.  If you owned any other echo device, does the same sound wise, but with a bonus of having a screen to show you some information, surf the web on it as well (it is a touch screen).

Bonus, I can see my security camera views I have setup in my place (skill required of course)!!  That's a nice touch especially if you have a multi level home.

Now, to fully take advantage of the device, you NEED to set up routines with your smart devices & appliances as well as have the right skills for them.  This will eliminate the need to constantly do it on your mobile device or tablet.  If you do not, won't do much for you.  As a stand alone product, you can use it, but you don't take full advantage of what it can do unless you're working on making your home a smart one.  Excellent addition to the Echo line of products.","Great device, but learn skills & routines!!"
"Amazon - Echo Show 8"" Smart Display with Alexa - Charcoal",1,3,13 Apr 2020,Kjr123,I got this for my elder grandfather and it was a pain to set up. Ended up having to create an Amazon acoustic for him to be able to call him from mine.,Hard setup for elderly
"Amazon - Echo Show 8"" Smart Display with Alexa - Charcoal",1,3,13 May 2020,gardco,I got this for my wife. She decided that she didn't want it,Returned
"Amazon - Echo Show 8"" Smart Display with Alexa - Charcoal",1,3,13 Jul 2020,Drpepper,"The Echo Show could be better. What it lacks in audio, it makes up in video.",Decent showing
"Amazon - Echo Show 8"" Smart Display with Alexa - Charcoal",1,3,13 Apr 2020,Joyfrog,It does not seem to like my English accent......Its a tad frustrating but its a nice clock and has pretty scenery on the background images.,Hard to interface
"Amazon - Echo Show 8"" Smart Display with Alexa - Charcoal",1,5,13 May 2020,tessy,Love this item.  It has great sound and the 8 inch screen makes it easier to read the words to the songs as they are playing.,Great Product!
"Amazon - Echo Show 8"" Smart Display with Alexa - Charcoal",1,3,13 Mar 2020,Shoemonkey,"Does it’s job. However the voice command can improve, don’t know how to take fully advantage of this. The listening feature doesn’t always do ask I ask. Can be better",The echo show does it’s job
"Amazon - Echo Show 8"" Smart Display with Alexa - Charcoal",1,3,13 Jul 2020,Becky,"As a non-techy, I still haven’t been able to connect it.",Still trying to get it synced up.
"Amazon - Echo Show 8"" Smart Display with Alexa - Charcoal",1,3,13 May 2020,Mike5311,"I ordered a stand with the Echo 8 . When I picked it up I was told it was in the box, It wasn’t.",Missing Product
"Amazon - Echo Show 8"" Smart Display with Alexa - Charcoal",1,1,13 Jul 2020,Cateyes23,This item was purchased for my Mom who is 70 and being that this Corona virus is here I couldn't visit her. I went to connect it to her phone but her smart phone wasn't compatible.  It told me to download other Alexa apps but still wouldn't work with echo. My mom has the Samsung galaxy J7 smartphone but it did not support the Alexa app so I had to return it. Sucks that there wasn't another way to use it other than with an app. Everyone isn't tech savvy and can't operate up to date smartphones.,Alexa app not supported on smartphone
"Amazon - Echo Show 8"" Smart Display with Alexa - Charcoal",1,3,13 Apr 2020,McDonald,Not easy to set up with a printer has poor tone quality when making calls to other devices not sure it was worth it,"Great for a shopping list or a timer, but......"
"Amazon - Echo Show 8"" Smart Display with Alexa - Charcoal",1,5,13 Sep 2020,GregZ,"I started with an Echo Dot and was pretty impressed with the operation and sound. Best Buy had a special on the Echo Show 8 and I liked the thought of having video so I purchased two. The sound is pretty impressive for playing music and the video is a nice addition to the information that is provided by Alexa. I find myself spoiled with the amount of time I use them and listen to music while doing something. So, I purchased two more Echo 8's for different rooms as well as an Echo 5 for my bedroom nightstand.",Spoils Me
"Amazon - Echo Show 8"" Smart Display with Alexa - Charcoal",1,2,13 Jul 2020,Savros81,Bought this for my bedridden 91 year old father-in-law to use to listen to Christian music.  Have had nothing but trouble getting the stations he wants.  Alexa will repeat the request back but won't change the station.  Will instead play Amazon music.,expect to be spied upon.
"Amazon - Echo Show 8"" Smart Display with Alexa - Charcoal",1,5,13 Jul 2020,Harley,"I absolutely love this little gadget! I have it in my kitchen and every morning I tell Alexa to play the news and play my music and she gets my day started. The video and sound are amazing especially coming from such a small box. You do need to set it up with your phone by downloading the app and after that, it is pretty easy to follow the directions for set up. You can program it to your own personal likings.  It doesn’t take  up much space. I have it on a shelf which is eye level: the problem is that the video shows my ceiling, so I need to add something underneath to slant it downwards or invest in a swivel stand. Other than that, it is great!",Great picture and sound!
"Amazon - Echo Show 8"" Smart Display with Alexa - Charcoal",1,1,13 May 2020,BestBuyBuya,"Just went and picked the Echo today because it was on sale. Played a few songs on it and then told it turn  screen off. Once I turned screen off, it never came on. Yelled Alexa at it, tried using buttons, eventually unplugged it, and still not working. Did factory reset and now it’s stuck in boot loop. Save your money and don’t buy this off brand Android clock. Glad it broke while I can still return it. Says it plays Apple Music which it does not. Don’t believe me just try it, and you’ll return it too. Amazon",Lasted 5 hours
"Amazon - Echo Show 8"" Smart Display with Alexa - Charcoal",1,2,13 Oct 2020,Giant,"Too big in size for my kitchen
Not easy to use and need to be connected",Size
"Amazon - Echo Show 8"" Smart Display with Alexa - Charcoal",1,5,13 Sep 2020,Czr123,"The Echo Show 8 is really worth the price, especially if you find it on sale! The screen is great and the speakers are plenty loud.  It's easy to use and you'd be amazed how often you actually use it!",Better than advertised
"Amazon - Echo Show 8"" Smart Display with Alexa - Charcoal",1,5,13 Jan 2020,SCRRT,We love it.  Does so many things to make our lives easier...,Echo
"Amazon - Echo Show 8"" Smart Display with Alexa - Charcoal",1,5,13 Nov 2018,Echo,I love my echo show eight. The sound quality is great. It is easy to use and Alexa certainly knows more than I do! Even more so I love the geek squad option and how easy it was to have that set up.,Echo show 8
"Amazon - Echo Show 8"" Smart Display with Alexa - Charcoal",1,2,13 Aug 2020,DonnaM,"Our Echo Show started cutting off in mid sentences and doesn't finish. We have bought two other Echo Shows, along with 2 echo dots and have not had a bit of trouble.",Cuts off in mid sentences
"Amazon - Echo Show 8"" Smart Display with Alexa - Charcoal",1,3,13 Mar 2020,jkim371,"I was excited to try this Alexa device, but it would keep disconnecting from the network.  I ended up returning it.",Good if you can connect to Wifi
"Amazon - Echo Show 8"" Smart Display with Alexa - Charcoal",1,2,13 Apr 2020,JustBob,"Bought 4 Echo Shows, 3 of them Echo Show 5 the other one Echo Show 8.  Two of the three 5s talk to each other and the Show 8, the third one can talk to the other 5s but cannot see the Show 8 no matter what we do. Amazon Chat is useless. Online directions do not work. Period.",Echo Show hard to set up
"Amazon - Echo Show 8"" Smart Display with Alexa - Charcoal",1,3,13 Jan 2020,GAFamily,So far the video apps have not been working. I purchased it mainly for the Hulu app that doesn’t want to work.,Works Okay
"Amazon - Echo Show 8"" Smart Display with Alexa - Charcoal",1,3,13 Apr 2020,Jessah77,We ended up returning this and got the Echo 5 which is smaller.,Too big
"Amazon - Echo Show 8"" Smart Display with Alexa - Charcoal",1,5,13 Jul 2020,Techgeek,easy to use and setup.  Nice big screen and good sound.,Great device for streaming and video
"Amazon - Echo Show 8"" Smart Display with Alexa - Charcoal",1,5,13 Nov 2018,dont88,This is my second Echo Show 8. The sound is pretty good for the size and I don't hear any distortion even at full volume. I especially like that I can tune in a variety of broadcast and SiriusXM stations quickly and easily with a simple command or request.,I'm really impressed!
"Amazon - Echo Show 8"" Smart Display with Alexa - Charcoal",1,5,13 Feb 2020,Dshah,"Very easy to install , easy to use, great display, plays amazon prime videos","Great screen ,sound"
"Amazon - Echo Show 8"" Smart Display with Alexa - Charcoal",1,1,13 Nov 2019,Rwsparks,Doesn’t work. Screen doesn’t come on. Just makes noise and no picture or anything. I would do zero stars if possible,Echo 8
"Amazon - Echo Show 8"" Smart Display with Alexa - Charcoal",1,2,13 Jul 2020,Geeoh,The clock on this was smaller than the clock on my 5 inch. Bright it back because I use it for a clock also.,Didn’t like the clock
"Amazon - Echo Show 8"" Smart Display with Alexa - Charcoal",1,5,13 Sep 2020,HighTechAddict,"Perfect for talking with family in assisted living who are now in lockdown. Really great for those who are not comfortable with high tech but still need face-to-face contact with loved ones. Also comes in handy for getting information, music, and almost everything else with the simplicity and ease of hands free operation!  Easiest setup and operation yet.",Easy Setup and Operation
"Amazon - Echo Show 8"" Smart Display with Alexa - Charcoal",1,1,13 Sep 2020,Dana,No one came out to the car for 20 mins. Once someone came out I was not first (even though I arrived first). Couldn’t find the items. Just a mess. Unorganized people. Definitely would not do again.,Not good
"Amazon - Echo Show 8"" Smart Display with Alexa - Charcoal",1,1,13 Feb 2020,Nslzr70,Google home worked better for my philips hue lights. Alexa doesn’t know all the time which lights I want to turn on or off or change color. Google home always got it right he first time. I can’t return it but if I could I would change it for the google hub. I’m gonna give Alexa one more chance maybe for a few months. If it keeps annoying me I’m gonna donate it to the garbage and get the google nest,It’s ok
"Amazon - Echo Show 8"" Smart Display with Alexa - Charcoal",1,5,13 May 2020,AsianCubSD,I already had an Echo Dot and and Echo Show 5.  The Show 5 is great for the bedroom since it matches the average size of bedroom clock.  But the Echo Show 8 is great for living areas.  The screen is bright and pretty sharp.  The sound clarity is way better than the Dot and a little bit better than the Show 5.  If you are debating between the Show 5 and Show 8 consider you location.  Very easy to set up either though the touch screen or the Alexa App on your smart phone.  Love this model!  Combine this with Amazon Smart Plugs and lights to create a smart home that turns on lights automatically at certain times.  Set reminders for certain task.  Timers to help with cooking.  So many things!,Love the Value and Screen Size of this Echo
"Amazon - Echo Show 8"" Smart Display with Alexa - Charcoal",1,1,13 Oct 2020,ring,"poor with ring doorbell!
!!!!!!!!!!!!!!!!!!!!!!!!!!!!!!!!!!",doesn't work well with ring doorbell!!!!
"Amazon - Echo Show 8"" Smart Display with Alexa - Charcoal",1,1,13 Aug 2020,Jessenia,"The person that came out only installed Alexa and not the ring security (he only did the app)
I had to do
It myself and took me over 45 mints. This is something he had to install. That’s why he finish in 10 mints!!!",Echo show
"Amazon - Echo Show 8"" Smart Display with Alexa - Charcoal",1,5,13 Aug 2020,Kenn,I love that it displays lyrics for songs playing and also so convenient for recipes being displayed and showed pictures and step by step instructions instructions.  It's like having a voice activated fire tablet with great sound quality not to mention the main reason I purchased was to view my ring doorbell activity without having to have my phone.  Love it!,Even better than Echo!
"Amazon - Echo Show 8"" Smart Display with Alexa - Charcoal",1,5,13 Jun 2020,SharonA,"I have been using an Echo Dot for a couple years, and I upgraded to the Echo Show. It is a little pricey, but I got a good deal on the ""Deal of the Day"" so I decided to try it. I am so glad I did! It is so much fun displaying my Amazon photos...walking by and seeing random memories. And the sound on the Echo Show is far superior to the Dot. I enjoy listening to music, and Alexa can find just about any song you ask for! I'm having fun learning all the new capabilities of the Alexa app.",Love my Echo Show!
"Amazon - Echo Show 8"" Smart Display with Alexa - Charcoal",1,1,13 Aug 2020,Notneed,After few days it stop working. I was able to return it because it was less than two weeks. I got another one in less than a month it stop working.  I am very disappointed.,Very disappointed
"Amazon - Echo Show 8"" Smart Display with Alexa - Charcoal",1,4,13 Apr 2020,WKUTOPS1,"This device works well for controlling and monitoring compatible smart devices. Being an Amazon product, it obviously is designed to steer you within their product and service lines but it is compatible with several other popular non-Amazon brands and services too. The screen and overall size of the Echo Show 8 is perfect for kitchens or other areas that this device would be setup to be interactive and control smart devices within your home and for streaming music or making video calls etc.  Overall it’s a good product but I wish you could turn off the suggestions if desired on the bottom of  the screen!",Good interactive smart video and hub device
"Amazon - Echo Show 8"" Smart Display with Alexa - Charcoal",1,5,13 Oct 2020,Fredvrp,Bought 2 of these to work in conjunction with Ring doorbells in a senior citizen's house.  Setup was simple and the sound quality is excellent and better than expected.,Great product and video quality
"Amazon - Echo Show 8"" Smart Display with Alexa - Charcoal",1,5,13 May 2020,DeeS,"It great having this Alexa. I use it daily for so many purposes. It's my alarm clock, radio, recipe file, a wealth of knowledge and much more. It is easy to use and set up. The sound is great and I love adding my photos to it. 
I live in a rural area and when I can't get a signal for my cell phone I use Alexa. This is, to me, a hidden feature nobody spoke of and makes this unit more valuable to me!! I love my Show 8.",Great to have
"Amazon - Echo Show 8"" Smart Display with Alexa - Charcoal",1,5,13 Nov 2017,Charrison58,Easy to set up and connect to blue tooth items in the room. Display is a nice size.  Sound is great too.,Echo show 8
"Amazon - Echo Show 8"" Smart Display with Alexa - Charcoal",1,5,13 May 2020,Chuck49,Bought this unit for my daughter for video calling. It was simple to set up by my 9 year old granddaughter. She had it set up in minutes. It's the perfect size. Very good speaker. Music sounds great and volume is pretty loud.  Great for kitchen or bedroom. Still learning all the Alexa or Echo commands. Has some pretty cool games. Great for recipes in the kitchen. Highly Recommend.,Perfect for Family
"Amazon - Echo Show 8"" Smart Display with Alexa - Charcoal",1,5,13 Jun 2020,wickedkuul,"Nice sized screen, god sound quality, Worth the money. I have mine in the kitchen where it makes my life so much easier! I also have benefitted from Alexa helping keep our home school schedule during the Corona lock downs. Highly recommend it. A+ for the irony of buying an Amazon product at Best Buy. The drop off from Best Buy was very fast.",Really enjoying my Amazon Echo Show 8
