product,verified,rating,date,author,content,title
"Facebook - Portal Mini Smart Video Calling 8"" Display with Alexa - Black",1,5,23 May 2020,Thermidor,My Gf uses this to talk to her mom and it’s amazing. I love to camera follow feature while cooking.,Love it!!
"Facebook - Portal Mini Smart Video Calling 8"" Display with Alexa - Black",1,5,23 May 2020,Tmuncaster,So easy to use an set up. It will be sooo great to use to call people an Family,Amazing
"Facebook - Portal Mini Smart Video Calling 8"" Display with Alexa - Black",1,5,23 Jun 2020,Linda,Love the Facebook portal for holding all your pictures,Like this Facebook pirtal
"Facebook - Portal Mini Smart Video Calling 8"" Display with Alexa - Black",1,5,23 Jun 2020,andy,I love it. I love it. I love it. I love it. I love it. I love it.,great video camera
"Facebook - Portal Mini Smart Video Calling 8"" Display with Alexa - Black",1,5,23 Jun 2020,tree9989,Can’t believe how clear the picture is on this little device.,Camera is crystal clear!!
"Facebook - Portal Mini Smart Video Calling 8"" Display with Alexa - Black",1,5,23 Jun 2020,Honeylemon,"Awesome ,love my portal mini it’s just perfect and clear.",Portal mini
"Facebook - Portal Mini Smart Video Calling 8"" Display with Alexa - Black",1,4,23 Jun 2020,EACM,"Love the portal, flexibility and quality of images",love the portal
"Facebook - Portal Mini Smart Video Calling 8"" Display with Alexa - Black",1,5,23 Mar 2020,Mojo,Got this for my 80 year old dad to keep in touch with everyone. Love how easy it was to set up and use.,easy to use
"Facebook - Portal Mini Smart Video Calling 8"" Display with Alexa - Black",1,5,23 Apr 2020,808FIREMUTT,great for connecting with family far away. Video quality and sound are great too.,Great video quality
"Facebook - Portal Mini Smart Video Calling 8"" Display with Alexa - Black",1,5,23 May 2020,Felicia,Helps me keep in contact with family.   It’s loud very good sound,Very clear love it sound is great
"Facebook - Portal Mini Smart Video Calling 8"" Display with Alexa - Black",1,5,23 Jan 2020,Ryen,Bought this as a Christmas gift and my aunt loves it! So easy to use my 3 year old nephew uses it and makes phone calls from it lol,Christmas Gift
"Facebook - Portal Mini Smart Video Calling 8"" Display with Alexa - Black",1,5,23 Jan 2020,Jani,"As I also bought the Portal TV as well, I am using this for listening music. It's really great. Sound quality is pretty good.",Excellent sound quality on music
"Facebook - Portal Mini Smart Video Calling 8"" Display with Alexa - Black",1,4,23 May 2020,Mauricio,"Good product, it works great for video calls Camera moves great",Good for video calls
"Facebook - Portal Mini Smart Video Calling 8"" Display with Alexa - Black",1,5,23 Feb 2020,Mocha,Bought this for my mother. Easy to use. I like how it focuses on the person even when they move.,Easy
"Facebook - Portal Mini Smart Video Calling 8"" Display with Alexa - Black",1,5,23 Feb 2020,Havoc300ZX,"Wife got this for XMAS, and loves it. Picture quality is awesome. Can see the grandkids everyday.",Great Social Camera
