product,verified,rating,date,author,content,title
"Amazon - Echo Show 8"" Smart Display with Alexa - Charcoal",1,5,13 Feb 2020,Jumil,"First step in making my home smart! Great quality, easy to use and setup.",First step in making my home smart!
"Amazon - Echo Show 8"" Smart Display with Alexa - Charcoal",1,5,13 Nov 2017,Tenderfoot1955,This is my 2nd one. My 1st is the smaller one but both are great. I love the bigger screen as I have it sitting on the end table next to me and I use it often. Thanks,My thoughts
"Amazon - Echo Show 8"" Smart Display with Alexa - Charcoal",1,5,13 Sep 2020,MacOwner,"This product provides a great service during this pandemic, while we cannot physically socialize and many are at an age where they are not able to use the apps that connect, this product is easy to use and can bring your family together.",Excellent way to keep the family together
"Amazon - Echo Show 8"" Smart Display with Alexa - Charcoal",1,5,13 Jul 2020,awherry7,"My siblings and I bought this for my dad for fathers day.  He has some visual and motor impairment (struggles with small print and low contrast things).  He absolutely loves that he can talk to ""Alexa"".  He enjoys watching youtube videos on this as well as music.  It was a great gift even for someone who isn't the most tech savvy.  It is friendly to those with visual and motor impairment! Highly recommend :)",Bought for my dad and he loves it!
"Amazon - Echo Show 8"" Smart Display with Alexa - Charcoal",1,5,13 Mar 2020,TLG8R,Great product. Easy to setup. Easy to use. All ages.,Easy to use
"Amazon - Echo Show 8"" Smart Display with Alexa - Charcoal",1,5,13 Jul 2020,Boomshalaq1969orgey,Love this Echo Show better then the 5 all the great features with a bigger screen love this we will be buying more for all the grandchildren gonna go buy the 10 inch one for ourselves as usual Amazon makes great quality merchandise very easy to learn how to use makes Prime that much better tells you when your Amazon packages  have arrived at your door great alarm to wake you up has so many features can’t even remember them all,It’s nice and big
"Amazon - Echo Show 8"" Smart Display with Alexa - Charcoal",1,3,13 Jul 2020,Tuts,"Easy to use once set up.   I like ease of setting alarms, timers, weather.   I know they can do a lot more but just haven’t taken the time to try.  Got two on a great sale.....one for bedroom and one for the kitchen.",Fun
"Amazon - Echo Show 8"" Smart Display with Alexa - Charcoal",1,5,13 Nov 2019,Stephen,"Great for chatting with the grandkids, listening to your favorite music & discovering some great recipes. Could not be happier.",Great Entertainment
"Amazon - Echo Show 8"" Smart Display with Alexa - Charcoal",1,5,13 Feb 2020,Seabass,Very easy to use and set up would highly recommend for anybody,Great product for the price
"Amazon - Echo Show 8"" Smart Display with Alexa - Charcoal",1,5,13 Nov 2017,marty,"Amazon - Echo Show 8"" is a very nice unit and certainly worth the cost. It does a lot and has a nice rich sound. Wish I bought this sooner!!!!","Amazon - Echo Show 8"" Nice unit"
"Amazon - Echo Show 8"" Smart Display with Alexa - Charcoal",1,5,13 Jan 2020,reallycoolguy69,Works perfect in a kitchen! very easy to use was set up in minutes,Great!
"Amazon - Echo Show 8"" Smart Display with Alexa - Charcoal",1,5,13 Feb 2020,GaMom,Echo show is a great device with excellent sound and features.,Perfect screen size
"Amazon - Echo Show 8"" Smart Display with Alexa - Charcoal",1,5,13 Feb 2020,Danloru,Better than show 5.display is better sharper. Easier to see.,Great show the best one. Better than show 5
"Amazon - Echo Show 8"" Smart Display with Alexa - Charcoal",1,5,13 Jan 2020,Tyler,Good sound great product plus it has a clock. Really simple to use,Great speakers
"Amazon - Echo Show 8"" Smart Display with Alexa - Charcoal",1,4,13 Jul 2020,Cocoa,"For the price, this is best device for making video calls. I went in with my brothers to purchase several so we can be in video contact with our aging family members. My 92 year old grandmother loves it, and enjoys playing music on it.  I do wish it had an improved camera like the Google Nest in which the video camera follows the individual in the room, which allows for a more natural engagement with device. Also a criticism, I wish Amazon Devices had permissions to communicate with Google Devices. One of my brothers has the same echo device while another brother has Google Nest. It was cheaper to buy multiple Amazon Echos than Google Nest, at $200 a pop.",The cost & value of product lead the way
"Amazon - Echo Show 8"" Smart Display with Alexa - Charcoal",1,5,13 Feb 2020,drone,bought as a gift and very user friendly and easy to set up,very good product
"Amazon - Echo Show 8"" Smart Display with Alexa - Charcoal",1,5,13 Aug 2020,BAB23,So much fun and helpful. Other than music my favorite thing is it helps me with my grocery list so I don’t miss anything at the market or purchase things I don’t need. I tell her what I need when I see it’s low and when I go to the store it’s all written down in my app divided by sections.,Obsessed
"Amazon - Echo Show 8"" Smart Display with Alexa - Charcoal",1,5,13 Sep 2020,Bigscottallen,I love the Echo Show 8! It's a wonderful addition to the kitchen. I can watch show on Hulu and Amazon Prime. I can listen to Spotify and other streaming services. It has great sound and ample volume. It has a lot to offer for such a low price.,Echo Show 8 is awesome!
"Amazon - Echo Show 8"" Smart Display with Alexa - Charcoal",1,4,13 Apr 2020,JB760,I have been eyeing the echo show line since it came out. I have several 2nd gen dots and enjoyed them so wanted to upgrade my Alex experience. Almost picked up a bogo for the show 5 a few months back and glad I held off because I jumped on the deal of the day and scored a bogo on these Show 8’s and I am very happy with the purchase even though one arrived with a nick in the side but BestBuy was great and offered a replacement or discount to keep the item. All in all these are great smart displays with a crisp HDish picture and very good sound. Just wish it had the light for notifications and you could customize it a bit more. Also the mic array could use some improvement. I find myself having to shout and speak slowly for it to recognize what I am saying. Hopefully the next gen has those improvements but for now it’s a solid choice and happy with the purchase.,Good upgrade for Alex and nice smart screen
"Amazon - Echo Show 8"" Smart Display with Alexa - Charcoal",1,5,13 May 2020,BlazerMe,"You just can not beat the deal from Best Buy really good ! 
Echo show 8 has larger screen than Echo Show 5, better sound, and it start to work with Ring protection to guard against home by listening to glass break, or CO detector etc... tons of good stuff from it, I love it.

However the drop in feature could have more room for improvement, if you have multiple devices at home, the drop in will pick the Echo device closest to you ( actually your cell phone) that could be scary.",Love the Echo Show 8 and best buy deal
"Amazon - Echo Show 8"" Smart Display with Alexa - Charcoal",1,5,13 Nov 2019,Ptrk,"First one I purchased, and am impressed with the quality of the sound.  Also like the 8"" screen.","Echo Show 8"""
"Amazon - Echo Show 8"" Smart Display with Alexa - Charcoal",1,5,13 May 2020,jimp2249,Bought this for my home office  now working at home. Big screen is easy to see. I use it for anything Alexa. Wife had to go to Florida to help with grand kids out of school. We talk everyday on this and her Echo 5. Lots better than a phone. I watch front door RING for deliveries also. Big screen is beautiful and easy to see. Worth every bit. I use the smaller Echo 5s around the house for other purposes and to see where son is when need to talk to him.,Love it
"Amazon - Echo Show 8"" Smart Display with Alexa - Charcoal",1,5,13 Sep 2020,Ricky,"I’ve been stalling the Kasa switches over the last few weeks and finally moved to the dimmer. Aside from the wiring of my house, the install was straightforward and easy and appreciate the integration with Alexa. So far I’m pleased.",Great product
"Amazon - Echo Show 8"" Smart Display with Alexa - Charcoal",1,5,13 Nov 2017,Bowler300,"Easy to install and setup.
Connection of multiple devices is also easy.
Unit provides a wealth of information and entertainment.",Great home automation device
"Amazon - Echo Show 8"" Smart Display with Alexa - Charcoal",1,5,13 Jan 2020,GaryC,Very easy to set up and use. Clear audio and video,Easy to set up
"Amazon - Echo Show 8"" Smart Display with Alexa - Charcoal",1,5,13 Oct 2020,IndianaJ,This product is all I expected and more! The way you can hook up so many different things in your home is very convenient. Not too mention Alexa and all it does!,Great product for securing your home!
"Amazon - Echo Show 8"" Smart Display with Alexa - Charcoal",1,5,13 Apr 2020,2Rotary,"The sound from this unit sounds like a much larger speaker. Full rich sound. Clear highs and punchy bass. If you listen to rock, pop, and jazz, this unit is for you. If you have a ring doorbell, it even better because it will show you who is at the door. If you listen to R&B, and Rap music, the echo sub would be recommended. This speaker screen is easy to pair with others for stereo pair or music scenes like party mode. I have not found any real complaints about the product. Excellent value at $89.",Great sound.
"Amazon - Echo Show 8"" Smart Display with Alexa - Charcoal",1,5,13 Aug 2020,ML999,"I haven't used all of the functions on it yet, but it certainly a very nice upgrade from the Echo Dot.  The video is clear.  Other family members had shown us theirs and some of the functios and making a video call with it, and that prompted me to buy one.",I like the Echo Show!
"Amazon - Echo Show 8"" Smart Display with Alexa - Charcoal",1,5,13 Aug 2020,Angie,"We purchased two of these, and are having a great time with them.  We have one upstairs and one downstairs.  We play games with the grandchildren, works with our Ring doorbell, karaoke, listen to music, set alarms, announce when dinner is ready...... display lots of our photos .... it's AWESOME",Lots of fun and easy to use
"Amazon - Echo Show 8"" Smart Display with Alexa - Charcoal",1,5,13 Jan 2020,Mnovz,"+++Easy to use and install, highly recommended !!!",+++
"Amazon - Echo Show 8"" Smart Display with Alexa - Charcoal",1,5,13 Nov 2018,tonyS,Love it!  Great to talk to your family and friends and hear music! I would highly recommend it to anyone,Love it!
"Amazon - Echo Show 8"" Smart Display with Alexa - Charcoal",1,5,13 May 2020,tbc51550,"My wife loves to listen to music when she’s in the kitchen, so I wanted to upgrade her music experience and provide her the ability to watch videos. The quality of the speakers is excellent and she can tune into her any of her favorite streaming shows or even watch cooking videos or find recipes. She uses it daily. She can play any of her subscription services from SiriusXM or Amazon music, and find exactly the music she wants to listen to.",Echo Show 8 is Great!
"Amazon - Echo Show 8"" Smart Display with Alexa - Charcoal",1,5,13 Nov 2019,FNUZ,I really like the updated design...its more responsive than echo show 5..simple set up and easy to use,works well
"Amazon - Echo Show 8"" Smart Display with Alexa - Charcoal",1,5,13 Oct 2020,JoeNathan,"This Echo Show 8 is a perfect size to sit on my computer desk, play video clips as I request, and listen to music from SiriusXM.  The picture is amazing, the sound quality exceptional.",Love this
"Amazon - Echo Show 8"" Smart Display with Alexa - Charcoal",1,4,13 Nov 2018,Dfwcoach,Clear display. I would give this 5 stars if there was a way to use this as a clock. I have very bad eyesight and the time is very small on the display with no way to enlarge it. The time is displayed larger on the show 5.,Needs better clock customization options
"Amazon - Echo Show 8"" Smart Display with Alexa - Charcoal",1,5,13 Oct 2020,Nitmare64,Dad loves it! Thats all that matters. Video calls to my parents. Visual music playing all the time and my mother loves the recipes. Sound is great in this lil package.,Dad love it!
"Amazon - Echo Show 8"" Smart Display with Alexa - Charcoal",1,5,13 Oct 2020,Lubin,"Excellent but.  Suta at my desk, music sound quality is awesome and I can ask questions, check weather, and drop in on other devices   Great buy and very useful.",Great sound and helpful
"Amazon - Echo Show 8"" Smart Display with Alexa - Charcoal",1,5,13 Jan 2020,kwebbster,"After trying all the different sizes of Echo Show devices, we have decided that the Echo Show 8 hits the sweet spot without being too large or too small. The full sized Show had a beautiful display but took up way too much space. The 5 inch Show was way too small, the sound the really limited and its capabilities were limited due to size. This one meets all the capabilities of the full Show, but with less space being taken up.  It sounds good, has a great display and is pretty customizable. We also tried using Fire HD tablets in Show mode, but the speakers were extremely limited and the mics weren't nearly as good as this device.  Can't go wrong with this purchase!","Really love the ""Middle"" Echo Show"
"Amazon - Echo Show 8"" Smart Display with Alexa - Charcoal",1,5,13 Sep 2020,kitty,"I loved put music when I wake-up and Alexa remember me when I have appointments.  That's sound very loud.  So, I loved and I get 1 more to my home.

Thanks Alexa for help me in my rushing days.",Great sounds and make my days more easy.
"Amazon - Echo Show 8"" Smart Display with Alexa - Charcoal",1,5,13 Aug 2020,Spaceman,"This is a fun gadget.  It is will make phone calls (out going), give you weather stats, answer question and the list goes on.  I am finding more things it can do with the help of skills (apps).  The screen is just the right size and twin speakers make it sound remarkable.",Great assistant
"Amazon - Echo Show 8"" Smart Display with Alexa - Charcoal",1,5,13 Nov 2018,BMom,I really like this.  Larger screen   Making viewing easier for Ring Doorbell or recipes.,Amazon Echo Show 8
"Amazon - Echo Show 8"" Smart Display with Alexa - Charcoal",1,5,13 Sep 2020,JohnNSheri27,love the big screen. It is easy to set-up. I wish it had some other good things like calling on duo or something but its ok. I us it with my ring and indoor camera.,Great
"Amazon - Echo Show 8"" Smart Display with Alexa - Charcoal",1,5,13 Oct 2020,peter,we are loving the depth of sound for music and videos. We use it to pull up our shopping list and review recipes. Exactly what we needed,Perfect addition to our Kitchen
"Amazon - Echo Show 8"" Smart Display with Alexa - Charcoal",1,5,13 May 2020,IndyMike,"Had no idea how convenient, helpful, and fun an Amazon-Echo Show 8 with Alexa would be until I visited my daughter and saw hers. I love this device, and utilize it several times a day, beginning with the day's forecast, asking for correct spelling, music, and general questions. Would highly recommend this device, and also suggest the 8"" screen as opposed to the smaller unit.",Great Alexa for A Beginner!
"Amazon - Echo Show 8"" Smart Display with Alexa - Charcoal",1,4,13 May 2020,ShawnB2063,"This really helped us connect our kids with their grandparents.  My dad doesn't have a smartphone and there aren't good instructions with it on how to set it up with downloading the Alexa app on your smartphone.   I dug around online long enough in Amazon help docs to figure it out, but was definitely more challenging to set up than expected.  With a smartphone, it's much easier.  Dont like how you cant adjust the angle it sits at without spending more money on an adjustable bracket.  Sometimes your too close, sometimes you're too far away... cant adjust it.  Picture and video quality is good.  No complaints there.",Decent functionality for the price.
"Amazon - Echo Show 8"" Smart Display with Alexa - Charcoal",1,5,13 Oct 2020,Klwh,"Very easy to use and able to perform numerous functions such as telling the weather forecast, setting a kitchen timer, playing music, etc",Great device!
"Amazon - Echo Show 8"" Smart Display with Alexa - Charcoal",1,5,13 Aug 2020,FastandEasy,"If you like using Alexa this Echo Show will become the hub for your echo dots.
Easy to setup, Great Sound,  and picture quality is above Average. There are so many things that can be done with this unit.",Great Echo Show Series
"Amazon - Echo Show 8"" Smart Display with Alexa - Charcoal",1,5,13 Nov 2019,tullydog,Easy to use and connect. Picture quality perfect and sound also,Very Happy
"Amazon - Echo Show 8"" Smart Display with Alexa - Charcoal",1,5,13 Jan 2020,hien34,"This was purchased solely for dropping in on family members that may need care.  The bonus is the sound from the speaker is rich and full so voices, music, and the occasional recipe video sound great.

If you're in the Amazon ecosystem, it's a no-brainer when it's on sale.  Even if you're in multiple ecosystems (like me), it seems each has its purpose.  We use Google and their assistants for almost everything, but there are always great deals on the Echos and their drop-in functionality is priceless for checking in on loved ones that may not be able to operate these devices.","if you use drop-in and listen to music, it's great"
"Amazon - Echo Show 8"" Smart Display with Alexa - Charcoal",1,4,13 Sep 2020,Titusito,Worth the purchase if you are invested into Amazon products or have Alexa enabled devices. It's a pretty versatile device that can become very handy once you learn the different ways you can leverage it. Audio quality is very solid for a device this small. Price is very reasonable and is almost a no brainer when on sale.,Solid complimentary device!
"Amazon - Echo Show 8"" Smart Display with Alexa - Charcoal",1,5,13 Nov 2018,Dprivera,All the family enjoy talking with Alexa. The display is great. I hate that I cannot see the morning news.,Great Product
"Amazon - Echo Show 8"" Smart Display with Alexa - Charcoal",1,5,13 Jan 2020,ksnrn,Nice looking and good sound. Easy to setup and use.,Excellent and price.
"Amazon - Echo Show 8"" Smart Display with Alexa - Charcoal",1,5,13 Jun 2020,Tisha,I purchased the Alexa Echo Show 8 when my son ended up in the hospital from brain injury and due to the corona virus pandemic my family and I were not able to visit. The Alexa was the  perfect item to keep me close and in touch with him and staff. Easy to setup and great ideal for comfort. I have told others that had family members in the hospital as well. Great investment!!!!,Really Awesome To Have
"Amazon - Echo Show 8"" Smart Display with Alexa - Charcoal",1,5,13 Nov 2017,Tonyd,Great purchase. Fun to use and easy. Drop in function is great. Pairs with other smart home devices. Nice sound.,Great purchase
"Amazon - Echo Show 8"" Smart Display with Alexa - Charcoal",1,4,13 Feb 2020,BrianS,Works well as an addition to an Alexa based home automation system. Easy to read screen and great sound.,Great addition to the home automation
"Amazon - Echo Show 8"" Smart Display with Alexa - Charcoal",1,5,13 Oct 2020,mweyand8987,"For me, this was an upgrade from the echo show 5. I love the larger screen in the kitchen, and I was able to move my 5 to the bedside. I love the Amazon products!",Big Screen!!
"Amazon - Echo Show 8"" Smart Display with Alexa - Charcoal",1,5,13 Nov 2017,Bart,Like the way it liks to Ring and the plugs. You can't go wrong with this purchase.  It is fairly easy to set up.,8 inch Echo
"Amazon - Echo Show 8"" Smart Display with Alexa - Charcoal",1,5,13 Aug 2020,RadioComputerGuy,"Bought this product to go with my Ring Security system makes it easier to look at one's cameras and to communicate with Amazon.
The product does what the box says's and the price made it an avoidable addition to my home.

Thank you, Best Buy.",Good Price Products Dos What it States
"Amazon - Echo Show 8"" Smart Display with Alexa - Charcoal",1,4,13 Jul 2020,PaukyDucky,"The Echo Show 8 is awesome, its the only affordable Smart Speaker / Video with a camera on it, and the camera works decently well. Everything is pretty seamless. The speaker sounds amazing, a lot of bass. I bought one for my mother in law so that we can chat with her easily and its so simple that even she has no issues using it. 

My only gripe is Alexa, I have an Alexa and a Google home next to it, and Alexa's voice recognition capability is terrible compared to Google's, it just doesn't work as well. But otherwise it works fine.","Great device, Alexa is not great, speaker is great"
"Amazon - Echo Show 8"" Smart Display with Alexa - Charcoal",1,5,13 Aug 2020,Meggy79,"I love everything about the Alexa show. Very user friendly. I really enjoy working in the kitchen and can just ask Alexa to pull up a youtube video, a recipe or even watch hulu while cooking or cleaning. I also purchased the echo 5 for my son.",Love this!
"Amazon - Echo Show 8"" Smart Display with Alexa - Charcoal",1,4,13 Jun 2020,JanetA,"I have never used a smart speaker, before, but got this for a family member who was in the hospital unable to have visitors.  The video screen was a nice way to communicate, since we could not be there in person, and the access to Amazon Prime, photos, etc. was an added bonus.  Thankfully I had a 20 something helping me set this up, as we had to set-up remotely and then drop at the hospital, with a set of instructions for the nurses to get it up and running again.  I would say for the price its a nice little useful gadget!  The only thing that would make me like it better - if it was cordless.",Useful little gadget
"Amazon - Echo Show 8"" Smart Display with Alexa - Charcoal",1,5,13 Aug 2020,Feldam,The Echo Show 8 is an Excellent product. Affordable compared to its big brother (10 inch) and little brother (5 inch). Display and speaker are great quality and easy to connect to your existing Alexa infrastructure. Good luck. You will not regret it.,Excellent product. Affordable and great quality
"Amazon - Echo Show 8"" Smart Display with Alexa - Charcoal",1,5,13 Oct 2020,Jonny5,I had bought the small echo realized it was to small. Decided to get the echo show 8 wow!! This thing is amazing clear picture and sound.,Echo show 8 is awesome!!
"Amazon - Echo Show 8"" Smart Display with Alexa - Charcoal",1,4,13 Feb 2020,Soundguy,"The sound is more bassy than clear, but good. It is OK for monitoring cameras and answering door bell.",Good Screen
"Amazon - Echo Show 8"" Smart Display with Alexa - Charcoal",1,4,13 Apr 2020,Jbizzle,Has a good sound when plays the music from Amazon.,Very informative!!!
"Amazon - Echo Show 8"" Smart Display with Alexa - Charcoal",1,5,13 Sep 2020,Syncan28,I purchased the echo 8 for my mom that's in a nursing facility. I like that I can drop in to talk to her without having to go through the nurse's station.,Great camera. Easy to use.
"Amazon - Echo Show 8"" Smart Display with Alexa - Charcoal",1,5,13 Jan 2020,BHCarp,"Amazed at it functionality, controlling lights, outlets and nested together with echo dots to play music and execute audio commands throughout the house.","Impressive, love it"
"Amazon - Echo Show 8"" Smart Display with Alexa - Charcoal",1,5,13 Sep 2020,ALIG,"I love putting on music while i cook. An how easy it yes to get recipes, Tell ask to put a timer on instead of touching the stove timer with your dirty hands lol I watch HULU on mine too.",Best Kitchen Tool
"Amazon - Echo Show 8"" Smart Display with Alexa - Charcoal",1,5,13 Nov 2018,Dragons,I love the show! I’m getting a few around the house. Sounds great too!,Echo show
"Amazon - Echo Show 8"" Smart Display with Alexa - Charcoal",1,4,13 Jul 2020,LessHelpfulYoda,"Everything has worked perfectly fine on the Alexa side and with the ease of using it, but the speakers blew out a bit after only about 2 months. I had it about 70% for music, alarms and drop in calls. Going to try and swap it for another one because 2 months is wayyyy too early for the speakers to start having problems. That being said, I love all the amazon products I've bought so far.",Works perfectly but speakers gave out 2 early
"Amazon - Echo Show 8"" Smart Display with Alexa - Charcoal",1,5,13 Oct 2020,Dockski2463,Just Love My Echo Show features and Picture Quality And Sound Amazing,Just Love It
"Amazon - Echo Show 8"" Smart Display with Alexa - Charcoal",1,5,13 Sep 2020,Roush,"We had the Echo 5, after having it for 6 months, we decided to buiy the Echo 8 as well, that poor thing gets a lot of usage.",Great sound! Awesome graphics
"Amazon - Echo Show 8"" Smart Display with Alexa - Charcoal",1,5,13 Jun 2020,Bryan,"I bought this for my wife for her birthday and she uses it for recipes in the kitchen with step by step videos, music for this kids or to check our ring doorbell. I highly recommend this!",Great sound and amazing video quality!
"Amazon - Echo Show 8"" Smart Display with Alexa - Charcoal",1,5,13 Jan 2020,Beaver,"Bought a pair of these to allow long distance video chatting between my family!  All of the features an Echo Dot has, added with a clear and useful screen.",Love this for Video chatting!
"Amazon - Echo Show 8"" Smart Display with Alexa - Charcoal",1,4,13 Aug 2020,Savage,Love the picture and how easy it is to use. Setup was simple.,Great product
"Amazon - Echo Show 8"" Smart Display with Alexa - Charcoal",1,5,13 Nov 2017,AlexT,"I purchased the Echo Show 8"" because I had to run out for groceries during the lockdown and it allowed me to keep in contact with my daughter with the drop-in feature.   My daughter loves being able to ask questions and listen to music on it.","Keeping in touch with the Echo Show 8"""
"Amazon - Echo Show 8"" Smart Display with Alexa - Charcoal",1,5,13 May 2020,Vicky,"Bought the stand to go with it.
Easy to use. I like it a lot.",Great picture and great sound
