product,verified,rating,date,author,content,title
Google - Nest Wifi AC2200 Router - Snow,1,5,23 Nov 2019,m0nkey,"The Google Nest WIFI AC2200 Router was super easy to set up with the Google Home app. The Google Home app walks you through the installation process with ease. I did have an issue with it connecting to my WIFI smart outlets that run on 2.4GHz. I called up Google and they provided me a workaround to get them set up. (it will require a secondary phone with hotspot capabilities). I am paying for 200 Mbps internet and when I perform the speed test I hit 207 Mbps on Ookla's speedtest. On top of the performance and ease of setup, I put this router ontop of our floating TV console in our living room and it is aesthetically pleasing to look at. My GF did not like our old router with the antennas sticking out.

1. Setup a secondary phone hotspot with the same SSID and password as you configured for your Google Nest WIFI Router

2. Turn on secondary phone hotspot

3. Connect your Phone to the secondary hotspot
     a. Ensure that you see the blue banner on secondary phone
     b. Ensure that you see the hotspot symbol on your phone

4. Using the specific WIFI smart app, enter in the same SSID and password as in step 1

5. Once you walk through the steps on the smart app and it successfully connects

6. You can now turn off the hotspot and rename the secondary phone back to its original name

7. On your phone now you can connect back to the Google Nest WIFI

8. Verify controls to WIFI outlets while on the Google Nest WIFI

This is to trick your WIFI outlets to thinking its connecting to a 2.4GHz router, this is because the Google Nest WIFI router does not have dedicated WIFI SSID's for 2.4GHz and 5Ghz. (Both channels are rolled up into one SSID)

I hope this help others!",Aesthetically Pleasing / High Performance Router!
Google - Nest Wifi AC2200 Router - Snow,1,5,23 Nov 2018,WifiExtender,Works well in extending the range in my home.  Now I can work from my backyard as well!,WIFI
Google - Nest Wifi AC2200 Router - Snow,1,5,20 Nov 2020,BenN,Easy to set up with the google home app and gets good speed.,Good Product
Google - Nest Wifi AC2200 Router - Snow,1,5,23 Nov 2018,Sophia11,Best minimal router in the market! I get an internet speed of 220+ mbps for downloads.,High recommended
Google - Nest Wifi AC2200 Router - Snow,1,5,23 Nov 2018,Ash23,Best router ever. I have a 3 level townhouse and have no trouble getting a strong signal!,Love this router!
Google - Nest Wifi AC2200 Router - Snow,1,5,23 Jan 2020,jm23,"This works really good and it is better than the previous version. However, if you have the old Google mesh router, they are not easy to manager together since you have to use the Google Wifi app to manage the old ones and the Google Home app to manage this device. But this new generation router works better and covers more area. I intend to eventually replace my other devices so that I don't have to have 2 apps to manage my wifi.",Great Mesh Router
Google - Nest Wifi AC2200 Router - Snow,1,4,23 Jul 2020,nestito,"Listen, if you don't want to mess around with router settings and just want something to just work. Get this. I assure you that you'll love it. The device actually looks good enough to place on a countertop and not due to its minimalistic form factor. The only issue with this router is that there's only one Ethernet port. If your home is strictly wifi only then this won't be an issue.",Sexy and Easy
Google - Nest Wifi AC2200 Router - Snow,1,4,23 Jun 2020,DrGary,"Pleasantly surprised on how easy it was to integrate the new Nest AC2200 router with the old Google WIFI system. I currently had a three mesh system. I could not stabilize my system from constant drop offs.
The addition of the fourth Nest router did the trick.  The addition of the new Nest router with the old Google WIFI system was seamless. Overall the improvement is noticeable and satisfactory.
One comment. The Nest units are very shockingly expensive.",Purchased a Nest WIFI AC2200 Router
Google - Nest Wifi AC2200 Router - Snow,1,5,23 Oct 2020,AliNader,BEST ever! Needed to upgrade a unit I purchased. Justyn was more than accommodating!  Loved the experience!,WiFi
Google - Nest Wifi AC2200 Router - Snow,1,5,23 Oct 2020,MrsTendies,This little booger has some serious output. Reaches all of our devices and hasn't dropped a signal like others we have used!,Works great!
Google - Nest Wifi AC2200 Router - Snow,1,4,23 Aug 2020,Manny,Purchased this router to upgrade my first generation Google wifi mesh network. Took a little while for me to get my network setup again but my network is working better than before. I am not technically savvy in setting up networks which is why it took me a while to setup.,Nice upgrade
Google - Nest Wifi AC2200 Router - Snow,1,5,23 Feb 2020,RyansWorld,I walked into Best Buy knowing it was time to replace my outdated and failing router. I did some research on WiFi routers prior to visiting the store however had some questions based on my application and needs. The Best Buy employee offered some recommendations and then sold me on the Google Nest WiFi Router after he showed me how it integrated with the Google Home app and Google Assistant. Needless to say I walked out of the store with a Google Nest WiFi AC2200 Router along with a new switch for my house. All I can say is that it works and it works well.,Plug and play Wifi router
Google - Nest Wifi AC2200 Router - Snow,1,4,23 Nov 2019,Larkinwf,This product is becoming my main WiFi unit. It looks cool and sends the signal throughout the house.,Signal sender
Google - Nest Wifi AC2200 Router - Snow,1,5,23 Nov 2019,AlaynneA,"Best WiFi router I’ve ever owned. Seamless setup, great performance!",Awesome!
Google - Nest Wifi AC2200 Router - Snow,1,5,23 Oct 2020,Marge,Works really well. Before getting the Nest WIFI I had trouble connecting my Wyze cams. Now they connect every time. Great product.,Great Product
Google - Nest Wifi AC2200 Router - Snow,1,5,23 Oct 2020,MyJunkStuff,Upgrading from the original Google WiFi... Great product... Easy setup... highly recommend it...,Worth the upgrade... highly recommend
Google - Nest Wifi AC2200 Router - Snow,1,5,23 Sep 2020,Trey,Awesome little device!!! Packs a punch!!! Easy to connect to!! What more could you want!,Works great!!! Averaging 113 mbps!!!
Google - Nest Wifi AC2200 Router - Snow,1,5,23 Nov 2019,Shantsamtani,Great product. Easy to buy in the store. I recommend.,Product review.
Google - Nest Wifi AC2200 Router - Snow,1,5,23 Sep 2020,JoshF,I switched from a Netgear nighthawk that kept dropping internet broadcast. This router has been amazing! It’s 100% worth the price!,This is an amazingly reliable router
Google - Nest Wifi AC2200 Router - Snow,1,5,23 Sep 2020,Johnr101,Google Nest WiFi router is just what I needed to give my lagging wifi some Umph!!,Powerful Little Guy
Google - Nest Wifi AC2200 Router - Snow,1,5,23 Oct 2020,DanCG,Really good router that can do gigablast service! I recommend,Great Router! Best!
Google - Nest Wifi AC2200 Router - Snow,1,5,23 Oct 2020,Sheri,I am very satisfied with google nest wifi. It’s so far performed well,It’s a great interactive product
Google - Nest Wifi AC2200 Router - Snow,1,5,23 Jul 2020,Kevin,Have tried several brands of mesh routers and Google was the best.  I have a mix of the newer And older Nest Wifi routers and they work flawlessly in my 5500sf house.,Fantastic
Google - Nest Wifi AC2200 Router - Snow,1,5,23 Sep 2020,LouieV26,FANCY LOOKING AND HASNT FAILED ME SINCE I BOUGHT IT. SAFE AND RELIABLE,MESHED GREAT WITH OLD SYSTEM
Google - Nest Wifi AC2200 Router - Snow,1,5,23 May 2020,Techjunkie,My wife and I just moved into our new place and the router is too far from the family room so we got one of these. Not only was it just plug and play but the google home app gives you stats and notices when your internet is down. Best purchase ever,Easy isn’t the half of it
Google - Nest Wifi AC2200 Router - Snow,1,5,23 Jul 2020,Slippety,Added to an existing nest system could not have been easier.  If you are looking for a user friendly mesh router system go with the Nests,Great router
Google - Nest Wifi AC2200 Router - Snow,1,5,23 Jan 2020,MysticZealot,"Installed this at my parents house for Xmas. Super simple to set up.

Funny thing I found out, and it’s pretty sneaky by Google. If you are using a manually set DNS provider on your smartphone other than Google, it’s fails to setup constantly.

I switched it from cloud flare DNS to google after about 30 minutes of thinking what was happening. Most people won’t have this issue",Can’t get any more simpler
Google - Nest Wifi AC2200 Router - Snow,1,5,23 Jun 2020,Patpiwo,"Love, love the new Google router.  Noticeable improvements from the older google router and points.  Great thing is the new router works with the old google router/ points.  Highly recommended.",Love the new Google Router
Google - Nest Wifi AC2200 Router - Snow,1,5,23 Jul 2020,ScoobyDoo,Just got gig internet setup and with this router there is no need for a modem. Speed is great and range is better than my previous Modem/Router combo.,Amazing router
Google - Nest Wifi AC2200 Router - Snow,1,5,23 Apr 2020,Charuto,"The router/modem that my internet provider gave me it doesnt cover my apt. I ask a friend with the same problem and recomend it me this. I bought it because I'm trying to make my apt smart, since I use google home and mini, I preffered to stay with the google network.",It's Work Great!!
Google - Nest Wifi AC2200 Router - Snow,1,5,23 Jul 2020,TinkerbellOh,It is nice to be able to block the kids out from being on the Internet all night long or whatever they decide they want to not do their chores.,Sweet
Google - Nest Wifi AC2200 Router - Snow,1,5,23 Sep 2020,Frankiej2,out performs any wifi mesh out right now.massive coverage.excellent,Awesome mesh wifi
Google - Nest Wifi AC2200 Router - Snow,1,5,23 Aug 2020,Erictheman1080,Great product. It does everything I need it to do in a simple and effective way. Highly Recommend!,Excellent device!
Google - Nest Wifi AC2200 Router - Snow,1,5,23 Aug 2020,IraB,"Great WiFi product. I love the google mesh system , and how it covers our 5 bedroom house",Great WiFi product. Works well
Google - Nest Wifi AC2200 Router - Snow,1,5,23 May 2020,Mark,This router replaced an Apple Extreme Base Station with an Express extender and it does better (much better) than the Apple equipment.  I am a big Apple fan but this Google product far surpasses my expectations.,Excellent Router
Google - Nest Wifi AC2200 Router - Snow,1,5,23 Sep 2020,Rosita13,"Very handy, and work out great! I fully recimmended",Awesomr
Google - Nest Wifi AC2200 Router - Snow,1,5,23 Jul 2020,Raza,One the best decision i have ever made to switch it to google nest router. Speed is like a bullet. You would never regret. Worth every penny.,The best router ever!!!
Google - Nest Wifi AC2200 Router - Snow,1,5,23 Sep 2020,Chilly,Added to my existing Google WiFi mesh. Works very well as main hub,Great Router
Google - Nest Wifi AC2200 Router - Snow,1,5,23 Apr 2020,Keisha,Son loves it! Got it at a great price and son now has his own Wifi for gaming. Works great with Xfinity!,Great!
Google - Nest Wifi AC2200 Router - Snow,1,4,23 Jul 2020,Lo1st,"google nest is a good device, small, and nicely displayed",google nest
Google - Nest Wifi AC2200 Router - Snow,1,5,23 Jan 2020,Soto,When I purchased the google nest router I had my doubts about the mesh system itself but I was quickly relieved of all my concerns because the product delivers as advertised.,Wonderful product!
Google - Nest Wifi AC2200 Router - Snow,1,5,23 Feb 2020,Rias1,Great store ! Love the products but I continuously had to ask for assistance before someone finally came. I stood waiting for 25 minutes.,Great wifi for beginners
Google - Nest Wifi AC2200 Router - Snow,1,3,23 May 2020,Urias,"I really enjoy Google products, though this probably wouldn’t be their best. I had to upgrade primary routers from our previous Google 3p due to it randomly dropping Wi-Fi, and not even a months time has passed and the issue persists. Their customer service and forums haven’t helped either, so i’d advise doing thorough research before purchasing this.",Great at first but...
Google - Nest Wifi AC2200 Router - Snow,1,5,23 May 2020,Marketu,"We were having trouble with wifi, no more, this works great!",PPefect fit for our ranch home
Google - Nest Wifi AC2200 Router - Snow,1,5,23 May 2020,TomT,Replaced a 1st gen google nest and was wowed by the improvement.,Worth the upgrade
Google - Nest Wifi AC2200 Router - Snow,1,5,23 Dec 2019,Bobby,This unit is good to have in your home. Along with the nest you can see who is at y out ur front door. Or see who is getting into the ice cream at night.,This is great to have.
Google - Nest Wifi AC2200 Router - Snow,1,5,23 Apr 2020,LAEB,Maintains high mbps across the house.  I also have 3 Google WiFi Routers.,Works great with XIFI
Google - Nest Wifi AC2200 Router - Snow,1,4,23 Jun 2020,Bewtyboi,Yeah boiiiiiiiiiiiiiiiiiiiiiiiiiiiiiiiiiiiiiiiiiiii,Yeah boi
Google - Nest Wifi AC2200 Router - Snow,1,5,23 Mar 2020,JohnnyBoy,I love the nest wifi over the Google hubs.  They seriously beefed up my mesh system,Great improvement
Google - Nest Wifi AC2200 Router - Snow,1,5,23 Apr 2020,Panagirl,No buffing or slowness with connectivity since I install it.,I have not any issues with my internet since.
Google - Nest Wifi AC2200 Router - Snow,1,4,23 May 2020,Waine1976,Very high quality but more technical setup than standard routers.,Hi tech router
Google - Nest Wifi AC2200 Router - Snow,1,5,23 Feb 2020,B0hunt3r39,"I was recommended by a 3rd party and man do these things work, I am impressed to say the least",These are a must for full home Wifi access
Google - Nest Wifi AC2200 Router - Snow,1,5,23 Apr 2020,Dede,Great product and I will recommend this product to anyone,Excellent
Google - Nest Wifi AC2200 Router - Snow,1,4,23 May 2020,bunt,Range us but then what advertised otherwise great product,Great
Google - Nest Wifi AC2200 Router - Snow,1,5,23 Feb 2020,Ddesz,All good friendly helpers and staff didn’t over sell me took time to explain item,Great router
Google - Nest Wifi AC2200 Router - Snow,1,5,23 Apr 2020,Jimmy,Very happy with the google - Nest Wifi AC2200 Router .,Very happy with it
Google - Nest Wifi AC2200 Router - Snow,1,5,23 Mar 2020,DonD,Doubled my average download sites. Great value and great upgrade.,Great upgrade from Google wifi
Google - Nest Wifi AC2200 Router - Snow,1,5,20 Nov 2020,Echo,"If you have not given google nest wifi a try, you should. It definitely surpasses connectivity compared to other wifi extenders or routers. Super blazing fast speed when using this to expand wifi across the home. Decent price, totally worth it.",Google Router
Google - Nest Wifi AC2200 Router - Snow,1,5,23 Sep 2020,CowtiprSR,"Before installing this router, I bought two other routers within a week and both of the other two stopped connecting to Spectrum so I returned them. This router was easy to setup and I haven’t had any connection loss with this one.  Coverage throughout the house is good, even in the basement without the Point.",Easy to set up and use.
Google - Nest Wifi AC2200 Router - Snow,1,5,23 Jan 2020,RSinWA,The router is installed and operating just fine.  The unit is the beginning of my home's systems.,NEST Router
Google - Nest Wifi AC2200 Router - Snow,1,5,23 Oct 2020,Dhananjay,"I bought this router as an alternative to FIOS router provided by Verizon. The Verizon FIOS router is big and doesn’t look good. I found almost all the functionality in the google router and it works just perfect for me.

I can manage devices, set the static ips can manage guest network. Run the Speedtest to individual devices. 

I highly recommend this router if anyone is looking for an alternative for Verizon FIOS router.",Great WiFi Router
Google - Nest Wifi AC2200 Router - Snow,1,5,23 Nov 2018,Aristides,This is an amazing upgrade to the wifi. I had two apple AirPort Extreme devices that got overwhelmed when there were more than 15 people in the house. This manages up and downstream connections like no other. My speed went up from 150/190 mbps to over 400 with no effort.,Amazing home internet upgrade
Google - Nest Wifi AC2200 Router - Snow,1,5,21 Nov 2020,iPhone,"Excellent excellent excellent device. I bought it, the setup was very easy and nice, and I haven’t have any issue with it. In fact, the WiFi app is awesome! Highly recommended and the price it really good in my opinion.",Excellent WiFi Device
Google - Nest Wifi AC2200 Router - Snow,1,5,20 Nov 2020,bigmushroom,Great product - solved out connection issues in a 2000 square feet home. It's super simple to set up with your phone. The Google assistant is actually useful even though I initially believed that I would never use it.,Reliable and powerful Wifi
Google - Nest Wifi AC2200 Router - Snow,1,4,23 Nov 2019,Salehannah,This master router works well for amplified WiFi signal we coupled with boosters of the same series across our home and offices. We got this model as the previous one was weaker and had signal interference with other devices which blocked the signal on a specific type of smart TV we had.,Good master WiFi router for signal amplification
Google - Nest Wifi AC2200 Router - Snow,1,5,23 Nov 2018,IAmDad,"With my old Went through several hours of technical support, changed routers , changed placement. But nothing worked. Then got this and it seems as if bumped myself to a much better internet plan. No drop outs , good speed.",Change router over time.
Google - Nest Wifi AC2200 Router - Snow,1,5,23 Nov 2019,JimLea,Excellent coverage and very easy to set up. This unit covers the whole house main floor and basement rooms over 2700 square feet. A good buy that we use on over 8 pieces of equipment with no issues.,Good buy
Google - Nest Wifi AC2200 Router - Snow,1,5,23 Nov 2017,SReview,Glad to have my own router so that I don’t have to worry about constantly changing my smart devices. Setup can be tricky only can you have to make sure you modem isn’t still connected to your prior modem.,Convenient
Google - Nest Wifi AC2200 Router - Snow,1,5,23 Oct 2020,DINHO,"I had a problem with my internet since it only arrived in certain areas of my house and google nest wifi I ended up with the problem, it is very easy to install and it is very practical and does not take up much space",problem solved
Google - Nest Wifi AC2200 Router - Snow,1,4,23 Aug 2020,Octopvz,"I bought this to replace my current router that my ISP provides. At first I thought everything was good with speeds going great to my phone but then when I would play online, I would see a huge dip in latency, causing my game to lag.  And for COD Warzone, lag can mean life or death. 

The software only allow me to prioritize one device at a time and it would dramatically reduce the speed of the other non-prioritized devices. 

Google Home app works great with it, just not good for what I needed.","Good for just WiFi, not gaming."
Google - Nest Wifi AC2200 Router - Snow,1,5,22 Nov 2020,MichaelScott,"Amazing product. Being able to pause the wifi on other devices really helped when it’s not currently in use. Fast, reliable and smart.",GOOGLEONE
Google - Nest Wifi AC2200 Router - Snow,1,5,23 Oct 2020,RandomCustomer,"A little upset at how expensive this router is, but I'm impressed with the performance. Can easily handle 15+ devices at any moment and does a great job keeping everyone up to speed. I also like the Google Wifi app which makes the wifi easier to manage.","Speed, speed, speed!"
Google - Nest Wifi AC2200 Router - Snow,1,5,22 Nov 2020,8marc5,"Very good router, no reasons for complaining. It can handle multiple devices at once and it was super easy to set up.","Good router, worth picking up"
Google - Nest Wifi AC2200 Router - Snow,1,5,23 Nov 2018,Danol07185,Outstanding Router... fast... dependable...love the features in the app to modify devices etc. I get on avg 575-700 mbps over WiFi.  and I LOVE IT!,BOOM GOOGLE NEST
Google - Nest Wifi AC2200 Router - Snow,1,5,23 Nov 2019,maubritto,"Best wi-fi router I've ever had !!! Easy to set up and everything works perfectly.
Don't know why took me so long to try Google nest.",Best wi-fi router ever
Google - Nest Wifi AC2200 Router - Snow,1,5,23 Feb 2020,Theo213,"Reviews for this system were sterling but initially, I tried to go with a Netgear Nighthawk device. In short, the Netgear was returned and in came Le Google Nest.

Setup was a breeze and the range on this thing is simply impressive. The main router provides a stronger signal with faster and more consistent speeds than what Xfinity's box provided and destroyed the Netgear Nighthawk in all meaningful categories.

If you're looking for in-depth networking configuration options - this isn't for you. This is consumer grade (albeit high-end) networking tech. If you want fancy configuration options, you're better off with a Ubiquiti Unifi system or some other comparable enterprise system.

This does NOT have WiFi 6 compatibility but that's not mainstream yet and shouldn't be a dealbreaker (until 2022 or so)

If you need fast & stable blanket coverage for your home, this is a great option.",Simply Excellent!
Google - Nest Wifi AC2200 Router - Snow,1,4,23 May 2020,Boredallday,"Works great for streaming, not so much for gaming.",Good product
Google - Nest Wifi AC2200 Router - Snow,1,5,23 Mar 2020,Maxthedog,Is there really good product like it a lot it’s very good.,Like it
Google - Nest Wifi AC2200 Router - Snow,1,5,23 Feb 2020,Mart,Worked very well with out nest cameras to acquire wifi and our location.,Easy to use with nest cameras.
Google - Nest Wifi AC2200 Router - Snow,1,5,23 Aug 2020,BethBV,"We connected the router to our ISP's connection, downloaded the app and scanned the code on the bottom of the router.  So easy and works great.  We get a clear, 5-bar connection from anywhere in our 1,800 sq ft home with speeds of 250 Mbps upload/download.  Our ISP is 1G which is way faster than our computers are capable of handling.",Easy Set Up
Google - Nest Wifi AC2200 Router - Snow,1,4,23 Apr 2020,Everett,The sound on this thing is just so sweet you have to get one,Sounds bra
Google - Nest Wifi AC2200 Router - Snow,1,5,23 Feb 2020,Suecole,Like it easy to install works great in my home looks good,Very small takes up no room
Google - Nest Wifi AC2200 Router - Snow,1,5,23 Dec 2019,hddhh,got these because bedroom doesnt get good coverage using verizon router. works great,good wifi
Google - Nest Wifi AC2200 Router - Snow,1,5,23 Feb 2020,Rick,works great                                       thanks,works better than the older one
Google - Nest Wifi AC2200 Router - Snow,1,3,23 Jun 2020,PackerDan,The Google name seems to bear out higher pricing but this router integrated relatively easily with online support assistance. Provided instructions were not effective.,Pricey but nicely integrates
Google - Nest Wifi AC2200 Router - Snow,1,3,23 Sep 2020,Rachithi,Easy to blame WiFi but I believe the product also needs to be refined further,Very useful
Google - Nest Wifi AC2200 Router - Snow,1,4,23 Feb 2020,Jaws,"Works well, and supports multiple devices.  We like the clean profile look.",works well.  no issues
Google - Nest Wifi AC2200 Router - Snow,1,3,23 May 2020,MonitorCustomer,"Bottom line is that my 7 year old router, for which this router was a replacement, was more reliable and faster than this router. 

I find myself having to restart it every other day because WiFi drops.",Easy to install but not great quality
Google - Nest Wifi AC2200 Router - Snow,1,2,23 Jan 2020,Junk1,I upgraded from a previous model and it doesn't work any better. I have this in the office and one waypoint in the master bedroom that is down the hall and works good. And 2 waypoints down stares on opposite ends of the center of the house with one wall between all points. One has a weak connection and the other drops. That's ALOT of money for 4 units that don't work like they should. I wouldn't recommend it.,Not worth it
Google - Nest Wifi AC2200 Router - Snow,1,3,23 Aug 2020,munchadoo,Seems to work ok. Not sure if I am always too far away or if I am using it right or not,Router
Google - Nest Wifi AC2200 Router - Snow,1,3,23 Apr 2020,Frustrated,"Tried to hook up with my existing ""Google WIFI"" points and took hours of trial and error to finally connect them.
Still not able to connect with my Sonos.  Would not buy unless you are starting from scratch.",Need some help with this one
Google - Nest Wifi AC2200 Router - Snow,1,3,23 Jul 2020,Bdub1,"I wanted to upgrade from my old Google Wifi and OnHub set up.  I am using two Nest Wifi routers, and have added one old Google Wifi Puck to help with coverage in a far-off corner of my home.

The difference in speed and coverage is fantastic.  It was also easy to set up.

Unfortunately, I have had some issues.  Having to use both the Google Home and Google Wifi app is a pain.  I have no idea why Google would be ok with that kind of set up.  A big source of frustration is that my Sonos speakers have been rendered useless (I am getting ready to sell them).  This is because they don't seem to work well with the Nest mesh system.  They constantly drop out of coverage, and it's impossible to have more than one Sonos speaker even showing as available at any time.  The final problem is that while i have 25 devices on my wifi network, the Google apps rarely show more than 12.  Again, I have no idea why, but it's been extremely frustrating.  I didn't have these issues with Google Wifi.  I'm close to selling this system and trying Eero.  

This seems to be a ""miss"" by Google.",Mixed Bag
Google - Nest Wifi AC2200 Router - Snow,1,3,23 Sep 2020,bbrown2011,Returned and got a cheaper router.  Liked the look.,good router
