product,verified,rating,date,author,content,title
"Facebook - Portal Mini Smart Video Calling 8"" Display with Alexa - Black",1,5,23 Apr 2020,Lindam116,I purchased 3 of these for my family across the USA.  It has been a great way for all of us to stay connected.  My elderly parents were able to connect with ease even though they are not tech savvy.  The simplicity is great.  The picture and audio are excellent.  We love the way the camera follows the subject with movement.  I highly recommend purchasing during this time of social distancing.,Wonder way to stay connected
"Facebook - Portal Mini Smart Video Calling 8"" Display with Alexa - Black",1,5,23 May 2020,Dave51026,Love this device. When you make a call the camera will follow you around the room. Good sound quality for streaming music.  This device I like better than the other brands that I own.,Great device for hands free WhatsApp calls.
"Facebook - Portal Mini Smart Video Calling 8"" Display with Alexa - Black",1,5,23 May 2020,Marie,This seems to be a great product. Like the fact that you can shut the camera and microphone off and still use it for music.  I can play my Sirius XM on it.  Has great picture and is easy to use.,Great Portal
"Facebook - Portal Mini Smart Video Calling 8"" Display with Alexa - Black",1,4,23 Jan 2020,Bill,"Wife loves it for keeping in touch with grandkids out of state. Story time mode is nice.

Simple, clean, easy set up. The privacy features are appreciated (easy to see when the camera lens is closed and covered.)

Got this as a bundle deal and gave one to our daughter out of state. Wait for the sale and get the bundle.",Story time
"Facebook - Portal Mini Smart Video Calling 8"" Display with Alexa - Black",1,5,23 Jun 2020,Blizz,"Lots of features 
Seems to work easier then the Show IMHO
Seems more people have access to and are more familiar to Facebook then amazon anyways",seems to work well
"Facebook - Portal Mini Smart Video Calling 8"" Display with Alexa - Black",1,5,23 May 2020,novamel,"I considered this among the echo show and Googles equivalent 8"" display.  Our family has 5 echos in our home and love using alexa which is why this appealed to us as well.  The only limitation is that you can't ""drop in"" on this device.  I just wanted an EASY to use video caller for my parents to use to call my kids.  I got 1 for each home and love it!  The Portal is user friendly, especially for the old and the young.  Almost everyone we would chat with has facebook or/and messenger already so the Portal was an easy choice.  We have tons of pic already on facebook so the digital frame it turns into when not in use automatically rotates them.  Unless you use Amazon for photo storage and everyone you want to talk to has a show also OR you only use google products, the Portal is a winner.    My little ones love the other features as well.",Better Video Chat device then the rest!
"Facebook - Portal Mini Smart Video Calling 8"" Display with Alexa - Black",1,5,23 Jun 2020,Lmac,This is great during stay at home orders.  The video quality and sound is good.  Easy to use and to connect to to your WiFi,Second purchased
"Facebook - Portal Mini Smart Video Calling 8"" Display with Alexa - Black",1,5,23 Jan 2020,CTJo,It is fun to use and I was able to use it right away.  Took all of 20 minutes +/- to set up and 15 was it setting itself up.  I like the ability to opt in or out of features.  I made a call right after set up and the picture and sound quality was surprisingly good.,Very easy to set up and use
"Facebook - Portal Mini Smart Video Calling 8"" Display with Alexa - Black",1,5,23 May 2020,Rias124,Bought this to keep in touch with my elderly mother who lives alone.  She loves it...plus the digital photo feature is great.,Great for keeping in touch with loved ones.
"Facebook - Portal Mini Smart Video Calling 8"" Display with Alexa - Black",1,4,23 Jun 2020,rainwater,"Bought this for my Mom on mother's day,  was easy to use and the video and audio sound was very good.",Gift for Mom
"Facebook - Portal Mini Smart Video Calling 8"" Display with Alexa - Black",1,5,23 Jul 2020,Critter2,"Happy with my purchase.
Quick way to communicate with family",Relatively easy to use. Good quality picture
"Facebook - Portal Mini Smart Video Calling 8"" Display with Alexa - Black",1,5,23 Jan 2020,AMD1982IL,"This is the future of communication and the future is right here and right now, nice design, great video quality, and great sound trust me your faMILY AND FRIEND WILL LOVE IT! BEST GIFT EVER",Best Small video screen for video chat
"Facebook - Portal Mini Smart Video Calling 8"" Display with Alexa - Black",1,5,23 Jun 2020,Tisoy,"Very handy for communicating with families and friends, great picture and sounds.",Very good friendly equipment
"Facebook - Portal Mini Smart Video Calling 8"" Display with Alexa - Black",1,4,23 Jun 2020,Chris,I purchased portal for my mom now she can see her great grand babies as they grow.,Clear picture great investment
"Facebook - Portal Mini Smart Video Calling 8"" Display with Alexa - Black",1,5,23 Jun 2020,Cjg1,"love this product, the picture is clear.  The sound is great.",Great picture
"Facebook - Portal Mini Smart Video Calling 8"" Display with Alexa - Black",1,1,23 Jan 2020,suaodat,"In order to use the portal I had to sign-up with Face Book. That was okay for about a minute until Face Book locked me out. then, trying to fix the problem, there is no one to call and the online was not helpful at all. I tried several times to re-instate mu Face Book account but nothing worked. I am still locked out and cannot use the Portal. I will be bringing both portals back for refund.",Face Book does not make the set up an easy process
"Facebook - Portal Mini Smart Video Calling 8"" Display with Alexa - Black",1,1,23 May 2020,J3nBest,I thought this would be fantastic for us to use to be able to video chat with the family and use much like the virtual assistant Alexa or Google play. Sadly this was not the case. All the apps I had on my previous virtual assistant were not available on this device. I decided to return it and get one with the same capabilities as an Alexa or google device to meet our needs.,Not for me
"Facebook - Portal Mini Smart Video Calling 8"" Display with Alexa - Black",1,1,23 Jun 2020,everythingRGB,"Initially I thought this was good fit for me, since I really want alexa and a digital picture frame. But man after a week, my whole family hated this thing, the digital picture frame function worked alright but holy xxx, built-in Alexa? Did FB got a dumb down version of Alexa or something? Failed 8 out of 10 times when I ask it to doing simple thing like turn of my TV, on the other hand I have a echo show that works 100%.","Don't buy it if you looking for a ""smart"" device"
"Facebook - Portal Mini Smart Video Calling 8"" Display with Alexa - Black",1,3,23 Dec 2019,Nk4s,Bad camera quality whatsApp calling integration is not good.,Not bad
"Facebook - Portal Mini Smart Video Calling 8"" Display with Alexa - Black",1,3,23 Feb 2020,Moses,I am pleased with it. I would reccomend it to anyone.,Nice
"Facebook - Portal Mini Smart Video Calling 8"" Display with Alexa - Black",1,3,23 Feb 2020,essamgorgi,"too much money foe the same usage my apple phone 
Average",the same my Apple phone
"Facebook - Portal Mini Smart Video Calling 8"" Display with Alexa - Black",1,3,23 Jan 2020,SCGM,It is cool but limited in what you can do with it.,Just ok
"Facebook - Portal Mini Smart Video Calling 8"" Display with Alexa - Black",1,1,23 Jan 2020,NormaJean,Can't load my Ring app or all my telephone contacts on it so what's the point? You're forced to create a Facebook account so that you can use it and I didn't really like that. I ended up trading my in for the Echo Show 8.,Not A Fan
"Facebook - Portal Mini Smart Video Calling 8"" Display with Alexa - Black",1,1,23 Jul 2020,None,"Defective Product, Does Not Work, I bought 3  for gifts 1 works and 2 do not. The 15  day return has expired and now I’m stuck with them.",Does not work
"Facebook - Portal Mini Smart Video Calling 8"" Display with Alexa - Black",1,2,23 Jun 2020,Coco,Sometimes the sound from the person you talking with  it’s muffle,Sound
"Facebook - Portal Mini Smart Video Calling 8"" Display with Alexa - Black",1,4,23 Dec 2019,Danv,"The Portal is a great solution to keep in touch with the tech-challenged friends and family members like grandparents or other Luddites in your circle. While it requires a FaceBook account, it does not require BOTH people to have one. My wife does not do social media, but I need to keep in touch since she is medically housebound. The solution is to call myself on the Portal. While this also makes my phone and laptop ring while I wait for her to answer, it's NBD. 
Trying to make this a hub of sorts, FB has baked in Alexa support (it did conflict with the Echo dot in the room, so that will move). You can link Spotify or other streaming music, and there's a rudimentary browser so you can check email and other simple tasks. There is no battery, however, so the AC power--which has a long jack leg that acts as an easel--would make this awkward to use as a tablet. Video quality is decent on average connection speeds, although the camera is a little confused by lack of motion and tends to zoom and pan awkwardly when there's no focal point in the frame. (My wife is laying down, for example, and unless she gestures, the camera often pans away from her looking for motion in the room.)
I can see this as an ideal way to contact grandparents, check in with a child while you're away, etc. But I wouldn't use this for all my friend chatting, because Facebook and privacy. It's also not a high-function replacement for other hub products, Alexa notwithstanding. For the narrow purpose I have--keeping in touch with a loved one who has no cell phone or internet presence--it's an economical, simple solution. But you do sort of have Zuck and Alexa posing as ""elf on the shelf"" unless you massage privacy settings carefully.",Staying in touch is the goal...
"Facebook - Portal Mini Smart Video Calling 8"" Display with Alexa - Black",1,5,23 May 2020,Ed510,Shipped Grandma a portal so we can have dinner every night her. Excellent sound and video quality. Also we have been wanting a digital picture frame which the Portal does a great job.,Awesome Mother's Day Gift.
"Facebook - Portal Mini Smart Video Calling 8"" Display with Alexa - Black",1,5,23 Jun 2020,Dillingerspops,Purchased it as a mother's day gift for my mom that lives in another state. Was hard for her to use her cell phone but this is very user friendly.,Very easy to use.
"Facebook - Portal Mini Smart Video Calling 8"" Display with Alexa - Black",1,5,23 Jun 2020,J4Y7H3K1N6,Happy to add this to our home. Price is worth 1 video call to my mom and sister states apart. Following you around the room works great.,Perfect size and price
"Facebook - Portal Mini Smart Video Calling 8"" Display with Alexa - Black",1,5,23 Jun 2020,PirateSteve,"Amazing product, easy to set-up and extremely easy to use. Especially in this time of everyone required to be socially seperated. Great price from Best Buy!",Facebook Portal Tablet
"Facebook - Portal Mini Smart Video Calling 8"" Display with Alexa - Black",1,5,23 Aug 2020,Deidre,This is very easy to use and is a great way to stay in touch.,Great product
"Facebook - Portal Mini Smart Video Calling 8"" Display with Alexa - Black",1,5,23 Jun 2020,Kathy,"and all my pics rotate on the screen, so I get to enjoy them when I want to. I still have more to explore. 
Enjoy my portal a lot",I enjoy talking to all my facebook friends face.
"Facebook - Portal Mini Smart Video Calling 8"" Display with Alexa - Black",1,5,23 Jun 2020,Hendu28,Bought this for my father to use and communicate with the kids from across the state. It was even easy enough for him to use.,Ease of use
"Facebook - Portal Mini Smart Video Calling 8"" Display with Alexa - Black",1,4,23 Jan 2020,Markymark,Bought one for myself and my in laws to use and it is very simple and easy to use and they are able to use the portals easily. The way the camera adjust and you are able to close the camera off when you aren’t going to be using it. If there was a way it did not need to be plugged in all the time would be great,Very great technology!
"Facebook - Portal Mini Smart Video Calling 8"" Display with Alexa - Black",1,5,23 May 2020,MLSGerbs,"Easy to use and a lot of fun! Highly recommend, especially for older individuals who might not want to or can't use a smartphone for video-chatting.",Great for keeping in touch with family
"Facebook - Portal Mini Smart Video Calling 8"" Display with Alexa - Black",1,5,23 Jun 2020,lonewolf55,Works great Am able to read larger text.  Music sounds great coming out of the portal. I would recommend to all on this product,Facebook Portal
"Facebook - Portal Mini Smart Video Calling 8"" Display with Alexa - Black",1,5,23 May 2020,Ej10271,This is easy to use and was a perfect way for us to see our grandpa during Covid. If it was wireless that would make it better,Perfect way to see family
"Facebook - Portal Mini Smart Video Calling 8"" Display with Alexa - Black",1,4,23 Feb 2020,Kahoutek,"The portal mini is the right size for viewing and has a good picture. I purchased both a black and a white one, so they blend in with different decors.  It is easy and straight foreword to start up and install. So far I.m very happy with it.",Good size for small areas
"Facebook - Portal Mini Smart Video Calling 8"" Display with Alexa - Black",1,4,23 Jun 2020,LaLa,The only disappointing feature is that the Alexa does not make calls. Having this feature would make this device perfect.,Very good gift idea
"Facebook - Portal Mini Smart Video Calling 8"" Display with Alexa - Black",1,5,23 Jul 2020,JMELP,This is a little power house for video calls and works great as an Alexa speaker,Great video calls with built in Alexa
"Facebook - Portal Mini Smart Video Calling 8"" Display with Alexa - Black",1,5,23 Jun 2020,Bnbsvw,"This portal works great, I just wish I would have purchased the larger screen. The clarity is superb!",Works great!
"Facebook - Portal Mini Smart Video Calling 8"" Display with Alexa - Black",1,5,23 Jun 2020,Jan0108,Its a wonderful way to stay in touch with family that has moved to different states. Love using it.,Easy to use for any age.
"Facebook - Portal Mini Smart Video Calling 8"" Display with Alexa - Black",1,5,23 Jun 2020,BigJoe,Easy setup and great video chat. Took a bit to update but after that it was easy.,Easy peazy
"Facebook - Portal Mini Smart Video Calling 8"" Display with Alexa - Black",1,5,23 Jan 2020,Kimber5765,Was xmas gift to our son in Missouri.  He loved it! Super easy to use & set up. We can keep in contact even now.,Awesome new toy!
"Facebook - Portal Mini Smart Video Calling 8"" Display with Alexa - Black",1,5,23 Feb 2020,TSoward,Really neat little gadget. Very easy to use and set up. No network port though so wifi only,Really cool magic frame
"Facebook - Portal Mini Smart Video Calling 8"" Display with Alexa - Black",1,4,23 Jan 2020,Collector527,Easier to use than the lenovo hub I bought. Does a great job with the facebook messenger. quality of the calls are good.,Works as advertised
"Facebook - Portal Mini Smart Video Calling 8"" Display with Alexa - Black",1,3,23 Jun 2020,Silly,Still having issues trying to connect additional accounts but overall nice for video calling and messaging. We do enjoy the additional Alexa on the portal which is useful in listening to music.,Not Bad
"Facebook - Portal Mini Smart Video Calling 8"" Display with Alexa - Black",1,4,23 Jan 2020,RJones,"Works great, algorithm for camera follow can get a little confused when kids are bouncing off the walls",Good camer
"Facebook - Portal Mini Smart Video Calling 8"" Display with Alexa - Black",1,3,23 Apr 2020,Scoutmom,"Well, got this for an older parent  who wanted to chat with the kiddos. Only limitation I can really complain about is the lack of aps and things like that. Video quality is sometimes sketchy but that’s due to internet connection.",Nice for video calls but limited.
"Facebook - Portal Mini Smart Video Calling 8"" Display with Alexa - Black",1,5,23 Feb 2020,Usernames,"Gift for my mom, she loves it, uses it for everything",Easy to use
"Facebook - Portal Mini Smart Video Calling 8"" Display with Alexa - Black",1,4,23 Jan 2020,Ron1,Still learning but have enjoyed so far. Lot of fun features to mess with.,Works well and fun features
"Facebook - Portal Mini Smart Video Calling 8"" Display with Alexa - Black",1,5,23 Jan 2020,alex,Easy to set up and use. Great video quality and sound.,Geat product
"Facebook - Portal Mini Smart Video Calling 8"" Display with Alexa - Black",1,5,23 Jan 2020,Aprilwatcher,We are enjoying this tv very much.  Picture is great.,great tv.  began using even before Christmas
"Facebook - Portal Mini Smart Video Calling 8"" Display with Alexa - Black",1,4,23 Jan 2020,MZee,Good product for beginners. Easy to use. Kid friendly.,.
"Facebook - Portal Mini Smart Video Calling 8"" Display with Alexa - Black",1,2,23 Jan 2020,Toma27,"Just was not what I expected. Returned the Portal.  I think the large screen TV Portal might be a better option for ""fixed location"" I didn't like the fact that it did not have a battery option so I could take it to other rooms or outside without plugging in.  It was more difficult to setup than expected. I did not see much benefit over using my laptop or ipad to be honest. Might be good for some, just not portable or intuitive enough for me,",Just was not what I expected
"Facebook - Portal Mini Smart Video Calling 8"" Display with Alexa - Black",1,4,23 Dec 2019,Grandma,Daughter in another state. Great to talk to grandkids.,Good sound
"Facebook - Portal Mini Smart Video Calling 8"" Display with Alexa - Black",1,1,23 Dec 2019,mrh1954,"So I bought this for my 93 year old Father in-law so that we could keep in touch by video. HOWEVER you need a Facebook account so when I went to create one. I got this message; You Can't Use Facebook Right Now We're currently reviewing your submission. 
We're always looking out for the security of our community, so until then you won't be able to use Facebook.",Do not buy if you do not have a facebook account!!
"Facebook - Portal Mini Smart Video Calling 8"" Display with Alexa - Black",1,3,23 Jan 2020,Daniel,"I thought we could do Facebook in an app on this portal but it goes to a web site with difficult to navigate options. 

Otherwise video chat is good.",Good for video chat but limited otherwise
"Facebook - Portal Mini Smart Video Calling 8"" Display with Alexa - Black",1,3,23 Feb 2020,Jjsmom,Works well but you need to use Facebook. Good picture.,It’s OK
"Facebook - Portal Mini Smart Video Calling 8"" Display with Alexa - Black",1,5,23 Jun 2020,donnette,I purchased this for my mother-in-law. My husband hasn't seen his mom 7 months and I really wanted to get this gift for her so that she could video call her son and grandchildren. She was hesitant to set it up but she received help and we were so happy to be able to video call her the other day. The clarity is great and we loved seeing her. I have since then bought the TV portal.,Mother's day gift
"Facebook - Portal Mini Smart Video Calling 8"" Display with Alexa - Black",1,5,23 Apr 2020,AgRN16,"We got this as a gift for our MIL.  She video calls us with Whatsapp from it frequently, and it works very well.  She loves it!!",great gift for our MIL
"Facebook - Portal Mini Smart Video Calling 8"" Display with Alexa - Black",1,5,23 Apr 2020,Glory4TheKing,"I bought the camera when COVID-19 prevented me from going to visit my new 1 month old granddaughter. While it’s not the same as holding her in my arms, it’s been wonderful having the camera follow her every movement. While all the extra online usage does at time affect the quality of the pictures, I tend to get better reception with the portal than using messenger on my phone. Glad I bought it so I don’t miss out a day on my granddaughters life.",Great camera for Grandma’s!
"Facebook - Portal Mini Smart Video Calling 8"" Display with Alexa - Black",1,5,23 Aug 2020,Jilly,It’s very easy to use once you get used to it. Wasn’t a big Facebook video chatter but this works well. Also it’s nice to be able to watch some of the Facebook live videos on the device rather than on my phone.,Works Well
"Facebook - Portal Mini Smart Video Calling 8"" Display with Alexa - Black",1,5,23 Oct 2020,Houdinii,"Use this to keep in touch and watch my Grandkids grow up.

Easy to use for both 60+ and 6-10 Year old.",Great during COVID times!
"Facebook - Portal Mini Smart Video Calling 8"" Display with Alexa - Black",1,5,23 Jun 2020,JayVee3,I purchased the Facebook Portal for both my mom and mom-in-law and now they're able to start calling friends and family (near and far) without the need to look at their small cell phone.. This is a great product and I also got it on sale. Swipe it up and use it because most folks that you know already have a Facebook account!,Easy to use Communicator for older folks!
"Facebook - Portal Mini Smart Video Calling 8"" Display with Alexa - Black",1,5,23 May 2020,Nickname,"Product is great for video chatting with people that have other Portals or facebook messenger. It does NOT work with Messenger Kids, just FYI. the video quality is AMAZING from Portal to Portal. Much better than any other video chat system on the market. Works with Whatsapp also, and kids love using the built-in avatars and face changers, story time and alexa controls.",Great Product
"Facebook - Portal Mini Smart Video Calling 8"" Display with Alexa - Black",1,3,23 Sep 2020,LordOdDestruct1,"This is now my go-to device for Video chat, that I started using Facebook Messenger over Facetime or Duo. The face-tracking feature makes a world of difference especially if both parties have this device. But, the device itself is buggy, UX lags and freezes often. Alexa support is sub-standard and not the same as a first-party Echo Show. I'd give it 5 stars if they make the software more stable and add support for 3rd party apps like Teams, Duo, Alexa video calling, Youtube.","My go-to device for Video chat, but..."
"Facebook - Portal Mini Smart Video Calling 8"" Display with Alexa - Black",1,5,23 Oct 2020,Franky,Easy to use just need a Facebook account. Stay connected to family all over the world,Connection
"Facebook - Portal Mini Smart Video Calling 8"" Display with Alexa - Black",1,5,23 Apr 2020,Mary,"Got this for my mom for Christmas. It is super easy to use and she loves that she gets to
See us on video. Great cause the person answering doesn’t need one to use it. She can just give it a verbal command and call whoever. Super easy for non tech people! The camera follows her if she gets up to show me something. Super cool",Perfect gift
"Facebook - Portal Mini Smart Video Calling 8"" Display with Alexa - Black",1,5,23 Jul 2020,kidcymucks,"Debated between this and Alexa Show, but this won due to it's ease of use with FB Messenger. My mom takes it everywhere with her. The only drawback is it has to be plugged into power to work. Maybe they'll address that in the future.",Great Mother's Day gift
"Facebook - Portal Mini Smart Video Calling 8"" Display with Alexa - Black",1,3,23 Jan 2020,G7edge,I like the fact you can face time and chat with people. Its a little too boxey looking for my liking. Good sound and good clarity. Id give it a 7/10,Its so so
"Facebook - Portal Mini Smart Video Calling 8"" Display with Alexa - Black",1,5,23 Jun 2020,Donzn8tor,"It works just as advertised. The slide show feature is cool, as is the built in Alexa. We've enjoyed using it with family for fun group calls, and several of them have purchased one too. The zoom and pan feature is neat.",Fun and useful
"Facebook - Portal Mini Smart Video Calling 8"" Display with Alexa - Black",1,4,23 Jul 2020,kuppyli,"Love it for video chatting! My kid loves the story time. I wish it had more official apps to install like YouTube, Pinterest, etc and capabilities to integrate with my blank mini home camera!",Great Video Chat Capabilities
"Facebook - Portal Mini Smart Video Calling 8"" Display with Alexa - Black",1,5,23 Jun 2020,Riego,As a photographer I love being able to put my photos on here as a photo frame. Easy enough for my kids to call their grandparents any time they want. My 3 year old daughter loves doing the fun augmented reality apps.,Nice!
"Facebook - Portal Mini Smart Video Calling 8"" Display with Alexa - Black",1,5,23 Jun 2020,Nikki,"Love my portal, love that I can listen to music on it while cleaning and love that all my photos are on there and seeing memories of my children when they where babies!!! Great and affordable",Great for face to face talking
"Facebook - Portal Mini Smart Video Calling 8"" Display with Alexa - Black",1,5,23 Apr 2020,LMaR,"in the Covid age - we needed a quick, easy, and GOOD way to stay in touch. This little gem did the trick. I got one for my 4 y.o. grandson to stay in touch with me as well. Thank you FB for an inexpensive and super easy to use way to stay in touch.",Mom's 82 - and this is just perfect~
"Facebook - Portal Mini Smart Video Calling 8"" Display with Alexa - Black",1,5,23 Aug 2020,Djtobey,It has so much feature its way better than the echo you could see the person and it follow you I love it,Portal
"Facebook - Portal Mini Smart Video Calling 8"" Display with Alexa - Black",1,5,23 Jun 2020,CL76,Bought as a gift for Mother’s Day. It’s ease of use and quick set up made it an excellent gift.,Mother’s Day
"Facebook - Portal Mini Smart Video Calling 8"" Display with Alexa - Black",1,5,23 May 2020,George,Bought for the grand kids. They loved it ! We talk to each other every day so easy to use,Great product overall
